S NO,DISTRICT,BLOCK NAME,SCHOOL NAME,SCHOOL ADDRESS,PINCODE
23579,VIRUDHUNAG,Kariyapatti,PANCHAYAT UNION MIDDLE SCHOOL VARALOTTI,AGRAHARAM STREETVARALOTTI,626109
23580,VIRUDHUNAG,Kariyapatti,"PANCHAYAT UNION MIDDLE SCHOOL, A. THOTTIYANKULAM","A. THOTTIYANKULAM, KARIYAPATTI",626106
23581,VIRUDHUNAG,Kariyapatti,"PANCHAYAT UNION MIDDLE SCHOOL, ACHANKULAM","PUMS Achankulam,
Manthoppu, KARIYAPATTI,",626104
23582,VIRUDHUNAG,Kariyapatti,"PANCHAYAT UNION MIDDLE SCHOOL, ARASAKULAM",ARASAKULAM,626115
23583,VIRUDHUNAG,Kariyapatti,"PANCHAYAT UNION MIDDLE SCHOOL, KAMBIKUDI","kambikkudi post kariyapatti taluk , virudhunagar dist",626106
23584,VIRUDHUNAG,Kariyapatti,"PANCHAYAT UNION MIDDLE SCHOOL, KARIAPATTI","PUMS KARIYAPATTI
KARIYAPATTI
PVUIRMUSDkHeUelNaaAlaGgiAaRnallur,",626106
23585,VIRUDHUNAG,Kariyapatti,"PANCHAYAT UNION MIDDLE SCHOOL, KEELA ALAGIANALLUR","kariyapatti, VIRUDHUNAGAR.",626109
23586,VIRUDHUNAG,Kariyapatti,"PANCHAYAT UNION MIDDLE SCHOOL, MANGULAM UDAIKULAM",mangulam udaikulamkurandi,626115
23587,VIRUDHUNAG,Kariyapatti,"PANCHAYAT UNION MIDDLE SCHOOL, MEENATCHIPURAM",kambikudi postkariyapatti taluk,626106
23588,VIRUDHUNAG,Kariyapatti,"PANCHAYAT UNION MIDDLE SCHOOL, MELAKKALANKULAM","PANCHAYAT UNION MIDDLE SCHOOL,
MELAKKALANKULAM, Kariapatti Union, Virudhunagar District",626106
23589,VIRUDHUNAG,Kariyapatti,"PANCHAYAT UNION MIDDLE SCHOOL, MURUGAIYAPURAM","PUMS MURUGAIYAPURAM\K.Puthur (po) Thiruchuli (via), kariapatti (TK)",626129
23590,VIRUDHUNAG,Kariyapatti,"PANCHAYAT UNION MIDDLE SCHOOL, PAPPANAM",PappanamV. Nangoor,626106
23591,VIRUDHUNAG,Kariyapatti,"PANCHAYAT UNION MIDDLE SCHOOL, SURANOOR","PUMS SOORANUR \MUDUKKANKULAM-POST
KARIYAPATTI TALUK VIRUDHUNAGAR DIST",626106
23592,VIRUDHUNAG,Kariyapatti,"PANCHAYAT UNION MIDDLE SCHOOL, T. CHETTIKULAM",T. CHETTIKULAMKARIAPATTI,626106
23593,VIRUDHUNAG,Kariyapatti,"PANCHAYAT UNION MIDDLE SCHOOL, T. VEPPANKULAM","t.veppankulam, kariapatti",626106
23594,VIRUDHUNAG,Kariyapatti,"PANCHAYAT UNION MIDDLE SCHOOL, THOPPUR","PUMS THOPPUR
CHITHUMOONDRADAIPPU KARIYAPATTI",626106
23595,VIRUDHUNAG,Kariyapatti,"PANCHAYAT UNION MIDDLE SCHOOL, VAKKANANKUNDU",PUMS VAKKANANGUNDU KARIYAPATTI-626104,626104
23596,VIRUDHUNAG,Kariyapatti,"SARVA SEVA MATRICULATION SCHOOL, THONUGAL","SARVA SEVA MATRIC HS,
VAKKANANGUNDU  POST, KARIYAPATTI TALUK,",626104
23597,VIRUDHUNAG,Kariyapatti,"SRI SABARI NATIONAL SCHOOL, KARIAPATTI",kazhuvanacheri Road\Kariapatti,626106
23598,VIRUDHUNAG,Kariyapatti,ST.MARYS MATRICULATION SCHOOL KARIAPATTI,"ST.MARY'S MATRICULATION SCHOOL
Kallikudi Road, Kariapatti VIRUDHUNAGAR",626106
23599,VIRUDHUNAG,Kariyapatti,SUNDRAM MATRICULATION HR. SEC. SCHOOL KRISHNAPURAM AVIYUR,"Krishnapuram, Aviyur",626115
23600,VIRUDHUNAG,Narikudi,ASMA MATRICULATION HIGH SCHOOL VEERACHOLAN,"Asma Nagar, VarisaiyurVeeracholan",626612
23601,VIRUDHUNAG,Narikudi,GHS IRUNCHIRAI,"GOVT. HIGH SCHOOL, IRUNCHIRAITIRUCHULI TALUK, VIRUDHUNAGAR Dt.",626612
23602,VIRUDHUNAG,Narikudi,GHS MUTHURAMALINGAPURAM,MUTHURAMALINGAPURAMMANDALAMANICKAM POST,623605
23603,VIRUDHUNAG,Narikudi,GHS SIRUVANOOR,"siruvanoor  ,narikkudi via,  thiruchuli tk",626607
23604,VIRUDHUNAG,Narikudi,GHS ULUTHIMADAI,"GHS,Uluthimadai,Thiruculi Thalk, Virudhunagar
DTGHS&lt;Uluthimadai, Thirupasethi Via,Thiruculi Thalk, Virudhunagar",630610
23605,VIRUDHUNAG,Narikudi,GHSS ANAIKULAM,AnaikulamTiruchuli,626129
23606,VIRUDHUNAG,Narikudi,GHSS ILUPPAIYUR,ILUPPAIYURTRICHULI(Via),626129
23607,VIRUDHUNAG,Narikudi,GHSS KATTANOOR,kattanurkattanur,630610
23608,VIRUDHUNAG,Narikudi,GHSS ULAKUDI,MAIN ROADULAKUDI,626607
23609,VIRUDHUNAG,Narikudi,GHSS VEERACHOLAN,KAMUTHI ROADVEERACHOLAN,626612
23610,VIRUDHUNAG,Narikudi,"GHSS, PANAIYUR",PANAIYURPANAIYUR,626129
23611,VIRUDHUNAG,Narikudi,"GOVERNMENT HIGH SCHOOL , S.VALLAKULAM","S.VALLAKULAM PIDARISERI(POST) PARTHIBANOOR
VIA,
PVIILRLUADIYHAURNKAUGLAARMDISTRICT - 623608",623608
23612,VIRUDHUNAG,Narikudi,GOVERNMENT HIGH SCHOOL PILLAIYARKULAM,THIRUCHULI TK VIRUDHUNAGAR DT,630611
23613,VIRUDHUNAG,Narikudi,"GOVERNMENT HIGH SCHOOL, NALOOR",GHS NALUR THIRUCHULI TK,626607
23614,VIRUDHUNAG,Narikudi,GOVT HIGH SCHOOL PULVOIKARAI,pulvaikarai,630611
23615,VIRUDHUNAG,Narikudi,"KASTURBA GANDHI BALIKA VIDYALAYA, A.MUKKULAM",A.Mukkulam Thiruppuvanam (po),630611
23616,VIRUDHUNAG,Narikudi,"KASTURBA GANDHI BALIKA VIDYALAYA, ANAIKULAM",Trichuli TalukAnaikulam,626129
23617,VIRUDHUNAG,Narikudi,"KASTURBA GANDHI BALIKA VIDYALAYA, NARIKUDI","KK MANIKAM COLONYPETROL BACK SIDE, NARIKUDI",626607
23618,VIRUDHUNAG,Narikudi,"MARUTHUPANDIAR GOVERNMENT HR SEC SCHOOL, NARIKUDI","Maruthupandiyar Govt.Hr.Sec.School,NarikudiNarikudi",626607
23619,VIRUDHUNAG,Narikudi,P.K.M.I. GHSS A MUKKULAM,"PKMI GOVT HR SEC SCHOOL, A.MUKKULAM.",630611
23620,VIRUDHUNAG,Narikudi,"PANCHAYAT UNION MIDDLE SCHOOL, SULLANGUDI",NALLUKURUCHI PANCHAYAT VEERACHOLAN POST.,626612
23621,VIRUDHUNAG,Narikudi,"PANCHAYAT UNION MIDDLE SCHOOL, THIMMAPURAM","V NANGOOR POST
KARIYAPATTI TK VIRUDHUNAGAR DT",626106
23622,VIRUDHUNAG,Narikudi,PUMS  MARAIYUR,"panchayat union middle school, Maraiyur. panchayat union middle school, Maraiyur",626107
23623,VIRUDHUNAG,Narikudi,PUMS AMMANPATTI,AmmanpattiIlluppaiyur,623603
23624,VIRUDHUNAG,Narikudi,PUMS CHELLAIYAPURAM,panchayat union middle school chellaiyapuramNarikudi union anaikulam(P.O),626129
23625,VIRUDHUNAG,Narikudi,PUMS CHOTTAMURI,"P.U.M.S.CHOTTAMURI ,ESALI (P.O)",626607
23626,VIRUDHUNAG,Narikudi,PUMS KUMILANGULAM,Melakumilangulam\ESALI post,626607
23627,VIRUDHUNAG,Narikudi,PUMS MELAPARUTHIYUR,MelaparuthiyurVEERACHOLAN  PO,626612
23628,VIRUDHUNAG,Narikudi,PUMS MINAKULAM,"PUMS,MINAKULAMVEERACHOZHAN POST",626612
23629,VIRUDHUNAG,Narikudi,PUMS OTTANKULAM,"PUMSchool,ottankulam.Veeracholan (P O)",626612
23630,VIRUDHUNAG,Narikudi,PUMS RENGAIYANPATTI,RengaiyanpattyPanaiyur,626129
23631,VIRUDHUNAG,Narikudi,PUMS SEMPONNERUNCHI,"Panchayat Union Middle School, SemponnerunchiAnaikulam post",626129
23632,VIRUDHUNAG,Narikudi,PUMS THATCHANENDAL,"PUMS THATCHANENDAL,
VAYALSERI POST VIRUDHUNAGAR DISTRICT",630611
23633,VIRUDHUNAG,Narikudi,PUMS V ALANKULAM,"PUMS, V.ALANGULAMVEERACHOLAN (P.O), VIRUDHUNAGAR DISTRICT",626612
23634,VIRUDHUNAG,Narikudi,PUMS VARISAIYUR,NARIKUDI UNION\VEERACHOLAN (POST) THIRUCHULI TALUK,626612
23635,VIRUDHUNAG,Narikudi,PUMS VEERACHOLAN WEST,pumschool veeeracholan west veeracholan narikudi unionnarikudi virudhunagar district,626612
23636,VIRUDHUNAG,Narikudi,PUMS. KANAYAMARITHAN,"panchayat union middle school kanayamarithanNarikudi union
.cinnakannanoor (P.O)",630606
23637,VIRUDHUNAG,Narikudi,PUMS. MANOOR,ULAKUDI(PO)ARIKUDI BLOCK,626607
23638,VIRUDHUNAG,Narikudi,PUMS. MUTHANERI,MUTHANERIARIKKIUDI(PO),626607
23639,VIRUDHUNAG,Narikudi,PUMS. SETHURAYANENTHAL,Pums.sethurayanendalmariyur p.o,626607
23640,VIRUDHUNAG,Narikudi,PUMS. T.VELANKUDI,Pums t.velangudit.velangudi p.o,626612
23641,VIRUDHUNAG,Narikudi,PUMS. UDAYASERVAIKARANPATTI,"PANCHAYAT UNION MIDDLE SCHOOL, UDAIYASERVAKARANPATTI.",626177
23642,VIRUDHUNA GAR,Narikudi,PUPS. THIRUMANICKANENTHAL,"PUPS, THIRUMANIKKANENDAL",
23643,VIRUDHUNAG,Rajapalayam,"A.A.G.M HIGH SCHOOL, SANGARAPANDIAPURAM","south street, sankarapandiapuramrajapalayam taluk",626102
23644,VIRUDHUNAG,Rajapalayam,"A.K.D.D.MID SCH, RAJAPALAYAM",173\BIG BAZAAR STREET,626117
23645,VIRUDHUNAG,Rajapalayam,"ANANDA VIDYALAYA MATRICULATON HSS, RAJAPALAYAM","7/162, AYYANAR KOVIL SALAI,  RAJAPALAYAM",626117
23646,VIRUDHUNAG,Rajapalayam,ARUMUGAM PALANIGURU MODERN SCHOOL CHATRAPATTI,"360/4 NATHAMPATTI ROAD,CHATRAPATTI",626102
23647,VIRUDHUNAG,Rajapalayam,"CASA DI MIR MATRICULATON HSS, RAJAPALAYAM","MARUDHU NAGAR WEST, AYYANAR KOVIL ROAD, RAJAPALAYAM",626117
23648,VIRUDHUNAG,Rajapalayam,"CHINMAYA VID P.A.C.R MAT HSS, RAJAPALAYAM",TENKASI ROADRAJAPALAYAM,626117
23649,VIRUDHUNAG,Rajapalayam,"CHINMAYA VIDYALAYA SLR MAT HSS, RAJAPALAYAM","Lingammal Ramaraju Salai, Rotary NagarAyyanar Kovil Road, Rajapalayam",626117
23650,VIRUDHUNAG,Rajapalayam,"GANDHI MIDDLE SCHOOL, RAJAPALAYAM",GANDHI MIDDLE SCHOOL SANKARANKOVIL ROAD 3RD STREET,626117
23651,VIRUDHUNAG,Rajapalayam,"GHSS (B), CHATRAPATTI",RAJAPALAYAM-ALANGULAM ROADCHATRAPATTI,626102
23652,VIRUDHUNAG,Rajapalayam,"GHSS (G), CHATRAPATTI",GNANIYAR KOVIL STREETCHATRAPATTI,626102
23653,VIRUDHUNAG,Rajapalayam,"GHSS, CHOKKANATHANPUTHUR",CHOKKANATHANPUTHURRAJAPALAYAM,626121
23654,VIRUDHUNAG,Rajapalayam,"GHSS, KILAVIKULAM","Govt.hr.sec.school, Kilavikulam",626139
23655,VIRUDHUNAG,Rajapalayam,"GHSS, NALLAMANAICKERPATTI","NallammanikenpattiRajapalayam(Taluk), Virudhunagar",626102
23656,VIRUDHUNAG,Rajapalayam,"GOVERNMENT HIGH SCHOOL, AYANKOLLANKONDAN","1/1,NORTH STREET,AYANKOLLANKONDAN",626142
23657,VIRUDHUNAG,Rajapalayam,"GOVERNMENT HIGH SCHOOL, MOUNT ZION",Cholapuram south postRajapalayam Taluk,626139
23658,VIRUDHUNAG,Rajapalayam,"GOVERNMENT HIGH SCHOOL, SIVAKAMIPURAM",GHS SIVAKAMIPURAMGHS SIVAKAMIPURAM,626102
23659,VIRUDHUNAG,Rajapalayam,"GOVERNMENT HIGH SCHOOL, THIRUVALLUVAR NAGAR",GOVT HIGH SCHOOLTHIRUVALLUVARNAGAR,626117
23660,VIRUDHUNAG,Rajapalayam,"GOVERNMENT HIGHER SECONDARY SCHOOL, SIVALINGAPURAM","GHSS, SivalingapuramVadakari",626137
23661,VIRUDHUNAG,Rajapalayam,"GOVT A.D.W HR SEC SCHOOL, SUNDARARAJAPURAM","1,school streetsundhararajapuram",626142
23662,VIRUDHUNAG,Rajapalayam,"GOVT HR SEC SCHOOL, SEITHUR",PAPPANKINATRU ST - 33260612778SEITHUR,626121
23663,VIRUDHUNAG,Rajapalayam,"HARISH MATRIC HSS, SANGAMPATTI",Sangampattis.thirukothaiyapuram,626136
23664,VIRUDHUNAG,Rajapalayam,"K.H.N.U.P.KAMARAJ. HR SEC SCHOOL, KRISHNAPURAM","1/60, MARIAMMAN KOVIL STREETKRISHNAPURAM, RAJAPALAYAM (TK), VIRUDHUNAGAR (DT)",626142
23665,VIRUDHUNAG,Rajapalayam,"K.P.A. MID SCHOOL, RAJAPALAYAM","109,karuppananiyar kovil st-9715610871",626117
23666,VIRUDHUNAG,Rajapalayam,"KALVI THANTHAI KAMARAJAR VIDHYASALA MATRICULATION SCHOOL, RAJAPALAYAM","38, Madurai RoadRajapalayam",626117
23667,VIRUDHUNAG,Rajapalayam,"LIVING HOPE MATRIC SCHOOL, MOUNT ZION","MOUNT ZION, CHOLAPURAM SOUTH PO\RAJAPALAYAM",626139
23668,VIRUDHUNAG,Rajapalayam,"M.M.AVUDAI AMMAL MID SCH, RAJAPALAYAM","18A,chinnaiya raja street18A,chinnnaiya raja street",626117
23669,VIRUDHUNAG,Rajapalayam,"M.N.NADAR HIGH SCH, MELAVARAGUNARAMAPURAM",MELAVARAGUNARAMAPURAMPUTHUR (POST),626111
23670,VIRUDHUNAG,Rajapalayam,"MAHARISHI VID MAT HSS,RAJAPALAYAM",561 Chenbagathoppu RoadRajapalayam,626117
23671,VIRUDHUNAG,Rajapalayam,"MIRASU VEERAPPA NAIDU VIDYALAYA MATRICULATION SCHOOL, CHETTIYARPATTI","Muhavur Main Road, Chettiyarpatti.",626188
23672,VIRUDHUNAG,Rajapalayam,"MURUGAN MID SCH, RAJAPALAYAM","36,SANNATHI STREETAVRAMPATTI,RAJAPALAYAM",626117
23673,VIRUDHUNAG,Rajapalayam,N.A ANNAPPARAJA MEMORIAL H S S RAJAPALAYAM,"1111, Madurai Road,Rajapalayam-626117",626117
23674,VIRUDHUNAG,Rajapalayam,"N.A PAPPURAJA MEMORIAL MIDDLE SCHOOL, RAJAPALAYAM","152/153T P MILLS ROAD,COTTON MARKET",626117
23675,VIRUDHUNAG,Rajapalayam,"NADAR HR SEC SCHOOL, RAJAPALAYAM",RAILWAY FEEDER ROADRAJAPALAYAM,626117
23676,VIRUDHUNAG,Rajapalayam,"NADAR HSS, ZAMIN KOLLANKONDAN",1/150 Ration kadai streetZaminkollan kondan,626142
23677,VIRUDHUNAG,Rajapalayam,"NADAR MATRIC HSS, RAJAPALAYAM","7/151,Ayyanar Kovil RoadRajapalayam",626117
23678,VIRUDHUNAG,Rajapalayam,"NATARAJA MID SCH, RAJAPALAYAM","186B,Sankarapandiapuram streetRajapalayam",626117
23679,VIRUDHUNAG,Rajapalayam,"NAVA BHARATH MATRIC HIGHER SECONDARY SCHOOL, S.RAMALINGAPURAM",MUDHUKUDI TO SAMUSIGAPURAM ROADRANI MANGAMMAL SALAI,626102
23680,VIRUDHUNAG,Rajapalayam,"P.A.C.M HR SEC SCHOOL, RAJAPALAYAM","PSK NAGAR, RAJAPALAYAMK.R.NAGAR",626108
23681,VIRUDHUNAG,Rajapalayam,"P.A.C.R AMMANI AMMAL(G) HR SEC SCHOOL, RAJAPALAYAM",K R NAGAR POSTRAJAPALAYAM,626108
23682,VIRUDHUNAG,Rajapalayam,"P.P.S.A HINDU MIDDLE SCHOOL, RAJAPALAYAM",78Jawahar Maidanam Street,626117
23683,VIRUDHUNAG,Rajapalayam,P.U.M.S PANCHAMPATTI,pottalpatti p.opanchampatti,626111
23684,VIRUDHUNAG,Rajapalayam,"P.U.M.S, AMMAIYAPPAPURAM","PUMS,AMMAIYAPPAPURAMCHETTIYARPATTI POST",626122
23685,VIRUDHUNAG,Rajapalayam,"P.U.M.S, DEVADANAM",kumaran koil streetdevathanam,626121
23686,VIRUDHUNAG,Rajapalayam,"P.U.M.S, GOPALAPURAM","PANCHAYAT UNION MIDDLE SCHOOL, GOPALAPURAM(POST)       Pin Code-626136",626136
23687,VIRUDHUNAG,Rajapalayam,"P.U.M.S, SOUTH VENGANALLUR","PU MIDDLE SCHOOL, SOUTHVENGANALLUR, RAJAPALAYAM",626142
23688,VIRUDHUNAG,Rajapalayam,"P.U.M.S,ASILAPURAM",Cholapuram postRajapalayam Taluk,626139
23689,VIRUDHUNAG,Rajapalayam,"PALANIAPPA HSS, CHOLAPURAM",cholapuram south postRajapalayam,626139
23690,VIRUDHUNAG,Rajapalayam,PERUNTHALAIVAR KAMARAJAR HSS MEENATICHIYAPURAM,"3/157,main roadmeeenakshipuram",626111
23691,VIRUDHUNAG,Rajapalayam,"PERUNTHALAIVAR KAMARAJAR MATRICULATON HR SEC SCHOOL, THALAVAIPURAM","1/53 A10,Kamarajar nagar streetThalavaipuram",626188
23692,VIRUDHUNAG,Rajapalayam,"R.V THEVAR M.G HR SEC SCHOOL, CHOLAPURAM","THIRU R.V THEVAR MEMORIAL GIRLS HR.SEC.SCHOOL, CHOLAPURAM(SOUTH)",616139
23693,VIRUDHUNAG,Rajapalayam,"RC HR SEC SCHOOL, MEENACHIPURAM","MEENAKSHIPURAM,MUHAVUR(VIA),RAJAPALAYAM(TK
),VIRDHUNAGAR(DIST).MEENAKSHIPURAM,MUHAVUR( VIA),RAJAPALAYAM(TK),VIRDHUNAGAR(DIST).",626111
23694,VIRUDHUNAG,Rajapalayam,"S.S.H.N.HR.SEC.SCHOOL, MUHAVUR","S S HINDU NADAR HR SEC SCHOOL, MUHAVURS S HINDU NADAR HR SEC SCHOOL, MUHAVUR",626111
23695,VIRUDHUNAG,Rajapalayam,"SAKKA RAJA KOTTAI MID SCH, RAJAPALAYAM",35 mathang kovil streetRajapalayam,626117
23696,VIRUDHUNAG,Rajapalayam,"SIVAKAMI HIGH SCHOOL, RAJAPALAYAM","71, Kamatchi Aamman Kovil St, Rajapalayam",626117
23697,VIRUDHUNAG,Rajapalayam,"SIVANTHI ATHITHANAR HIGH SCHOOL, KOVILUR","main road.Koviloormani road,kOVILOOR",626121
23698,VIRUDHUNAG,Rajapalayam,"SRI ANNAI VIDYALAYA MATRICULATION SCHOOL, CHETTIYARPATTI",PUTHUR MAIN ROAD CHETTIYARPATTI,626122
23699,VIRUDHUNAG,Rajapalayam,"SRI KRISHNASAMY MID.S, RAJAPALAYAM","49, SEVALPATTI SOUTH STREETRAJAPALAYAM",626117
23700,VIRUDHUNAG,Rajapalayam,"SRI P.S.KUMARASAMY RAJA MEMORIAL GIRLS HIGH SCHOOL, RAJAPALAYAM",PS KUMARASAMYRAJA MEMORIAL HIGH SCHOOL SUBBARAJAMADAM STREET RAJAPALAYAM,626117
23701,VIRUDHUNAG,Rajapalayam,"SRI RAMANA ACADEMY SENIOR SECONDARY CBSE, RAJAPALAYAM","RAMANA NAGARK.R.NAGAR POST, RAJAPALAYAM",626108
23702,VIRUDHUNAG,Rajapalayam,"SRI RAMANA VIDYALAYA MONTESSORI MATRIC HSS, RAJAPALAYAM","RAMANA NAGAR, K.R.NAGAR - PORAJAPALAYAM",626108
23703,VIRUDHUNAG,Rajapalayam,"SRI RAO BAHADUR A.K.D.DHARMARAJA BOYS HR SEC SCHOOL, RAJAPALAYAM","35/45, MADASAMY KOVIL STREETRAJAPALAYAM",626117
23704,VIRUDHUNAG,Rajapalayam,"SRI RAO BAHADUR A.K.D.DHARMARAJA GIRLS HR.SEC.SCHOOL, RAJAPALAYAM","152/311, RAILWAY FEEDER ROADRAJAPALAYAM",626117
23705,VIRUDHUNAG,Rajapalayam,"SSG(B)HSS, RAJAPALAYAM","SS GOVT (B) HSS, RAILWAY FEEDER ROAD, RAJAPALAYAAM",626117
23706,VIRUDHUNAG,Rajapalayam,"SSG(G)HSS,RAJAPALAYAM",TENKASI ROADRAJAPALAYAM,626117
23707,VIRUDHUNAG,Rajapalayam,"ST ANTONYS MATRIC SCHOOL, CHETTIYARPATTI","29-P5,PARAI STREETCHETTIYARPATTI,THALAVAIPURAM",626122
23708,VIRUDHUNAG,Rajapalayam,"ST JOSEPH MID SCH, SUNDARANATCHIYARPURAM",sundaranachiarpuramRajapalayam Taluk,626142
23709,VIRUDHUNAG,Rajapalayam,ST.JOSEPH INTERNATIONAL SCHOOL RAJAPALAYAM,"Mother Virginammal Garden,RS.No:570, South Venganallur VillageTirunelveli Road, Rajapalayam, Virudhunagar",626117
23710,VIRUDHUNAG,Rajapalayam,"T.D.T.A.M.S, POTTALPATTI",Ramakrishnapuram RoadSrivilliputhur,626125
23711,VIRUDHUNAG,Rajapalayam,"T.N.P.M.M.A.N (G).H.S.S, THALAVAIPURAM","75A/1,RAJAPALAYAM MAIN ROAD THALAVAIPURAM",626188
23712,VIRUDHUNAG,Rajapalayam,"T.N.P.M.MARIMUTHU NADAR HR.SEC.SCHOOL, THALAVAIPURAM","73 J,Rajapalayam main roadDhalavoipuram",626188
23713,VIRUDHUNAG,Rajapalayam,"VANIGA VYSIAR HIGH SCHOOL, RAJAPALAYAM","251, KOORAI PILLAIYAR KOVIL STREET ,
RAJAPALAYAM251 KOORAI PILLAIYAR KOVIL STREET , RAJAPALAYAM",626117
23714,VIRUDHUNAG,Rajapalayam,"VIII WARD MUNICIPAL MID SCH, RAJAPALAYAM",SEETHAKATHI STREETSAMMANTHAPURAM,626117
23715,VIRUDHUNAG,Sattur,"AYIRA VYSIA BOYS HR SEC SCHOOL, SATTUR","66,PERUMAL KOVIL SOUTH CAR STREET,\SATTUR",626203
23716,VIRUDHUNAG,Sattur,"DR. RADHAKRISHNAN MATRIC HIGHER SECONDARY SCHOOL, SATTUR","126,Railway Feeder Road, SATTUR",626203
23717,VIRUDHUNAG,Sattur,"GOVERNMENT HIGH SCHOOL, K.METTUPATTI","GOVT HIGH SCHOOL
K METTUPATTI, SATTUR  TALUK.",626202
23718,VIRUDHUNAG,Sattur,"GOVERNMENT HIGH SCHOOL, KANMAISURANGUDI",kanmaisurangudio mettupatti (p.o),626203
23719,VIRUDHUNAG,Sattur,"GOVERNMENT HIGH SCHOOL, MELAPUDHUR","GHS,MELAPUDHUR,PUTHUSURENGUDI(post),SATTUR(TK
),VIRUDHUNAGAR GHS,MELAPUDHUR,PUTHUSURENGUDI(post),SATTUR(TK",626203
23720,VIRUDHUNAG,Sattur,"GOVERNMENT HIGH SCHOOL, MUTHALNAICKANPATTI",MUTHALNAICKANPATTI\SATTUR,626203
23721,VIRUDHUNAG,Sattur,"GOVERNMENT HIGH SCHOOL, N.G.O.COLONY",chennai to kaniyakumari roadpillaiyar temple,626203
23722,VIRUDHUNAG,Sattur,"GOVERNMENT HIGH SCHOOL, NATHATHUPATTI",GOVT HIGH SCHOOLNATHATHUPATTI,626202
23723,VIRUDHUNAG,Sattur,"GOVERNMENT HIGH SCHOOL, PERIYA KOLLAPATTI","GOVT HIGH SCHOOL ,PERIYAKOLLAPATTI",626203
23724,VIRUDHUNAG,Sattur,"GOVERNMENT HIGH SCHOOL, POTHIREDDIPATTI","Pothireddipattii , sattur taluk.",626203
23725,VIRUDHUNAG,Sattur,"GOVERNMENT HIGH SCHOOL, PUDHUSURANGUDI","surangudi post,sattur taluk , Virudhunagar dist",626203
23726,VIRUDHUNAG,Sattur,"GOVERNMENT HIGH SCHOOL, THERKUR","GHS THERKUR, SATTUR",626203
23727,VIRUDHUNAG,Sattur,"GOVERNMENT HIGH SCHOOL, THOTTILOVANPATTI","GOVT HIGH SCHOOL,THOTTILOVANPATTI,NALLI (P),SATTUR TALUK,VIRUDHUNAGAR -626205",626205
23728,VIRUDHUNAG,Sattur,"GOVERNMENT HIGHER SECONDARY SCHOOL, CHINNAKKAMANPATTI",ChinnakkamanpattiSattur,626189
23729,VIRUDHUNAG,Sattur,"GOVERNMENT HIGHER SECONDARY SCHOOL, MUTHARPATTI",GHSS MUTHARPATTIKOSUKUNDU PO,626202
23730,VIRUDHUNAG,Sattur,"GOVERNMENT HIGHER SECONDARY SCHOOL, N.SUBBAIYAPURAM","GHSS, N.SUBBIAHPURAMSATTUR(TK)",626205
23731,VIRUDHUNAG,Sattur,"GOVERNMENT HIGHER SECONDARY SCHOOL, NALLI",GHSS  NALLI - 33261108204NALLI,626205
23732,VIRUDHUNAG,Sattur,"GOVERNMENT HIGHER SECONDARY SCHOOL, O.METTUPATTI","GHSS, O.METTUPATTI, SATTUR BLOCK, VIRUDHUNAGAR DIST.",626203
23733,VIRUDHUNAG,Sattur,"GOVERNMENT HIGHER SECONDARY SCHOOL, PADANTHAL","PADANTHALSATTUR - TALUK, VIRUDHUNAGAR",626203
23734,VIRUDHUNAG,Sattur,"GOVERNMENT HIGHER SECONDARY SCHOOL, UPPATHUR",NORTH STREET\UPPATHUR,626205
23735,VIRUDHUNAG,Sattur,"GVJ INTERNATIONAL SCHOOL.,N.VENKADESWARAPURAM",No. 6 Uppathur VilakkuSattur Taluk,626205
23736,VIRUDHUNAG,Sattur,"HINDU MIDDLE SCHOOL, VENKATACHALAPURAM",HMS VENKADACHALAPURAM SATTURVIRUDHUNAGAR,626203
23737,VIRUDHUNAG,Sattur,"KAMMA MAHAJANA TRUST GIRLS HIGHER SECONDARY SCHOOL, VENKATACHALAPURAM",VENKATACHALAPURAMSATTUR,626203
23738,VIRUDHUNAG,Sattur,"KCAD CHIDAMBARAM GNANAGIRI
MATRICULATION HIGHER SECONDARY SCHOOL, SATTUR","74,Ethel Harvey Road,sattur",626203
23739,VIRUDHUNAG,Sattur,"LALITHA LAL BAHADUR SHASTRI PUBLIC SCHOOL, SADAYAMPATTI","N.H-7 EAST SERVICE ROAD, RAJIV GANDHI NAGARSADAYAMPATTI, SATTUR",626203
23740,VIRUDHUNAG,Sattur,LITTLE BUDS UNIQUE MATRICULATION SCHOOL,,
23741,VIRUDHUNAG,Sattur,"M.M VIDYASHRAM, SATTUR","NH 44, 3/465, R.K.NAGAR THOTTILOVANPATTINALLI POST , SATTUR TALUK,VIRUDHUNAGAR DISTRICT",626205
23742,VIRUDHUNAG,Sattur,"MPL. HIGHER SECONDARY SCHOOL, MELAGANDHI NAGAR","PERIYAR NAGAR, VIRUDHUNAGAR",626203
23743,VIRUDHUNAG,Sattur,"MPL. MIDDLE SCHOOL, SATTUR","MUNICIPAL MIDDLE SCHOOL
VELLAIKARAI SALAI SATTUR",626203
23744,VIRUDHUNAG,Sattur,"OXFORD MATRICULATION SCHOOL, SATTUR","1-1A,1B VELLAKARI ROAD,4 TH STREET",626203
23745,VIRUDHUNAG,Sattur,"PANCHAYAT UNION MIDDLE SCHOOL, A.RAMALINGAPURAM",PUMS A RAMALINGAPURAMA. RAMALINGAPURAM PO,626203
23746,VIRUDHUNAG,Sattur,"PANCHAYAT UNION MIDDLE SCHOOL, AYAN CHATRAPATTI",pum schoolchatrapatti,626204
23747,VIRUDHUNAG,Sattur,"PANCHAYAT UNION MIDDLE SCHOOL, CHINDAPALLI",MAIN ROAD CHINDAPALLI,626203
23748,VIRUDHUNAG,Sattur,"PANCHAYAT UNION MIDDLE SCHOOL, IRUKKANKUDI","IRUKKANKUDISATTUR,VIRUTHUNAGAR",626202
23749,VIRUDHUNAG,Sattur,"PANCHAYAT UNION MIDDLE SCHOOL, K.CHOKKALINGAPURAM","K.CHOCKALINGAPURAM, SATTUR- TKVIRUDHUNAGAR DT",626202
23750,VIRUDHUNAG,Sattur,"PANCHAYAT UNION MIDDLE SCHOOL, METTAMALAI",MIDDLE STREET         METTAMALAI  SATTUR VNR DIST,626203
23751,VIRUDHUNAG,Sattur,"PANCHAYAT UNION MIDDLE SCHOOL, NAMBIRAJAPURAM","PANCHAYAT UNION MIDDLE SCHOOL,
NAMBIRAJAPURAM AMIRPALAYAM, SATTUR (TK)",626203
23752,VIRUDHUNAG,Sattur,"PANCHAYAT UNION MIDDLE SCHOOL, SIRUKULAM",SIRUKULAMSATTUR TALUK,626202
23753,VIRUDHUNAG,Sattur,"PANCHAYAT UNION MIDDLE SCHOOL, SIVANANAINTHAPURAM","PANCHAYAT UNION MIDDLE SCHOOL, SIVANANAINTHAPURAM, SATTUR TK - 626205",626203
23754,VIRUDHUNAG,Sattur,"S. GURUSAMY NADAR KRISHNAMMAL MEMORIAL MIDDLE SCHOOL, SATTUR","31 -A,  KATTUPUDHU STREET, SATTUR, VNR DIST.",626203
23755,VIRUDHUNAG,Sattur,"S.H.N. EDWARD HIGHER SECONDARY SCHOOL, SATTUR","388,MAINROAD,SATTUR388,MAINROAD,SATTUR",626203
23756,VIRUDHUNAG,Sattur,"S.H.N. EDWARD MIDDLE SCHOOL, SATTUR","470, OLD TRUNK ROADSATTUR",626203
23757,VIRUDHUNAG,Sattur,"S.H.N. ETHEL HARVEY GIRLS HIGHER SECONDARY SCHOOL, SATTUR",RAILWAY FEEDER ROADSATTUR,626203
23758,VIRUDHUNAG,Sattur,"S.R.GOVERNMENT HIGHER SECONDARY SCHOOL, N.METTUPATTI","N.Mettupatti, Nenmeni(PO), Sattur(TK),Virudhunagar Dist",626202
23759,VIRUDHUNA GAR,Sattur,SATTUR KMT VIDHYALAYA,"KMT VIDHYALAYA CBSE, Venkatachalapuram, Sattur, Tamil Nadu",
23760,VIRUDHUNAG,Sattur,"SOUTHSIDE INTERNATIONAL SCHOOL, METTAMALAI","2/557-D,KRR NAGAR, METTAMALAI, SATTUR TK,
VIRUDHUNAGAR DISTRICT2/557-D,KRR NAGAR, METTAMALAI, SATTUR TK, VIRUDHUNAGAR DISTRICT",626203
23761,VIRUDHUNAG,Sattur,"SOUTHSIDE MATRICULATION HIGHER SECONDARY SCHOOL, METTAMALAI","2/557 - A, KRR NAGARMETTAMALAI",626203
23762,VIRUDHUNAG,Sattur,"SRI VENKATESWARA MATRICULATION SCHOOL, SATTUR",498 -A PERIYAR NAGARSATTUR,626203
23763,VIRUDHUNAG,Sattur,"SRIKARA VIDHYA MANDHIR SENIOR SECONDARY SCHOOL, SIVANANAINTHAPURAM","Shrikarra Nagar, Sivananainthapuram, N.HAvalnatham PO, Sattur Taluk, Virudhunagar District",628502
23764,VIRUDHUNAG,Sattur,"ST. STANISLAUS HIGHER SECONDARY SCHOOL, SATTUR",45 mannarkottai road sattur 45 mannarkottai road sattur,626203
23765,VIRUDHUNAG,Sattur,"ST. THERESA HIGHER SECONDARY SCHOOL, SATTUR",OLD PADNATHAL ROAD - SATTUR,626203
23766,VIRUDHUNAG,Sattur,"T.E.L.C. MIDDLE SCHOOL, SATTUR",NEHRU II STREETSATTUR,626203
23767,VIRUDHUNAG,Sivakasi,"A  U  MUNICIPAL HIGHER SECONDARY SCHOOL, SIVAKASI",MANI NAGARSIVAKASI,626123
23768,VIRUDHUNAG,Sivakasi,"AAA INTERNATIONAL SCHOOL.,THIRUTHANGAL","828A,S.N.Puram RoadThiruthangal",626130
23769,VIRUDHUNAG,Sivakasi,"ANITHA MATRICULATION HSS ,KONGALAPURAM",VEMBAKOTTAI MAIN ROAD\SITHURAJAPURAM,626189
23770,VIRUDHUNAG,Sivakasi,"ANNAVI THOTTAM MUNICIPAL GIRLS HIGH SCHOOL, SIVAKASI",MANI NAGARSIVAKASI,626123
23771,VIRUDHUNAG,Sivakasi,"ARASAN GANESAN MATRICULATION HR SEC SCHOOL, SIVAKASI",18 CHAIRMAN A.SHUNMUGAM  ROADSIVAKASI,626123
23772,VIRUDHUNAG,Sivakasi,"AVM MARIMUTHU NADAR HR SEC SCHOOL, VILAMPATTI","1/132, ALANGULAM MAIN ROAD",626124
23773,VIRUDHUNAG,Sivakasi,"AYYAVU MATRICULATION HIGH SCHOOL, VADAPATTI","Vadapatti, M.Pudupatti (post), Sivakasi (Taluk), Virudhunagar",626103
23774,VIRUDHUNAG,Sivakasi,"C.M.S. MIDDLE SCHOOL, SATCHIYAPURAM",SATCHIYAPURAM\SIVAKASI,626124
23775,VIRUDHUNAG,Sivakasi,"CORONATION GIRLS HIGHER SECONDARY SCHOOL, SIVAKASI","66-A, GNANAGIRIROAD , SIVAKASI",626189
23776,VIRUDHUNAG,Sivakasi,"CSI HIGH SCHOOL & VTC FOR THE DEAF, SATCHIYAPURAM","Elwin CentreSatchiyapuram, Sivakasi West",626124
23777,VIRUDHUNAG,Sivakasi,"CSI M&R SCHOOL, SATCHIAPURAM",Satchiyapuram WestSatchiyapuram,626124
23778,VIRUDHUNAG,Sivakasi,G.H.S PUDUKOTTAI,GHS PUDUKOTTAIERICHANATHAM(VIA),626103
23779,VIRUDHUNAG,Sivakasi,"G.H.S.,ALAMARATHUPATTI",SAKKAMMAL COLONYALAMARATHUPATTI,626130
23780,VIRUDHUNAG,Sivakasi,"G.H.S.,ANAIKUTTAM","GHS ANAIKUTTAMSIVAKASI TALUK, VIRUDHUNAGAR DISTRICT",626130
23781,VIRUDHUNAG,Sivakasi,"G.H.S.,ANUPPANKULAM",AnuppankulamSivakasi (TK),626189
23782,VIRUDHUNAG,Sivakasi,"G.H.S.,KOPPAIYANAICKENPATTI",KOPAIYANAICKENPATTIMALLIPUDUR PO SIVAKASI  via,626141
23783,VIRUDHUNAG,Sivakasi,"G.H.S.,M.PUDHUPATTI","M.PUDHUPATTI, SIVAKASI TALUK,VIRUDHUNAGAR DISTRICT",626130
23784,VIRUDHUNAG,Sivakasi,"G.H.S.,SATHYANAGAR","GHS,SATHYANAGARTHIRUTHANGAL",626130
23785,VIRUDHUNAG,Sivakasi,"G.H.S.,SUKKIRAVARPATTI",SUKKIRAVARPATTISUKKIRAVARPATTI,626130
23786,VIRUDHUNAG,Sivakasi,"G.H.S.S, MEENAMPATTI","GOVT HR SEC SCHOOL,MEENAMPATTI
VADAKKOORSivakasi",626189
23787,VIRUDHUNAG,Sivakasi,"G.H.S.S, PALLAPATTI","GOVERNMENT HIGHER SECONDARY  SCHOOL,
PALLAPATTI, NEAR KALIAMMAN KOVIL,THIRUTHANGAL ,PO,SIVAKASI",626130
23788,VIRUDHUNAG,Sivakasi,"G.H.S.S,VISWANATHAM",viswanatham,626189
23789,VIRUDHUNAG,Sivakasi,"G.H.S.S., MANGALAM",GOVT HR SEC SCHOOL MANGALAMSIVAKASI,626138
23790,VIRUDHUNAG,Sivakasi,"G.H.S.S., NARANAPURAM",GOVERNMENT HIGHER SECONDARY SCHOOLNARANAPURAM,626189
23791,VIRUDHUNAG,Sivakasi,"G.H.S.S.,BOOVANATHAPURAM",THE HEADMASTERGHSS BOOVANATHAPURAM,626124
23792,VIRUDHUNAG,Sivakasi,"G.H.S.S.,NADAIYANERI",MAIN ROADNADAYANERI,626130
23793,VIRUDHUNAG,Sivakasi,"G.H.S.S.,RESERVE LINE SIVAKASI","RESERVELINE, GANDHI NAGAR,SIVAKASI WESTWEST,626124 - 33260910573RESERVELINE SIVAKASI",626124
23794,VIRUDHUNAG,Sivakasi,GHS VADAMALAPURAM,GOVT HIGH SCHOOL VADAMALAPURAMTHIRUTHANGAL VIA,626130
23795,VIRUDHUNAG,Sivakasi,"GLORY MATRICULATION HR SEC SCHOOL, SIVAKASI","828,S.N.Puram Road",626130
23796,VIRUDHUNAG,Sivakasi,"GOOD SHEPHERD MATRICULATION HIGH SCHOOL, SIVAKASI","3/141 , Enjar Cross ,   Sivakasi Virudhunagar (Dist)",626124
23797,VIRUDHUNAG,Sivakasi,GOOD SHEPHERD MATRICULATION SCHOOL,,
23798,VIRUDHUNAG,Sivakasi,"GOVT GIRLS HR SEC SCHOOL, THIRUTHANGAL",virudhunagar main roadthiruthangal,626130
23799,VIRUDHUNAG,Sivakasi,GOVT HIGH SCHOOL ANAIYUR,GHS ANAIYUR SIVAKASI WEST,626124
23800,VIRUDHUNAG,Sivakasi,"GOVT HIGH SCHOOL, PERAPATTI",Government High SchoolPerapatti,626189
23801,VIRUDHUNAG,Sivakasi,"GOVT HIGHER SECONDARY SCHOOL, MARANERI",maranerimaraneri,626124
23802,VIRUDHUNAG,Sivakasi,"HINDU THEVAMAR HIGHER SECONDARY SCHOOL, SIVAKASI","28,QUAITH MILATH STREETSIVAKASI -",626123
23803,VIRUDHUNAG,Sivakasi,"K.KAMARAJAR MATRICULATION HR SEC SCHOOL, SIVAKASI",5/231 Sattur RoadEB Sub Station,626189
