S NO,DISTRICT,BLOCK NAME,SCHOOL NAME,SCHOOL ADDRESS,PINCODE
23804,VIRUDHUNAG,Sivakasi,"KALAIMAGAL HIGHER SECONDARY SCHOOL, THIRUTHANGAL","91 -A , NADAR NANDHAVANA STREET, THIRUTHANGALTHIRUTHANGAL",626130
23805,VIRUDHUNAG,Sivakasi,"KAMAK HIGHER SECONDARY SCHOOL, KRISHNAPERI","NEAR KALIYAMMAN KOVIL STREET, KRISHNAPERIT.MANAGASERI POST, SIVAKASI TALUK",626141
23806,VIRUDHUNAG,Sivakasi,"KAMMA KALVI SANGA HR SEC SCHOOL, SITHURAJAPURAM","1/418A, MELURSITHURAJAPURAM",626189
23807,VIRUDHUNAG,Sivakasi,"KMKA MATRICULATION HIGHER SECONDARY SCHOOL, THIRUTHANGAL",52 NADAR NANDHAVANA STREET\ THIRUTHANGAL,626130
23808,VIRUDHUNAG,Sivakasi,"KPATDR SIVAKASI JAYCEES MATRICULATION HR SEC SCHOOL, SIVAKASI","Anaiyur Post, Vilampatti Road - Ward-2Anaiyur Post, Vilampatti Road - Ward-2",626124
23809,VIRUDHUNAG,Sivakasi,"LORD P C A A  LIONS MATRICULATION HR SEC SCHOOL, SIVAKASI","9/210A, Lions Nagar\Reserveline",626123
23810,VIRUDHUNAG,Sivakasi,"LVR MATRICULATION SCHOOL,SENGAMALANACHIARPURAM",3/2007S.N Puram,626130
23811,VIRUDHUNAG,Sivakasi,"MEADOWS HIGHER SECONDARY SCHOOL, KALAIYARKURICHI",636/1A SANARPATTI ROAD,626130
23812,VIRUDHUNAG,Sivakasi,"MOUNT LITERA ZEE SCHOOL., SIVAKASI","749,VirudhuNagar, Sivakasi main RDThiruthangal,Sivakasi,TamilNadu",626130
23813,VIRUDHUNAG,Sivakasi,"MUNICIPAL HR SEC SCHOOL., AMMANKOVILPATTI",MUNICIPAL HR SEC SCHOOL. AMMANKOVILPATTI.SIVAKASI.,626189
23814,VIRUDHUNAG,Sivakasi,"MUSLIM HIGHER SECONDARY SCHOOL, SIVAKASI","Muslim Higher Secondary School, SIVAKASI",626123
23815,VIRUDHUNAG,Sivakasi,"MUTHUMARI MATRICULATION HR SEC SCHOOL, THIRUTHANGAL","40/1A, Sukkiravar patti RoadThiruthangal",626130
23816,VIRUDHUNAG,Sivakasi,"N.P.A.S.P.R.RATHNAVILAS HR SEC SCHOOL, SIVAKASI","84/2,RAILWAY COLONYSIVAKASI",626123
23817,VIRUDHUNAG,Sivakasi,"N.P.S.S.R.K. ROTARY MATRICULATION HIGHER SECONDARY SCHOOL, VISWANATHAM","VISWANATHAM,SIVAKASI.",626189
23818,VIRUDHUNAG,Sivakasi,P.U.M.S AYYANARPURAM COLONY,AYYANARPURAMCOLONYSIVAKASI,626123
23819,VIRUDHUNAG,Sivakasi,P.U.M.S GOUNDAMPATTI,"P.U.M.SCHOOLKOUNDAMPATTI,VELLUR [P.O]AMATHUR[VIA]",626005
23820,VIRUDHUNAG,Sivakasi,P.U.M.S JAMEENSALVARPATTI,P.U.MIDDLE SCHOOL\JAMEEN SALVARPATTI,626189
23821,VIRUDHUNAG,Sivakasi,P.U.M.S KUMILANKULAM,"PUMS,KUMILANKULAM,ERISANATHAM POST,SIVAKASI TK",626103
23822,VIRUDHUNAG,Sivakasi,P.U.M.S KUPPANAPURAM,kuppanapuramkrishnan koil via,626138
23823,VIRUDHUNAG,Sivakasi,P.U.M.S PETHULUPATTI,Main Road\Pethulupatti,626189
23824,VIRUDHUNAG,Sivakasi,"P.U.M.S, CHITHAMANAICKENPATTI",chithamanayakkanpattipudukottai(po),626103
23825,VIRUDHUNAG,Sivakasi,P.U.M.S. SANARPATTI,"P.U.middle school, sanarpattiM.PUDHUPATTI (P.O)",626130
23826,VIRUDHUNAG,Sivakasi,P.U.M.S.MATHIYASENAI,"PANCHAYAT   UNION   MIDDLE SCHOOL ,
MATHIYASENAI. 626005.
MEPCO  (POST) . SIVAKASI   UNION.",626005
23827,VIRUDHUNAG,Sivakasi,P.U.M.S.SENGAMALAMNATCHIYARPURAM,"pums,s npurampums,s npuram",626130
23828,VIRUDHUNAG,Sivakasi,P.U.M.S.URAMPATTI,PUMS URAMPATTIMARANERI SIVAKASI,626124
23829,VIRUDHUNAG,Sivakasi,P.U.M.S.VADAPATTI,"pums,vadapati,mellur,vadapattipums,vadapati,mellur,vadapatti",626124
23830,VIRUDHUNAG,Sivakasi,P.U.M.S.VELLAIYAPURAM,"P.U. MIDDLE SCHOOL, VELLAIYAPURAMSENGAMALANATCHIYAPURAM PO",626130
23831,VIRUDHUNAG,Sivakasi,"PANCHAYAT UNION MIDDLE SCHOOL, RENGAPALAYAM",Main RoadRengapalayam,626138
23832,VIRUDHUNAG,Sivakasi,"R.S.R INTERNATIONAL SCHOOL, SIVAKASI","NPSN Arumugam Road,
Sivakasi, Virudhunagar Tamilnadu, India.",626123
23833,VIRUDHUNAG,Sivakasi,"S N (JUNIOR) G.H.S.,VELLUR",EAST STREETVELLUR,626005
23834,VIRUDHUNAG,Sivakasi,"S.A.V. SALA MIDDLE SCHOOL, MUTHALIPATTI",2/70 AMMAN STREET\MUTHALIPATTI,626189
23835,VIRUDHUNAG,Sivakasi,"S.C.M.S.GIRLS HIGHER SECONDARY SCHOOL, SATCHIYAPURAM","OPP TO TALUK OFFICESATCHIYAPURAM, SIVAKASI WEST",626124
23836,VIRUDHUNAG,Sivakasi,"S.D.A. MATRICULATION HIGH SCHOOL, SIVAKASI","2/179 A , NARANAPURAM ROAD, SIVAKASI - 626 189",626189
23837,VIRUDHUNAG,Sivakasi,"S.H.N. GIRLS HIGHER SECONDARY SCHOOL, SIVAKASI","1,CHAIRMAN N.P.S.N ARUMUGAM NADAR ROADSIVAKASI",626123
23838,VIRUDHUNAG,Sivakasi,"S.N.G. GIRLS HIGHER SECONDARY SCHOOL., THIRUTHANGAL","90,Nadar Nanthavanam Street,Thiruthangal",626130
23839,VIRUDHUNAG,Sivakasi,"S.N.M.F. MATRICULATION HR SEC SCHOOL, SIVAKASI",Sattur Road Paraipatti,626189
23840,VIRUDHUNAG,Sivakasi,"S.R.,G.H.S.S.,THIRUTHANGAL",thiruthangal,626130
23841,VIRUDHUNAG,Sivakasi,"SAFIRE MATRICULATION HIGHER SECONDARY SCHOOL,SIVAKASI- THAYILPATTI ROAD","OLD THAYILPATTI ROAD, VISWANATHAM, SIVAKASI.KAVITHA NAGAR,SIVAKASI.",626123
23842,VIRUDHUNAG,Sivakasi,"SARVASEVA  MATRICULATION SCHOOL,ERICHANATHAM","3/305-c sevalaya,alagapuri road erichanatham sivakasi tk
virudhunagar dist3/305-c sevalaya,alagapuri road erichanatham sivakasi tk virudhunagar dist",626103
23843,VIRUDHUNAG,Sivakasi,"SHNV MATRIC HSS,SIVAKASI","10A,SHANMUGAM  ROADSIVAKASI",626123
23844,VIRUDHUNAG,Sivakasi,SIDHARAJAA INTERNATIONAL SCHOOL,,
23845,VIRUDHUNAG,Sivakasi,"SIVAKASI HINDU NADAR VICTORIA HR SEC SCHOOL, SIVAKASI","NO 10, CHAIRMAN SHANMUGAM ROAD\SIVAKASI",626123
23846,VIRUDHUNAG,Sivakasi,"SIVAKASI HINDU NADAR VICTORIYA MIDDLE SCHOOL, SIVAKASI",10 A CHAIRMAN SHANMUGAN ROAD10 A CHAIRMAN SHANMUGAM ROAD,626123
23847,VIRUDHUNAG,Sivakasi,"SIVAKASI HINDUNADARS GIRLS MIDDLE SCHOOL, SIVAKASI","1,Arumugam Road,\SIVAKASI",626323
23848,VIRUDHUNAG,Sivakasi,"SRI KRISHNASAMY INTERNATIONAL SCHOOL, MARANERI",VILLAMPATTI MARANERISIVAKASI,626124
23849,VIRUDHUNAG,Sivakasi,"SRI KRS. MATRICULATION SCHOOL, VISWANATHAM","2,2331 VISWANATHAM,SIVAKASI - 332609105192,2331
viswanatham",626123
23850,VIRUDHUNAG,Sivakasi,"SRI N M MEHTA JAIN MATRICULATION HR SEC SCHOOL, SIVAKASI","FIRST LANE,VELAYUTHAM ROADBEHIND HDFC BANK",626123
23851,VIRUDHUNAG,Sivakasi,"SRI SHENBAGA VINAYAGAR MATRICULATION HIGHER SECONDARY SCHOOL, SIVAKASI",7E Vembakottai Road Sivakasi,626123
23852,VIRUDHUNAG,Sivakasi,"SRUTHI VIDHYODHAYA , SIVAKASI","308C2, GNANAGIRI ROAD, NATIONAL COLONY, RAJIV GANDHI NAGAR, SIVAKASI",626189
23853,VIRUDHUNAG,Sivakasi,"SUNDARAVEL MATRICULATION HR SEC SCHOOL, THIRUTHANGAL","Sundaravel Mat.Hr.Sec.School, 334, Satchiya puram Road,
Thiruthanga.Sundaravel Mat.Hr.Sec.School, 334, Satchiya puram
TRCoaHdM, TSh,MiruUthTaHngUaK. UMARAPURAM,VELLUR",626130
23854,VIRUDHUNAG,Sivakasi,"TCH MS, MUTHUKUMARAPURAM","POST,AMATHUR VIATCHMS,MUTHUKUMARAPURAM,VELLUR",626005
23855,VIRUDHUNAG,Sivakasi,"THE SIVAKASI LIONS MATRICULATION HIGHER SECONDARY SCHOOL, SIVAKASI","196-A, Palaniyandavarpuram Colony,2/754-A, Virudhunagar Road,  Anaikuttam Post, Sivakasi",626130
23856,VIRUDHUNAG,Sivakasi,"THIRUTHANGAL LIONS MATRICULATION HR SEC SCHOOL, THIRUTHANGAL",3/457 PALLAPATTI ROAD\THIRUTHANGAL,626130
23857,VIRUDHUNAG,Sivakasi,"V S K D NADAR GURUKUL MATRIC HR SEC SCHOOL, SATCHIYAPURAM",SivakasiSatchiyapuram,626124
23858,VIRUDHUNAG,Sivakasi,"V.N.U.A.P.N.T. MATRICULATION HR SEC SCHOOL, VILAMPATTI",1/9\ALANGULAM MAIN ROAD,626124
23859,VIRUDHUNAG,Sivakasi,"V.S.K.DURAISWAMYNADAR GIRLS
MATRICULATION HIGHER SECONDARY SCHOOL, SIVAKASI",113 Badrakaliamman koil street,626123
23860,VIRUDHUNAG,Sivakasi,"VEERAMAMUNIVAR HIGH SCHOOL, KRISHNAPERI",MANAGASERI POST\SIVAKASI TALUK,626141
23861,VIRUDHUNAG,Sivakasi,"VELANKANNI MATHA HR SEC SCHOOL, SIVAKASI","10,11, PKSA ARUMUGAM ROAD, SIVAKASIAMMANKOVILPATTI",626189
23862,VIRUDHUNAG,Sivakasi,"VINAYAKAR MATRICULATION HR SEC SCHOOL,SIVAKASI","175,176 MUNDAGAN STREET,SIVAKASI",626123
23863,VIRUDHUNAG,Sivakasi,"YRTV MAT HR SEC SCHOOL, SIVAKASI","1-A, CHAIRMAN A R ARUNACHALAM ROAD340, POOTHAYAMMAL NAGAR, SIVAKASI",626123
23864,VIRUDHUNAG,Srivilliputhur,"C.M.S. HIGHER SECONDARY SCHOOL, SRIVILLIPUTHUR","C.M.S HSS,  SRIVILLIPUTTUR",626125
23865,VIRUDHUNAG,Srivilliputhur,"GOVERNMENT HIGH SCHOOL, LAKSHMIAPURAMPUTHUR","Inamkarisalkulam post, Srivilliputhur",626125
23866,VIRUDHUNAG,Srivilliputhur,"GOVERNMENT HIGH SCHOOL, PANANKULAM","PANANKULAM
VILLUPANOOR POST SRIVILLIPUTTUR TK- 626138",626138
23867,VIRUDHUNAG,Srivilliputhur,"GOVERNMENT HIGH SCHOOL, T.MANAGASERI","T.MANAGASERI,SRIVILLIPUTHUR TK",626141
23868,VIRUDHUNAG,Srivilliputhur,"GOVERNMENT HIGH SCHOOL, THOMBAKULAM",Alangulam roadThompakulam,626136
23869,VIRUDHUNAG,Srivilliputhur,"GOVERNMENT HIGHER SECONDARY SCHOOL, KEELARAJAKULARAMAN",ALANGULAM MAIN ROADKEELARAJAKULARAMAN,626136
23870,VIRUDHUNAG,Srivilliputhur,"GOVERNMENT HIGHER SECONDARY SCHOOL, KRISHNANKOVIL - MODEL","G.H.S.S,KRISHNANKOVIL, MADURAI MAIN ROAD, KRISHNANKOVIL",626126
23871,VIRUDHUNAG,Srivilliputhur,"GOVERNMENT HIGHER SECONDARY SCHOOL, PAPPAYANAICKERPATTI",APPAYANAICKERPATTI POST\PAPPAYANAICKERPATTI MALLI,626141
23872,VIRUDHUNAG,Srivilliputhur,"GOVERNMENT HIGHER SECONDARY SCHOOL, PILLAIYARNATHAM",GOVERNMENT HIGHER SECONDARY SCHOOL PILLAIYARNATHAM,626125
23873,VIRUDHUNAG,Srivilliputhur,"GOVERNMENT HIGHER SECONDARY SCHOOL, ULLOORPATTI",GHSS ULLOORPATTI\MALLI POST,626141
23874,VIRUDHUNAG,Srivilliputhur,"GOVT ADW HIGH SCHOOL, IDAYANKULAM",IDAYANKULAMSRIVILLIPUTTUR TK,626110
23875,VIRUDHUNAG,Srivilliputhur,"GOVT ADW HIGHER SECONDARY SCHOOL, KARISALKULAMPATTI","GOVT ADW HR SEC SCHOOL, KARISALKULAMPATTISRIVILLIPUTTUR TK",626125
23876,VIRUDHUNAG,Srivilliputhur,"GURUGNANA SAMPANDAR HINDU HSS, SRIVILLIPUTHUR",6 Thiruvenkita annaikal street,626125
23877,VIRUDHUNAG,Srivilliputhur,HINDU MATRICULATION SCHOOL,,
23878,VIRUDHUNAG,Srivilliputhur,"JOTHI HIGH SCHOOL,R.REDDIAPATTI","JOTHI HIGH
SCHOOL,R.REDDIAPATTI(PO),KEELARAJAKULARAMAN( Via),RAJAPALAYAMJOTHI HIGH",626136
23879,VIRUDHUNAG,Srivilliputhur,"KAMARAJAR  GOVERNMENT MIDDLE SCHOOL, MALLIPUTHUR",MALLIPUDHUR (PO) MALLISRIVILLIPUTTER (TK),626141
23880,VIRUDHUNAG,Srivilliputhur,"KAMMAPATTI MUNICIPAL MIDDLE SCHOOL, SRIVILLIPUTHUR",Municipal Kammapatti Middle SchoolSrivilliputtur,626125
23881,VIRUDHUNAG,Srivilliputhur,"M.N.R.D.GIRLS HSS, SRIVILLIPUTHUR","24,Thiruvenkata Annaigal Street, SrivilliputturSrivilliputtur",626125
23882,VIRUDHUNAG,Srivilliputhur,"MAHARISHI VIDYA MANDIR SECONDARY SCHOOL - CBSE, SRIVILLIPUTHUR",304 305 Kannan Colony Mamsapuram Road Srivilliputtur304 305 Kannan Colony,626125
23883,VIRUDHUNAG,Srivilliputhur,"MANGAPURAM HINDU HR SEC SCHOOL, SRIVILLIPUTHUR","MANGAPURAM HINDU HIGHER SECONDARY SCHOOL, NEAR PRC DIEPO, SRIVILLIPUTTUR",626125
23884,VIRUDHUNAG,Srivilliputhur,"METTU STREET MUNICIPAL MIDDLE SCHOOL, SRIVILLIPUTHUR",METTUSTREETSRIVILLIPUTTUR,626125
23885,VIRUDHUNAG,Srivilliputhur,"MUNICIPAL MIDDLE SCHOOL, KRISHNAN KOVIL STREET","krishnankovil street, srivilliputtur",626125
23886,VIRUDHUNAG,Srivilliputhur,"MUNICIPAL MIDDLE SCHOOL, PERUMALPATTI",MUNICIPAL  PERUMALPATTI MIDDLE SCHOOL SRIVILLIPUTTUR.,626125
23887,VIRUDHUNAG,Srivilliputhur,"MUNICIPAL MIDDLE SCHOOL, URANIPATTI","URANIPATTI STREET,SRIVILLIPUTHUR",626125
23888,VIRUDHUNAG,Srivilliputhur,"MUNICIPAL TVK HIGHER SECONDARY SCHOOL, SRIVILLIPUTHUR","MUNICIPAL TVK HIGHER SECONDARY SCHOOL, MADURAI  MAIN ROAD ,SRIVILLIPUTHUR",626125
23889,VIRUDHUNAG,Srivilliputhur,NK GOPALSAMY MIDDLE SCHOOL NACHIYARPATTI,NACHIARPATTI SRIVILLIPUTTUR,626135
23890,VIRUDHUNAG,Srivilliputhur,"P.N.U.P.KAMARAJAR MATRICULATION HR.SEC.SCHOOL, SRIVILLIPUTHUR","379,Aladipatti \Sri Kaliamman Nagar",626125
23891,VIRUDHUNAG,Srivilliputhur,PANCHAYAT UNION MIDDLE SCHOOL INAM KARISALKULAM,PUMS InamkarisalkulamSrivilliputtur,626125
23892,VIRUDHUNAG,Srivilliputhur,"PANCHAYAT UNION MIDDLE SCHOOL, AKKARAIPATTY",PUMS  AKKARAIPATTI ACHAMTHAVIZHTHAN POST,626137
23893,VIRUDHUNAG,Srivilliputhur,"PANCHAYAT UNION MIDDLE SCHOOL, ATHIKULAM","PANCHAYAT UNION MIDDLE SCHOOL , ATHIKULAM , SRIVILLIPUTHUR",626125
23894,VIRUDHUNAG,Srivilliputhur,"PANCHAYAT UNION MIDDLE SCHOOL, CHOKKALAMPATTI","PUMS,Chokkalampatti,P.Sallipatti Panchayat, Srivilliputhur Union",626138
23895,VIRUDHUNAG,Srivilliputhur,"PANCHAYAT UNION MIDDLE SCHOOL, INDRA NAGAR",Indra Nagar\SRIVILLIPUTTUR,626125
23896,VIRUDHUNAG,Srivilliputhur,"PANCHAYAT UNION MIDDLE SCHOOL, K.THOTTIYAPATTI",Panchayat Union Middle School K.ThotiapattiSrivilliputhur Union Rajapalayam Taluk,626117
23897,VIRUDHUNAG,Srivilliputhur,"PANCHAYAT UNION MIDDLE SCHOOL, KONGALAPURAM",SITHURAJAPURAM PO\SIVAKASI TK,626189
23898,VIRUDHUNAG,Srivilliputhur,"PANCHAYAT UNION MIDDLE SCHOOL, KOTHANKULAM","KOTHANKULAM, VAITHILINGAPURAM, SRIVILLIPUTHUR",626125
23899,VIRUDHUNAG,Srivilliputhur,"PANCHAYAT UNION MIDDLE SCHOOL, NAGAPALAYAM",PUMS Nagapalayam Mallipudhur,626141
23900,VIRUDHUNAG,Srivilliputhur,"PANCHAYAT UNION MIDDLE SCHOOL, NARAIYANKULAM OTHAPATTI",Panchayat Union Middle School Naraiyankulam Othapatty,626110
23901,VIRUDHUNAG,Srivilliputhur,"PANCHAYAT UNION MIDDLE SCHOOL, PERUMALDEVANPATTI",PERUMALTHEVANPATTIPERUMALTHEVANPATTI,626137
23902,VIRUDHUNAG,Srivilliputhur,"PANCHAYAT UNION MIDDLE SCHOOL, POOVANI","PUMS POOVANI,MEENAKSHIPURAM POST, SRIVILLIPUTTUR",626125
23903,VIRUDHUNAG,Srivilliputhur,"PANCHAYAT UNION MIDDLE SCHOOL, SAMINATHAPURAM","THOMBAKKULAM PO,VEMBAKKOTTAI TK",626136
23904,VIRUDHUNAG,Srivilliputhur,"PASUMPON THEVAR HIGHER SECONDARY SCHOOL, MAMSAPURAM","MAIN ROAD II,  MAMSAPURAM-626110",626110
23905,VIRUDHUNAG,Srivilliputhur,"PENNINGTON PUBLIC SCHOOL CBSE, SRIVILLIPUTHUR","9, Thiruvenkata annaigal street,(library street),Srivilliputtur",626125
23906,VIRUDHUNAG,Srivilliputhur,"R.K.GOVERNMENT HIGHER SECONDARY SCHOOL, P.RAMACHANDRAPURAM","R.K.GOVT.HR.SEC.SCHOOL, P.RAMACHANDRAPURAM",626137
23907,VIRUDHUNAG,Srivilliputhur,"RC.MIDDLE.SCHOOL,PATTAKULAM",PUMS PATTAKULAMPATTAKULAM,626138
23908,VIRUDHUNAG,Srivilliputhur,"SACRED HEART CONVENT HIGH SCHOOL, SRIVILLIPUTHUR","SACRED HEART CONVENT HIGH SCHOOL, MARTINPURAM, SRIVILLIPUTTUR",626125
23909,VIRUDHUNAG,Srivilliputhur,"SACRED HEART GIRLS HIGHER SECONDARY SCHOOL, SRIVILLIPUTHUR","59, NETHAJI ROAD, SRIVILLIPUTTUR",626125
23910,VIRUDHUNAG,Srivilliputhur,"SATHYA VIDYALAYA CBSE,PILLAYARKULAM",Pillaiyarkulam\Sriviiliputtur,626137
23911,VIRUDHUNAG,Srivilliputhur,SIVANTHIPATTI NADAR GIRLS HIGH SCHOOL,"6, kaliamman kovil north car streetmamsapuram",626110
23912,VIRUDHUNAG,Srivilliputhur,"SIVANTHIPATTI NADAR HSS, MAMSAPURAM",KALIAMMAN\KOVIL STREET,626110
23913,VIRUDHUNAG,Srivilliputhur,"SIVARAM HIGH SCHOOL, MAMSAPURAM",V M NAIDU STREETMAMSAPURAM,626110
23914,VIRUDHUNAG,Srivilliputhur,"SIVARAM MIDDLE SCHOOL,MAMSAPURAM","1  V,M, NAIDU STREETMAMSAPURAM",626110
23915,VIRUDHUNAG,Srivilliputhur,"SRI AYYAN KENDRA VIDYALAYA INTERNATIONAL SCHOOL, KALANGAPERI","1  Ayyan Garden, Kalangaperi Main Road, Rajapalayam",626108
23916,VIRUDHUNAG,Srivilliputhur,SRI MAYURA INTERNATIONAL SCH APPAIYANAYAKAR PATTI,APPAIYANAYAKARPATTI/MALLI,626141
23917,VIRUDHUNAG,Srivilliputhur,"SRIVI LIONS INTERNATIONAL SCHOOL, SRIVILLIPUTHUR","Sivakasi Main Road, Inam Natchiyar Kovil Panyachat, Malli village, Near Thailakulam, Srivilliputhur",626135
23918,VIRUDHUNAG,Srivilliputhur,"SRIVI LIONS MATRICULATION HSS, SRIVILLIPUTHUR","N.G.G.O. COLONY, SRIVILLIPUTTUR",626125
23919,Virudhunagar,Srivilliputhur,st antony matriculation school,,
23920,VIRUDHUNAG,Srivilliputhur,"ST.JOSEPH RC HR SEC SCHOOL, SRIVILLIPUTHUR","SIVAKASI ROAD,  RC CHURCH CAMPUS, SRIVILLIPUTTUR",626125
23921,VIRUDHUNAG,Srivilliputhur,TELUGU KULALAR SRI SOOLAI VINAYAGAR VIDYALAYA,,
23922,VIRUDHUNAG,Srivilliputhur,"THIYAGARAJA HIGHER SECONDARY SCHOOL., SRIVILLIPUTHUR","32 NGGO COLONY, SRIVILLIPUTTUR",626125
23923,VIRUDHUNAG,Srivilliputhur,"V.P.M.M.MATRICULATION HSS, SRIVILLIPUTHUR",vpm nagarkrishnankovil,626190
23924,VIRUDHUNAG,Srivilliputhur,"VALLUVAR VIDHYALAYA MATRICULATION HIGHER SECONDARY SCHOOL, SRIVILLIPUTHUR","11-14, Pandit Jawaharlal Nehru StreetSrivilliputtur",626125
23925,VIRUDHUNAG,Srivilliputhur,"VENKADASAMY NAIDU MIDDLE SCHOOL, M.P.K.PUDUPATTI",SUBBURAJCOTTONMILLS COLONY IDAYANKULAM,626110
23926,VIRUDHUNA GAR,Srivilliputhur,Virudhunagar District Government Model School,VPMM ENGINEERING COLLEGE KRISHNAN KOVIL VIRUDHUNAGAR,
23927,VIRUDHUNAG,Srivilliputhur,"VNUP.KALEESWARI HSS, VANNIAMPATTI",VANNIAMPATTY\SRIVILLIPUTTUR,626125
23928,VIRUDHUNAG,Srivilliputhur,"VPMS SELVI SHANKAR(SESHA) VIDYASRAM SCHOOL, SRIVILLIPUTHUR",VPMS SESHA VIDYASHRAM\ACHANKULAM ROAD BEHIND DISTRICT COURT SRIVILLIPUTTUR,626135
23929,VIRUDHUNAG,Srivilliputhur,"VPMS SESHA MATRICULATION SCHOOL , SRIVILLIPUTHUR ,","VPMS SESHA MAT. SCHOOL, ACHANKULAM ROAD,
ATHIKULAM SENKULAM POST,  SRIVILLIPUTHUR BLOCK",626135
23930,VIRUDHUNAG,Srivilliputhur,"YASHAS ENGLISH SCHOOL.,MALLI","37/2A1, SRIVILLIPUTTUR SIVAKASI MAIN ROAD MALLI",626141
23931,VIRUDHUNAG,Thiruchuli,GANDHI VIDYALAYAM HSS KULASEKARANALLUR,"GANDHI VIDYALAYAM HR SEC SCHOOL, RAMASAMY NAGAR, ARUPPUKOTTAI",626107
23932,VIRUDHUNAG,Thiruchuli,"GOVERNMENT HIGH SCHOOL, CHITHALAKUNDU",GOVERNMENT HIGH SCHOOLCHITHALAKUNDU,626129
23933,VIRUDHUNAG,Thiruchuli,GOVT HIGH SCHOOL K CHETTIKULAM,"GOVT.HIGH SCHOOL K.CHETTIKULAMS.CHRISTOBEL LEELABAI , HM, GOVT.HIGH SCHOOL K.CHETTIKULAM",626114
23934,VIRUDHUNAG,Thiruchuli,GOVT HIGH SCHOOL KATHALAMPATTI,"GOVT HIGH SCHOOL,KATHALAMPATTI\R.KALLUMADAM",626118
23935,VIRUDHUNAG,Thiruchuli,GOVT HIGH SCHOOL KEELKUDI,GOVT SCHOOLKEELKUDI,626114
23936,VIRUDHUNAG,Thiruchuli,GOVT HIGH SCHOOL KULASEKARANALLUR,THIRUCHULI ROADKULASEKARANALLUR,626159
23937,VIRUDHUNAG,Thiruchuli,GOVT HIGH SCHOOL MARAVARPERUNGUDI,GHS MARAVARPERUNKUDIGHS MARAVARPERUNKUDI,626118
23938,VIRUDHUNAG,Thiruchuli,GOVT HIGH SCHOOL NALLANGULAM,"Government High School,
Nallangulam,
K Chettikulam - Po",626114
23939,VIRUDHUNAG,Thiruchuli,GOVT HIGH SCHOOL P THOTTIYANGULAM,KRISHNAPURAM ROAD\P.THOTTIYANKULAM,626129
23940,VIRUDHUNAG,Thiruchuli,GOVT HIGH SCHOOL UDAIYANAMPATTI,K.PUDHUR(PO)THIRUCHULI(TK),626129
23941,VIRUDHUNAG,Thiruchuli,GOVT HIGH SCHOOL VADAKKUNATHAM,vadakkunathamvadakkunatham,626114
23942,VIRUDHUNAG,Thiruchuli,GOVT HIGH SCHOOL VIDATHAKULAM,"GHS - VIDATHAKULAMTIRUCHULI TALUK, NARIKUDI POST",626607
23943,VIRUDHUNAG,Thiruchuli,"GOVT HIGH SCHOOL, SAVVASUPURAM",ghs savasupuramramasamy nagar post,626105
23944,VIRUDHUNAG,Thiruchuli,GOVT HIGHER SECONDARY SCHOOL MUTHURAMALINGAPURAM,MUTHURAMALINGAPURAMKALOORANI POST,626105
23945,VIRUDHUNAG,Thiruchuli,GOVT HIGHER SECONDARY SCHOOL PARALACHI,MELAPARALACHI\ARUPUKKOTTAI,626114
23946,VIRUDHUNAG,Thiruchuli,GOVT HIGHER SECONDARY SCHOOL POOLANGAL,"GOVT HR SEC SCHOOL, POOLANGAL,
ARUPPUKOTTAI TALUK VIRUDHUNAGAR DISTRICT-626114",626114
23947,VIRUDHUNAG,Thiruchuli,GOVT HIGHER SECONDARY SCHOOL REDDIAPATTI M - MODEL,M.REDDIAPATTI\M.REDDIAPATTI,626118
23948,VIRUDHUNAG,Thiruchuli,GOVT HIGHER SECONDARY SCHOOL TAMILPADI,ALADIPATTI VIATAMILPADI POST,626129
23949,VIRUDHUNAG,Thiruchuli,GOVT HIGHER SECONDARY SCHOOL THUMMUCHINNAMPATTI,"THUMMUCHINNAMPATTI(PO)ARUPPUKOTTAI(TK) 626
118",626118
23950,VIRUDHUNAG,Thiruchuli,"MINERVA PUBLIC SCHOOL, MANGULAM",MINERVA VILLAGEMANKULAM,626105
23951,VIRUDHUNAG,Thiruchuli,NMSSV MIDDLE SCHOOL THOPPALAKARAI,NMSSV MIDDLE SCHOOL THOPPALAKARAI PARALACHI POST,626114
23952,VIRUDHUNAG,Thiruchuli,PUMS ERRAMPATTI,ErrampattiKattangudi (post),626107
23953,VIRUDHUNAG,Thiruchuli,PUMS ILLUPPAIKULAM,"v.Iluppaikulam\Mithalaikkulam panchayat/Karenthal post,thiruchuli union.",626129
23954,VIRUDHUNAG,Thiruchuli,PUMS K VELAYUTHAPURAM,K.VelayuthapuramNarikkudi (Po),626607
23955,VIRUDHUNAG,Thiruchuli,PUMS KARENTHAL,"PUMS, KARENTHAL.
Thiruchuli-Narikudi Main Road",626129
23956,VIRUDHUNAG,Thiruchuli,PUMS MADATHUPATTI,RAMASAMYNAGAR  POST\ARUPPUKOTTAI  TALUK,626105
23957,VIRUDHUNAG,Thiruchuli,PUMS MELAKANDAMANGALAM,MELAKANDAMANGALAMTAMILPADI(PO),626129
23958,VIRUDHUNAG,Thiruchuli,PUMS POTHAMPATTI,"P.U.M.S ,POTHAMPATTI,SUTHAMADAM P.O
,VIRUDHUNAGAR DISTRICTDO",626114
23959,VIRUDHUNAG,Thiruchuli,PUMS PUDUPATTI P M,"172,Thottiyangulam RoadKattangudi Post",626107
23960,VIRUDHUNAG,Thiruchuli,PUMS PULIKURICHI,"PULIKURICHI,
P.THOTTIYANKULAM POST,
PTUHMIRSU, CRHAUJALGI TOAPLAULKA,PURAM",626129
23961,VIRUDHUNAG,Thiruchuli,PUMS RAJAGOPALAPURAM,"THOPPALAKKARAI POST,
SVeInRkUuDlaHmUNAGAR",626114
23962,VIRUDHUNAG,Thiruchuli,PUMS SENKULAM,"Parlachi P.O Aruppukottai taluk,",626101
23963,VIRUDHUNAG,Thiruchuli,"SARADHA VIDYALAYA MATRICULATION SCHOOL,  M.REDDIYAPATTI",SAYALKUDI MAIN ROADM.REDDIAPATTI,626118
23964,VIRUDHUNAG,Thiruchuli,SBK HIGHER SECONDARY SCHOOL KALLOORANI,2/103Main bazzar,626105
23965,VIRUDHUNAG,Thiruchuli,SETHUPATHI GOVT HIGHER SECONDARY SCHOOL TIRUCHULI,West car streetTIRUCHULI,626129
23966,VIRUDHUNAG,Thiruchuli,"SRI VISHWAS VIDHYALAYA SCHOOL, PANNAI MOONDRADAIPPU",Vishwas NagarPannaimoondradaippu,626129
23967,VIRUDHUNAG,Thiruchuli,"T.U.N.S.V.HSS,THIRUCHULI","75D/5, Kariyapatti RoadTHIRUCHULI",626129
23968,VIRUDHUNAG,Vembakottai,BHARAT MIDDILE SCHOOL APPAYANAICKERPATTI,BHARATHI MIDDLE SCHOOLAPPAYANAICKENPATTI,626127
23969,VIRUDHUNAG,Vembakottai,"G.H.S.,MUTHANDIAPURAM",GOVT HIGH SCHOOL\MUTHANDIYAPURAM,626201
23970,VIRUDHUNAG,Vembakottai,GHS K.MADATHUPATTI,"GOVERNMENT HIGH SCHOOL, K MADATHUPATTI, THAYILPATTI POSTTHAYILPATTI POST",626128
23971,VIRUDHUNAG,Vembakottai,GHS MAMSAPURAM,GOVT HIGH SCHOOL MAMSAPURAM SIVAKASI-WEST 626124,626124
23972,VIRUDHUNAG,Vembakottai,GHS PULLAGOUNDANPATTI,"Pullagoundanpatti, Sankarapandiyapuram(po)vembakkottai(tk)",626201
23973,VIRUDHUNAG,Vembakottai,GHS SUBRAMANIYAPURAM,SUBRAMANIAPURAMTHAYILPATTI  VIA,626128
23974,VIRUDHUNAG,Vembakottai,GHS THULUKANKURUCHI,"SOUTH STREET,GUGANPARAI POST
,THULUKKANKURICHI,",626140
23975,VIRUDHUNAG,Vembakottai,"GHS,PANAYADIPATTI","GOVT HIGH SCHOOL,PANAIYADIPATTI",626201
23976,VIRUDHUNAG,Vembakottai,"GHSS,ALANGULAM","MAIN ROAD, ALANGULAM",626127
23977,VIRUDHUNAG,Vembakottai,"GHSS,SANKARAPANDIAPURAM",GOVT HR SEC SCHOOL SANKARAPANDIAPURAM,626201
23978,VIRUDHUNAG,Vembakottai,"GHSS,SEVALPATTI - MODEL",SEVALPATTISEVALPATTI,626140
23979,VIRUDHUNAG,Vembakottai,"GHSS,SIPPIPARAI",NEAR VAO OFFICECHATRAM ROAD,627713
23980,VIRUDHUNAG,Vembakottai,"GHSS,VEMBAKOTTAI",GOVT HR SEC SCHOOLVEMBAKOTTAI,626131
23981,VIRUDHUNAG,Vembakottai,"GHSS,VIJAYAKARISALKULAM",GHSS-VIJAYAKARISALKULAMVEMBAKOTTAI-TK,626131
23982,VIRUDHUNAG,Vembakottai,"GOVERNMENT HIGH SCHOOL, K.CHELLAIYAPURAM","GOVT HIGH SCHOOL
K.CHELLAIAHPURAMELAYIRAMPANNAI POST, VEMBAKOTTAI TK",626201
23983,VIRUDHUNAG,Vembakottai,GOVT HSS KALLAMANAICKERPATTI,GOVERNMENT HR SEC SCHOOLKALLAMANAICKERPATTI,626131
23984,VIRUDHUNAG,Vembakottai,HAYAGRIVAS INTERNATIONAL SCHOOL.PERNAYAKANPATTI,"Hayagrivas Gardens,Pernaiyakkanpatti,SivakasiHayagrivas Gardens,Pernaiyakkanpatti,Sivakasi",626189
23985,VIRUDHUNAG,Vembakottai,"HINDU MARAVAR PS ,T.KOTTAIYUR",7/140 T.KOTTAIYURTHAYILPATTI,626128
23986,VIRUDHUNAG,Vembakottai,"HINDU MIDDLE SCHOOL, ETHIRKOTTAI",middlestreet\Edirkottai,626131
23987,VIRUDHUNAG,Vembakottai,"KRTA GHSS,MELATHAYILPATTI",KRTA GOVT HR SEC SCHOOL MELATHAYILPATTI,626128
23988,VIRUDHUNAG,Vembakottai,"MADURAI C.E.O.A MATRICULATION SCHOOL, SALVARPATTI","R.V.C.E CAMPUS, SALVARPATTI, THAYILPATTI ROAD, VEMBAKOTTAI",626127
23989,VIRUDHUNAG,Vembakottai,"MAHAMAI MS , GUHANPARAI",GUHANPARAI POSTVEMBAKOTTAI TALUK,626140
23990,VIRUDHUNAG,Vembakottai,"NADAR GEORGE HS, THAYILPATTI",PatchayapuramThayilpatti,626128
23991,VIRUDHUNAG,Vembakottai,"NADAR MAHAMAI GIRLS HIGH SCHOOL,ELAYIRAMPANNAI",NADAR MAHAMAI GIRLS HIGH SCHOOLELAYIRAMPANNAI,626201
23992,VIRUDHUNAG,Vembakottai,NADAR MAHAMAI HSS ELAYIRAMPANNAI,"VEMBAKOTTAI TALUK, VIRUDHUNAGAR DISTRICT",626201
23993,VIRUDHUNAG,Vembakottai,P U M S M.DURAISAMYPURAM,M.DURAISAMYPURAM   MAMSAPURAM (PO)  626124.,626124
23994,VIRUDHUNAG,Vembakottai,P U M S NATHIKUDI,NATHIKUDI POSTVEMBAKOTTAI TALUK,626137
23995,VIRUDHUNAG,Vembakottai,P U M S PARAIPATTI,PARAIPATTI\KUNDAYERUPPU (PO),626131
23996,VIRUDHUNAG,Vembakottai,P.U.M.S E.RAMANATHAPURAM,"PUMS,E.RAMANATHAPURAM
ELAYIRAMPANNAI- POST VEMBAKKOTAI-BLOCK",626201
23997,VIRUDHUNAG,Vembakottai,P.U.M.S ELAYIRAMPANNAI,ELAYIRAMPANNAIELAYIRAMPANNAI,626201
23998,VIRUDHUNAG,Vembakottai,P.U.M.S ETTAKKAPATTI,PANCHAYAT UNION MIDDLE SCHOOLETTAKKAPATTI,626131
23999,VIRUDHUNAG,Vembakottai,P.U.M.S KANGARSEVAL,k.lakshmiyapuram roadkangarsevel,626131
24000,VIRUDHUNAG,Vembakottai,P.U.M.S KOTHAINATCHIYARPURAM,MelakothainachiyarpuramThayilpatti,626128
24001,VIRUDHUNAG,Vembakottai,P.U.M.S KOTTAIPATTI,PUMS KOTTAIPATTIVEMBAKOTTAI TALUK,626131
24002,VIRUDHUNAG,Vembakottai,P.U.M.S MANJALODAIPATTI,MANJALODAIPATTI SANKARA[PANDIAPURAM [PO],626201
24003,VIRUDHUNAG,Vembakottai,P.U.M.S PERNAICKENPATTI,"PERNAICKENPATTI
SITHURAJAPURAM(PO)                          (VIA) SIVAKASI",626189
24004,VIRUDHUNAG,Vembakottai,P.U.M.S SOUTH ANAIKUTTAM,Vetrilaiyoorani PostSivakasi Taluk,626128
24005,VIRUDHUNAG,Vembakottai,"P.U.M.S,RAMUTHEVANPATTI",Near punchayat union officeRamudevanpatti,626131
24006,VIRUDHUNAG,Vembakottai,"PANCHAYAT UNION MIDDLE SCHOOL, AYAN SALVARPATTI",P.U.MIDDLE SCHOOL AYANSALVARPATTI PIN 626128,626128
24007,VIRUDHUNAG,Vembakottai,"R.P.N.M.HINDU MIDDLE SCHOOL, KAKKIVADANPATTI",Main RaodNear Vinayagar Kovil,626124
24008,VIRUDHUNAG,Vembakottai,"SP MODERN MATRICULATION SCHOOL
,SEVALPATTI","2/272,South street\Sevalpatti",626140
24009,VIRUDHUNAG,Vembakottai,"ST.ANTONY'S HIGH SCHOOL, MELANMARAINADU",MelanmarainaduVembakkottai -TK,626127
24010,VIRUDHUNAG,Vembakottai,TANCEM MHSS ALANGULAM,SivakasiSivakasi,626127
24011,VIRUDHUNAG,Virudhunagar,"P S CHIDAMBARA NADAR SENIOR ENGLISH SCHOOL, VIRUDHUNAGAR","110/2,Katchery RoadNorth Bye pass Road, VNR",626001
24012,VIRUDHUNAG,Virudhunagar,AP SANKARALINGA NADAR GIRLS MIDDLE SCHOOL VNR,"10/73 A.P.S. Girls  Middle SchoolLink Road, Virudhunagar",626001
24013,VIRUDHUNAG,Virudhunagar,"ASPCC MUNICIPAL HS,VIRUDHUNAGAR","RAMAMOORTHI ROAD, VIRUDHUNAGAR",626001
24014,VIRUDHUNAG,Virudhunagar,"DHAMU MEMORIAL MATRICULATION SCHOOL, SEVALPATTI","dhamu MMS ,Near collectorrate, sevalpatti, Virudhunagar",626002
24015,VIRUDHUNAG,Virudhunagar,"G.H.S.,SENNELKUDI","Near Perumal Temple, Sennelkudi",626004
24016,VIRUDHUNAG,Virudhunagar,"GHS, PAVALI",Erichanatham ViaPavali,626103
24017,VIRUDHUNAG,Virudhunagar,"GHS,INAMREDDIAPATTI",GOVT HIGH SCHOOLINAMREDDIAPATTI,626003
24018,VIRUDHUNAG,Virudhunagar,"GHS,PATTAMPUDUR",TEACHERS COLONYPATTAMPUDUR,626003
24019,VIRUDHUNAG,Virudhunagar,"GHS,PERIA PERALI","GOVERMENT HIGH SCHOOL
PERIYAPERALI - 626 109 VIRUDHUNAGAR DISTRICT",626109
24020,VIRUDHUNAG,Virudhunagar,"GHS,VADAMALAIKURICHI",Vadamalaikurichi road Vadamalaikurichi,626001
24021,VIRUDHUNAG,Virudhunagar,GHSS AMATHUR,"K.S.G GHSS,AMATHURVIRUDHUNAGAR",626005
