S NO,DISTRICT,BLOCK NAME,SCHOOL NAME,SCHOOL ADDRESS,PINCODE
2176,COIMBATORE,Anaimalai,M C GGHSS KOTTUR,KAMATCHIYAMMAN KOIL STKOTTUR,642114
2177,COIMBATORE,Anaimalai,"MARY MATHA MATRICULATION SCHOOL, GANAPATHY PALAYAM",'A'-FARM GANAPATHYPALAYAM,642103
2178,COIMBATORE,Anaimalai,OXFORD MATRIC HR. SEC. SCHOOL,"88/2 POLLACHI MAIN ROAD ,ANAIMALAI",642104
2179,COIMBATORE,Anaimalai,PALANIAMMAL HSS,PALANIAMMAL HR SEC SCHOOLV.KALIAPURAM,642129
2180,COIMBATORE,Anaimalai,PUMS ARTHANARIPALAYAM,ARTHANARIPALAYAM REDDIARUR POPOLLACHI,642007
2181,COIMBATORE,Anaimalai,PUMS CHINNAPPAMPALAYAM,big bazaar street\chinnappampalayam,642104
2182,COIMBATORE,Anaimalai,PUMS GENGAMPALAYAM,GENGAM  PALAYAM  PETHANAYAKKANOOR,642134
2183,COIMBATORE,Anaimalai,PUMS KARIANCHETTIPALAYAM,"PANCHAYAT UNION MIDDLE SCHOOLKARIYANCHETTIPALAYAM,SAMATHUR
POST,ANAIMALAI TALUK",642123
2184,COIMBATORE,Anaimalai,PUMS KPM COLONY,KALIAPURAM POSTPOLLACHI .TK,642129
2185,COIMBATORE,Anaimalai,PUMS MANJANAICKANUR,MANJANAICKANOOR\MANJANAICKANOOR,642007
2186,COIMBATORE,Anaimalai,PUMS NARASIMMAN NAGAR,"PANCHAYAT UNION MIDDLE SCHOOLNARASIMMAN NAGAR,ANAIMALAI",642104
2187,COIMBATORE,Anaimalai,PUMS NARIKKALPATHY,"PUM.SCHOOL, NARIKKALPATHI\SETHUMADAI(PO)",642133
2188,COIMBATORE,Anaimalai,PUMS ODAYAKULAM,PANCHAYAT UNION MIDDLE SCHOOL\ODAYAKULAM ANAIMALAI TALUCK,642129
2189,COIMBATORE,Anaimalai,PUMS PONGALIYUR,"Subramaniyam street, PongaliyurPongaliyur, Anaimalai",642114
2190,COIMBATORE,Anaimalai,PUMS SARALAIPATHY,PANCHAYAT UNION MIDDLE SCHOOL\SARALAIPATHY,642129
2191,COIMBATORE,Anaimalai,PUMS SUBBEGOUNDENPUDUR,west vinayagar kovil streetsubbegoundenpudur,642103
2192,COIMBATORE,Anaimalai,PUMS THENSANGAMPALAYAM,"PANCHAYAT UNION MIDDLE
SCHOOL,THENSANGAMPALAYAMANAIMALAI MAIN ROAD",642007
2193,COIMBATORE,Anaimalai,PUMS VAZHAIKOMBU,"pumschool,vazhaikombu.vazhaikombu nagoor.",642103
2194,COIMBATORE,Anaimalai,"PUMS, KIZHAVANPUDUR",kizhavanpudurkizhavanpudur,642103
2195,COIMBATORE,Anaimalai,SHRI KRISHNA VIDHYALAYA MATRIC HR. SEC. SCHOOL,DIVANSAPUDUR\POLLACHI,642103
2196,COIMBATORE,Anaimalai,SHRI MAHATHMA VIDHYAA MANTHIR MAT SCHOOL,"44 MARAMANAI STREET307,SARALAIPATHY ROAD",642129
2197,COIMBATORE,Anaimalai,SHRI VIGNESWARA MATRIC HR. SEC. SCHOOL,KOTTUR\POLLACHI,642007
2198,COIMBATORE,Anaimalai,SRI LAXMI VIDYA BAVAN MATRIC HR SEC SCHOOL,"DIVANSAPUDUR(PO), MEENASHIPURAM, POLLACHIDIVANSAPUDUR(PO), MEENASH",642103
2199,COIMBATORE,Anaimalai,SRI VAGISVARI VIDYA MANDIR MATRIC HR SEC SCHOOL,"2/59, Pilchinnampalayam, Valparai Main Road ,Samathur (Po), Pollachi-642 123.",642123
2200,COIMBATORE,Anaimalai,SRINITHI PUBLIC SCHOOL,,
2201,COIMBATORE,Anaimalai,VIDHYA VISHWALAYA CBSE,"45/1 A, PILCHINNAMPALYAM, SAMATHUR",642123
2202,COIMBATORE,Anaimalai,VRT GGHSS ANAIMALAI,BHARATHIYAR NAGAR SETHUMADAI ROAD\ANAIMALAI - 642104,642104
2203,COIMBATORE,Annur,"AMARAR A. MUTHUGOUNDER  GOVERNMENT HIGHER SECONDARY SCHOOL, ANNUR",AVINASHI ROAD ANNUR,641653
2204,COIMBATORE,Annur,BENEVOLENCE INTERNATIONAL PUBLIC SCHOOL,"SF No.608/1 PT, KAKAPALAYAM ROAD,
SOKKAMPALAYAM POST, ANNUR,",641653
2205,COIMBATORE,Annur,"GANDHIJI GOVT HR SEC SCHOOL, SOKKAMPALAYAM 641653","ANNUR TKSOKKAMPALAYAM,",641653
2206,COIMBATORE,Annur,GHSS ANAIYUR,"GHSS ANAIYUR,KUPPANUR(PO),ANNUR(VIA)",641653
2207,COIMBATORE,Annur,"GHSS, KEMBANAICKENPALAYAM",KAREGOUNDENPALAYAMKEMBANAICKENPALAYAM,641697
2208,COIMBATORE,Annur,GOVERNMENT HIGH SCHOOL PONNEGOUNDENPUDUR,"GHS.PONNEGOUNDENPUDUR,S.S.KULAM-VIA",641107
2209,COIMBATORE,Annur,"GOVERNMENT HIGH SCHOOL, PERIYAPUTHUR","GOVERNMENT HIGH
SCHOOL,PERIYAPUTHUR,POGALUR VIA,ANNUR T,KCOIMBATORE,TAMILNADU.",641697
2210,COIMBATORE,Annur,"GOVT ADIDRAVIDA WELFARE HIGH SCHOOL, PASUR","SATHY MAIN ROAD,PASUR,ANNUR TK COIMBATORE- 641653",641653
2211,COIMBATORE,Annur,K.G. GIRLS HIGHER SECONDARY SCHOOL,ANNUR,641653
2212,COIMBATORE,Annur,"K.G. MATRICULATION HR SEC SCHOOL, ANNUR","K.G MATRICULATION HIGHER SECONDARY SCHOOL,
COVAI ROAD, ANNUR,",641653
2213,COIMBATORE,Annur,K.G.INTERNATIONALSCHOOL,"263/1 ALLIKARAMPALAYAM\ODDERPALAYAM POST, ANNUR, COIMBATORE",641653
2214,COIMBATORE,Annur,KOVAI VIDYASHRAM,"KARUVALUR ROAD, MANIKKAMPALAYAMSS KULAM VIA",641107
2215,COIMBATORE,Annur,KOVAI VIDYASHRAM,"KARUVALUR ROAD, MANIKKAMPALAYAM SS KULAM VIA",
2216,COIMBATORE,Annur,KPR Women Employees Educational Division,,
2217,COIMBATORE,Annur,NAVA BHARATH INTERNATIONAL SCHOOL,"NAVA BHARATH INTERNATIONAL SCHOOL,ALLIKULLAM,SATHY MAIN ROAD,ANNUR-
641653",641653
2218,COIMBATORE,Annur,NAVABHARATH NATIONAL SCHOOL,Sathy Main Road \Annur,641653
2219,COIMBATORE,Annur,"PANCAHAYAT UNION MIDDLE SCHOOL, ELLAPALAYAM",ELLAPPALAYAMPOGALUR VIA,641697
2220,COIMBATORE,Annur,"PANCHAYAT UNION MIDDILE SCHOOL, POGALUR","Panchayat Union Middle School, Pogalur-641697.",641697
2221,COIMBATORE,Annur,PANCHAYAT UNION MIDDLE SCHOOL KUNNATHUR PUDUR,kunnathurpudurss kulam via,641107
2222,COIMBATORE,Annur,PANCHAYAT UNION MIDDLE SCHOOL ORAIKALPALAYAM,pums oraikalpalayamoraikalpalayam post,641107
2223,COIMBATORE,Annur,PANCHAYAT UNION MIDDLE SCHOOL PACHAPALAYAM,"PUMS PACHAPALAYAM,PACHAPALAYAM(POST),SS KULAM VIA , ANNUR COIMBATORE",641107
2224,COIMBATORE,Annur,PANCHAYAT UNION MIDDLE SCHOOL PACHAPALAYAM,"PUMS PACHAPALAYAM,PACHAPALAYAM(POST),SS KULAM VIA , ANNUR  COIMBATORE",
2225,COIMBATORE,Annur,"PANCHAYAT UNION MIDDLE SCHOOL, AAMBOTHI","pums ambothy,ambothy po annur tk ANNUR COIMBATORE",638459
2226,COIMBATORE,Annur,"PANCHAYAT UNION MIDDLE SCHOOLC, SELLAPPAMPALAYAM",p.pulliyampatti (via)sellapampalayam,638459
2227,COIMBATORE,Annur,PUMS KANUVAKKARAI,KanuvakkaraiKanuvakkarai (PO),638459
2228,COIMBATORE,Annur,PUMS VADAKKALUR,PUM SCHOOL VADAKKALURVADAKKALUR PO ANNUR TK,641653
2229,COIMBATORE,Annur,"PUMS, AKKARAI SENGAPPALLI","PUM SCHOOL AKKARAISENGAPALLIAKKARAISENGAPALLI PO
SIRUMUGAI VIA  ANNUR TK",641302
2230,COIMBATORE,Annur,"PUMS, ANNUR KUMARAPALAYAM",A KUMARAPALAYAM\ ANNUR,641006
2231,COIMBATORE,Annur,"PUMS, ANNUR METTUPALAYAM",Annur mettuppalayam post\Annur via,641653
2232,COIMBATORE,Annur,"PUMS, KANJAPALLI",PUM SCHOOL KANJAPALLI KANJAPALL ( PO )ANNUR TK,641653
2233,COIMBATORE,Annur,"PUMS, OTTERPALAYAM",PUMS ODDERPALAYAMANNUR,641653
2234,COIMBATORE,Annur,"PUMS, PILLAIYAPPAMPALAYAM",pillaiappampalayam  pillaiappampalayam        post,641653
2235,COIMBATORE,Annur,"PUMS, PUTHUPALAYAM",Pums p.pudupalayam. Annur union coimbatore (dt),641653
2236,COIMBATORE,Annur,SREE MATRICULATION SCHOOL,1/413 sathy main road kunnathur,641107
2237,COIMBATORE,Annur,SRI AKILA VIDYALAYA MATRICULATION SCHOOL,"96,B AVINASHI ROAD  ANNUR",641653
2238,COIMBATORE,Annur,SRI AMBAL THULASI PUBLIC SCHOOL SENIOR SECONDARY CBSE,"638/2A1,SOMANUR ROAD, KALIYAPURAM,ANNUR,COIMBATORE(DIST)- 641 653. TAMIL NADU.638/2A1,SOMANUR ROAD, KALIYAPURAM,ANNUR,COIMBATORE(DIST)- 641 653.
TAMIL NADU.",641653
2239,COIMBATORE,Annur,SRI BHARATHI MATRICULATION HIGHER SECONDRY SCHOOL,"OPP. TO LGB , SATHY MAIN ROAD, GANESAPURAM",641107
2240,COIMBATORE,Annur,"ST MARY'S CONVENT MATRICULATION HIGHER SECONDARY SCHOOL, ALLIKKARANPALAYAM",ALLIKARAMPALAYAMANNUR,641653
2241,COIMBATORE,Annur,ST. ANTONY MATRICULATION SCHOOL,"ANTHONIAR NAGAR, GANESAPURAM, COIMBATORE",641107
2242,COIMBATORE,Annur,"STANES MATRICULATION SCHOOL, ELLAPALAYAM","553 - A, KANAKKAN THOTTAM, KARIAMPALAYAM VILLAGE, ELLAPALAYAM POST,  ANNUR.",641697
2243,COIMBATORE,Annur,SWAMI VIVEKANANDA MATRIC HR SEC SCHOOL,"JEEVA NAGAR,METTUPALAYAM ROAD\ODDERPALAYAM POST,ANNUR",641653
2244,COIMBATORE,Annur,"T.S.A. GOVT HR.SEC.SCHOOL, KATTAMPATTY","HEADMASTER TSA GOVT HR SEC SCHOOL KATTAMPATTI\KATTAMPATTI POST SS KULAM VIA
,COIMBATORE",641107
2245,COIMBATORE,Annur,WHITE EAGLE PUBLIC SCHOOL,WHITE EAGLE PUBLIC SCHOOL,641001
2246,Coimbatore,Coimbatore city,"ADWAITH THOUGHT ACADEMY, Coimbatore",,
2247,COIMBATORE,Coimbatore city,"AIR FORCE SCHOOL,COIMBATORE","AF SCHOOL CBE\RED FIELDS, KAMARAJ RAOD",641018
2248,COIMBATORE,Coimbatore city,AL-AZHAR MATRICULATION SCHOOL,"AL AZHAR MATRICULATION SCHOOL60-D,SAMRAO STREET,FORT,CBE",641001
2249,COIMBATORE,Coimbatore city,ALG MATRIC HR SEC SCHOOL,50 DAMU NAGARCOIMBATORE,641045
2250,COIMBATORE,Coimbatore city,ALVERNIA MATRICULATION HIGHER SECONDARY SCHOOL,"TRICHY ROAD, RAMANATHAPURAM, COIMBATORE",641045
2251,COIMBATORE,Coimbatore city,ANGAPPA EDUCATIONAL TRUST SENIOR SECONDARY SCHOOL,"RAJA ANNAMALAI ROADSAIBABA COLONY, COIMBATORE",641011
2252,COIMBATORE,Coimbatore city,ASHIRWAAD SPECIAL SCHOOL,"No.1, Subramaniyam road, \R.S. Puram, COIMBATORE",641002
2253,COIMBATORE,Coimbatore city,ATHAR JAMATH AIDED HIGH SCHOOL,"M.C.R Nagar,MUTHU COLONY,KARUMBUKKADAI",641008
2254,COIMBATORE,Coimbatore city,ATHAR JAMATH MIDDLE SCHOOL,"Hafizpet,Ukkadam",641001
2255,COIMBATORE,Coimbatore city,BHARATHI MATRICULATION HIGHER SECONDARY SCHOOL,"307, Thadagam Road,G C T Post, Coimbatore",641013
2256,COIMBATORE,Coimbatore city,BHARATHI REHABILITATION CENTRE,307 thadagam roadcoimbatore,641113
2257,COIMBATORE,Coimbatore city,BHARATHI SCHOOL,"307, THADAGAM ROAD, GCT POST COIMBATORE NORTH TALUK",641001
2258,COIMBATORE,Coimbatore city,"BHARATIYA VIDYA BHAVAN MATRICULATION HIGHER SECONDARY SCHOOL, R.S.PURAM",582 DIWAN BAHADUR ROADR S PURAM,641002
2259,COIMBATORE,Coimbatore city,BISHOP OUBAGARAM PARTIALLY AIDED HIGH SCHOOL,"LAWLY ROAD, R.S.PURAM,",641002
2260,COIMBATORE,Coimbatore city,BRINDISI MATRICULATION HR SEC SCHOOL,"4TH STREET EXTENTION,GANDHIPURAM, COIMBATORE",641012
2261,COIMBATORE,Coimbatore city,C M S WEDDERBURN PET,RAMALINGAM ROAD\R.S.PURAM,641002
2262,COIMBATORE,Coimbatore city,C S I MATRIC HR SEC SCHOOL,"RACE COURSE,COIMBATORE",641018
2263,COIMBATORE,Coimbatore city,C.S.I GIRLS AIDED HIGHER SECONDARY SCHOOL AVINASHI ROAD,"AVINASHI ROAD, COIMBATORE",641018
2264,COIMBATORE,Coimbatore city,CARMEL GARDEN MATRICULATION HIGHER SECONDARY SCHOOL,"CARMEL GARDEN MATRIC HR SEC SCHOOL, PULIYAKULAM ROAD,  RAMANATHAPURAM P O, CBE45",641045
2265,COIMBATORE,Coimbatore city,CARMEL GARDEN PUBLIC SCHOOL,"NEAR BISHOP AMBROSE COLLEGE,SUNGAM BY PASS ROAD ,COIMBATORE",
2266,COIMBATORE,Coimbatore city,"CCMA GOVERNMENT GIRLS HIGHER SECONDARY SCHOOL, RAJA STREET","CCMA GOVERNMENT GIRLS HIGHER SECONDARY SCHOOLRAJA STREET, COIMBATORE",641001
2267,COIMBATORE,Coimbatore city,CGHSS RANGANATHAPURAM,"CORPORATION GIRLS HR SEC SCHOOL,RANGANATHA PURAMRAMNAGAR,COIMBATORE",641009
2268,COIMBATORE,Coimbatore city,CHINMAYA VIDYALA MAT SCHOOL,"107- ROBERTSON ROAD R.S.PURAM,COIMBATORE",641002
2269,COIMBATORE,Coimbatore city,"CITY CORPORATION HIGHER SECONDARY SCHOOL, V.H. ROAD",V.H.ROAD\COIMBATORE,641001
2270,COIMBATORE,Coimbatore city,CMS MNG STREET,CORPORATION MIDDLE SCHOOLM.N.G.STREET,641001
2271,COIMBATORE,Coimbatore city,CMS PAPPANAICKEN PALAYAM,BHARATHIYAR ROADPAPPANAICKENPALAYAM,641037
2272,COIMBATORE,Coimbatore city,CMS TATABAD,Dr.azhagappa roadTATABAD coimbatore,641012
2273,COIMBATORE,Coimbatore city,COIMBATORE DISTRICT GOVERNMENT MODEL SCHOOL,"1/1, SUBRAMANIAM ROAD, RS PURAM",
2274,COIMBATORE,Coimbatore city,COIMBATORE SEVANILAYAM GIRLS AIDED HIGH SCHOOL,NO 2 SYRIAN CHURCH ROAD COIMBATORE,641001
2275,COIMBATORE,Coimbatore city,CORPORATION GIRLS HIGH SCHOOL PULIAKULAM,PULIAKULAM,641045
2276,COIMBATORE,Coimbatore city,CORPORATION GIRLS HIGH SCHOOL SIDHAPUDHUR,"AMBIKA LAYOUT, SIDHAPUDUR, COIMBATORE",641044
2277,COIMBATORE,Coimbatore city,CORPORATION GIRLS HIGH SCOOL SELVAPURAM,UKKADAM BYE PASS ROADSELVAPURAM,641026
2278,COIMBATORE,Coimbatore city,CORPORATION GIRLS HIGHER SEC SCHOOL RAMAKRISHNAPURAM,"CGHSS Ramakrishnapuram, Ramanathapuram, Coimbatore",641045
2279,COIMBATORE,Coimbatore city,CORPORATION GIRLS HIGHER SEC. SCHOOL R.S. PURAM WEST,"west sambandham road, RS Puram, COIMBATORE",641002
2280,COIMBATORE,Coimbatore city,CORPORATION GIRLS HIGHER SECONDARY SCHOOL OPPANAKARA STREET,OPPANAKARA STREETCOIMBATORE,641001
2281,COIMBATORE,Coimbatore city,CORPORATION HIGH SCHOOL ANUPPARPALAYAM,DR NANJAPPA ROAD ANUPPARPALAYAM,641018
2282,COIMBATORE,Coimbatore city,"CORPORATION HIGH SCHOOL FOR DEAF, R.S.PURAM",SUBRAMANIYAM STREET R.S.PURAM,641002
2283,COIMBATORE,Coimbatore city,CORPORATION HIGH SCHOOL RAMALINGAM COLONY,RAMALINGAMCOLONY 3RD CROSS STREET\BHARATHI PARK ROAD,641043
2284,COIMBATORE,Coimbatore city,CORPORATION HIGHER SECONDARY SCHOOL OKKILIYAR COLONY,"CORPORATION HR SEC SCHOOL , OKKILIYAR COLONY, COIMBATORE 641 001",641001
2285,COIMBATORE,Coimbatore city,CORPORATION HIGHER SECONDARY SCHOOL R.S. PURAM,AROCKIYA SAMY ROADR.S.PURAM,641002
2286,COIMBATORE,Coimbatore city,CORPORATION HIGHER SECONDARY SCHOOL SELVAPURAM,"CORP HR.SEC.SCHOOL,SELVAPURAM NORTHCORP HR.SEC.SCHOOL,SELVAPURAM",641026
2287,COIMBATORE,Coimbatore city,CORPORATION HIGHER SECONDARY SCHOOL SIDHAPUDHUR,"V K K Menon Road, Sidhapudur, Coimbatore",641044
2288,COIMBATORE,Coimbatore city,"CORPORATION HIGHER SECONDARY SCHOOL, NORTH COIMBATORE","NEAR FLY OVER,POWERHOUSE,CROSS CUT ROAD, NORTH COIMBATORE",641012
2289,COIMBATORE,Coimbatore city,"CORPORATION HR SEC SCHOOL, RAMANATHAPURAM","RAMASAMY STREET,TRICHY ROAD,
RAMANATHAPURAM COIMBATORE",641045
2290,COIMBATORE,Coimbatore city,CORPORATION MIDDLE SCHOOL  BB STREET,CORPORATION MIDDLE SCHOOL BIG BAZAAR STREET,641001
2291,COIMBATORE,Coimbatore city,CORPORATION MIDDLE SCHOOL KOTTAI,EASWARN KOVIL STREETKOTTAI,641001
2292,COIMBATORE,Coimbatore city,CORPORATION SRP AMMANIAMMAL GIRLS HIGHER SECONDARY SCHOOL,NO.1 KANNUSAMY ROADR.S.PURAM,641002
2293,COIMBATORE,Coimbatore city,CSI BOYS HR.SEC.SCHOOL,"12, Ismail Street, Town Hall, Coimbatore",641001
2294,COIMBATORE,Coimbatore city,DEVANGA AIDED HIGHER SECONDARY SCHOOL,"DEVANGA HR SEC SCHOOL ROAD, R.S.PURAM",641002
2295,COIMBATORE,Coimbatore city,Dharmamurthi sri SRPPS Vidhyalaya mat. School,,
2296,COIMBATORE,Coimbatore city,G.D.MATRIC HR SEC SCHOOL,"NO 2, K K LANE, OLD POST OFFICE ROAD",641018
2297,COIMBATORE,Coimbatore city,"GOVERNMENT MIDDLE SCHOOL, THIRUMAL STREET","THIRUMAL STREET,MANIYATHOTTAM",641001
2298,COIMBATORE,Coimbatore city,"Government Model School, Coimbatore",,
2299,COIMBATORE,Coimbatore city,HOLY FAMILY CONVENT MATRIC HSS,BY-PASS ROAD\SOUTH UKKADAM,641001
2300,COIMBATORE,Coimbatore city,I.C.C. GIRLS AIDED MIDDLE SCHOOL,"BIG BAZAAR STREET, FORT, COIMBATORE-641001",641001
2301,COIMBATORE,Coimbatore city,JEYAM SPECIAL SCHOOL,18BKR nagarnear ashwin  hospital,641012
2302,COIMBATORE,Coimbatore city,KAMARAJAR MATRIC HIGHER SECONDARY SCHOOL,"170, Dr.Alagappa road,Tatabad, Coimbatore",641012
2303,COIMBATORE,Coimbatore city,KIKANI VIDHYA MANDIR SENIOR SEC SCHOOL,"NO 9 RANGASAMY ROAD R S PURAM, COIMBATORE",641002
2304,COIMBATORE,Coimbatore city,KRISHNASAMY NAGAR GANGA NAGAR MATRIC SCHOOL,"62 krishnaswamy nagar , ramanathpuram",641045
2305,COIMBATORE,Coimbatore city,LISIEUX CMI INTERNATIONAL SCHOOL,"LITTLE FLOWER MONASTERY CAMPUS, BHARATHI PARK CROSS ROAD NO.3",641011
2306,COIMBATORE,Coimbatore city,LISIEUX MATRICULATION HIGHER SECONDARY SCHOOL,Bharathi Park Cross Road No:4Saibaba Colony,641011
2307,COIMBATORE,Coimbatore city,MANBAUL ULOOM Hr SEC SCHOOL,"1, HMPR STREET, FORT, COIMBATORE",641001
2308,COIMBATORE,Coimbatore city,MANBAUL ULOOM MATRICULATION SCHOOL,"Manbaul Uloom Matriculation School  , 797-801 Vincent Road,fort,Coimbatore",641001
2309,COIMBATORE,Coimbatore city,MANI AIDED HIGHER SECONDARY SCHOOL,"88,NETHAJI ROAD,PAPPANAICKEN PALAYAM, COIMBATORE- 37",641037
2310,COIMBATORE,Coimbatore city,MARANNA GOWDER HIGH SCHOOL,888 sullivan street coimbatore,641001
2311,COIMBATORE,Coimbatore city,MARANNA GOWDER MATRIC SCHOOL,"889, SULLIVAN STREET, NEAR GANDHIPARK, COIMBATORE - 641 001",641001
2312,COIMBATORE,Coimbatore city,NAVY CHILDREN SCHOOL,"INS Agrani,
Red Fields, Coimbatore",641018
2313,COIMBATORE,Coimbatore city,NIRMALA MATRIC HR SEC SCHOOL,"No:4, Savthiri Shanmugam Salai, Race Course road, Coimbatore - 641 018",641018
2314,COIMBATORE,Coimbatore city,P R Sidha Naidu Memorial Matriculation Higher Secondary School,"6, SIDHA NAIDU SCHOOL ROAD, SIDHAPUDUR",641044
2315,COIMBATORE,Coimbatore city,PANDIYAN MATRIC SCHOOL,8TH STREET\TATABAD,641012
2316,COIMBATORE,Coimbatore city,PRAKRIYA INTERNATIONAL SCHOOL,"138, NatarajaThevar Colony, Near Dhanwantari TempleRamanathapuram, Coimbatore",641045
2317,COIMBATORE,Coimbatore city,PRESENTATION CONVENT GIRLS HR.SEC.SCHOOL,"PRESENTATION CONVENT GIRLS HR.SEC.SCHOOL NEAR HEAD POST OFFICE ROAD, COIMBATORE",641001
2318,COIMBATORE,Coimbatore city,R.K.SREERANGAMMAL KALVI NILAYAM HIGHER SECONDARY SCHOOL,91 AVINASHI ROAD COIMBATORE,641018
2319,COIMBATORE,Coimbatore city,RAM NAGAR SUBURBAN MATRIC HR SEC SCHOOL,58 RAJAJI ROAD  RAMNAGAR COIMBATORE,641009
2320,COIMBATORE,Coimbatore city,RASAKONDALAR MATRIC HR SEC SCHOOL,"88, Nethaji road, Pappanaickenpalayam, Coimbatore",641037
2321,COIMBATORE,Coimbatore city,SEVENTH DAY ADVENTIST MATRIC HR SEC SCHOOL,"114,CHELLAPPAN STREET KATTOOR, RAMNAGAR, COIMBATORE",641009
2322,COIMBATORE,Coimbatore city,SHREE BALDEVDAS KIKANI VIDYAMANDIR AIDED HIGHER SEC SCHOOL,"SASTRI ROAD, R S PURAM,COIMBATORE",641002
2323,COIMBATORE,Coimbatore city,SHREE BALDEVDAS KIKANI VIDYAMANDIR MATRIC HR SEC SCHOOL,"SHREE BALDEVDAS KIKANI VIDYAMANDIR MATRIC HR SEC SCHOOL  NO  9 RANGASAMY ROAD  R S PURAM COIMBATORESHREE BALDEVDAS KIKANI VIDYAMANDIR MATRIC HR SEC SCHOOL  NO 9
RANGASAMY ROAD  R S PURAM COIMBATORE",641002
2324,COIMBATORE,Coimbatore city,SHRI NEHRU VIDYALAYA MATRICULATION HIGHER SECONDARY SCHOOL,"26 TIBREWAL NAGAR, ROBERTSON ROAD, R S PURAM, COIMBATORE",641002
2325,COIMBATORE,Coimbatore city,SNV GLOBAL SCHOOL,"NO-26, TIBREWAL NAGAR
ROBERTSON ROAD, R.S.PURAM, COIMBATORE",641002
2326,COIMBATORE,Coimbatore city,SREE NARAYANA MISSION MHS SAIBABA COLONY,90 NARAYANA GURU ROAD SAIBABA MISSION POST SAIBABA COLONY,641011
2327,COIMBATORE,Coimbatore city,SRI AVINASHILINGAM GIRLS HR.SEC.SCHOOL,"NEAR BHARATHI PARK, METUPALAYAM ROAD, COIMBATORE",641043
2328,COIMBATORE,Coimbatore city,SRI CHAITANYA TECHNO SCHOOL,"NO:11,Dr. Nanjappa Road Coimbatore 641018",641018
2329,COIMBATORE,Coimbatore city,SRI CHAITANYA TECHNO SCHOOL,"NO:11,Dr. Nanjappa Road Coimbatore 641018",
2330,COIMBATORE,Coimbatore city,SRI VISWESWARA VIDHYALYA  MATRICULATION HIGHER SECONDARY SCHOOL,494 A SUKRAWARPETGANDHIPARK,641001
2331,COIMBATORE,Coimbatore city,SRPPS Vidhyalaya Matric School,,
2332,COIMBATORE,Coimbatore city,ST ANTONYS HIGH SCHOOL,"ST ANTONY'S HIGH SCHOOL, PULIYAKULAM, COIMBATORE",641045
2333,COIMBATORE,Coimbatore city,ST MARY'S GIRLS HR.SEC.SCHOOL,"1591,TRICHY ROAD, COIMBATORE",641018
2334,COIMBATORE,Coimbatore city,ST MICHAEL'S MATRICULATION SCHOOL,"1284, Big Bazaar StreetCoimbatore",641001
2335,COIMBATORE,Coimbatore city,ST. AGNES GIRLS AIDED MIDDLE SCHOOL,Easwaran Kovil StreetFort. Coimbatore,641001
2336,COIMBATORE,Coimbatore city,ST. FRANCIS ANGLO INDIAN GIRLS HIGH SCHOOL (AIDED),"1591,Trichy Road,Coimbatore-641018",641018
2337,COIMBATORE,Coimbatore city,"ST. JOSEPH'S MATRICULATION HIGHER SECONDARY SCHOOL,COIMBATORE-641018","1591, Trichy Road, Coimbatore",641018
2338,COIMBATORE,Coimbatore city,ST. THERESA GIRLS AIDED MIDDLE SCHOOL,ANTONYS CHURCH BACK SIDEPULIAKUALM,641045
2339,COIMBATORE,Coimbatore city,ST.MARY'S HIGH SCHOOL,"5TH STREET (EXTN) GANDHIPURAM, COIMBATORE",641012
2340,COIMBATORE,Coimbatore city,ST.MICHAEL'S HR.SEC.SCHOOL,"1298 Big Bazaar , coimbatore-641001",641001
2341,COIMBATORE,Coimbatore city,STANES ANGLO INDIAN HIGHER SECONDARY SCHOOL,"1044 AVINASHI ROAD, COIMBATORE - 641 018.",641018
2342,COIMBATORE,Coimbatore city,STANES ICSE SCHOOL,1044AVINASHI ROAD,641018
2343,COIMBATORE,Coimbatore city,STANES SCHOOL CBSE,"1044, AVINASI ROAD,
COIMBATORE- 641018",641001
2344,COIMBATORE,Coimbatore city,SUGUNA INTERNATIONAL  CBSE SCHOOL,"102A, DR. RADHAKRISHNAN ROAD, DOCTORS COLONY, GANDHIPURAM, COIMBATORE",641012
2345,COIMBATORE,Coimbatore city,SUGUNA RIP V MATRICULATION HIGHER.SECONDARY SCHOOL,"102, Dr.Radhakrishnan Road,Doctor's Colony
,Gandhipuram,Coimbatore",641012
2346,COIMBATORE,Coimbatore city,T E LC MIDDLE SCHOOL,ISMAYIL STREETRAJA STREET,641001
2347,COIMBATORE,Coimbatore city,T.A. RAMALINGAM CHETTIAR AIDED HIGHER SECONDARY SCHOOL,407 ALAGESAN ROAD COIMBATORE 641011,641011
2348,COIMBATORE,Coimbatore city,THE SUBURBAN HR.SEC.SCHOOL,101  RAJAJI RAOD RAMNAGAR COIMBATORE,641009
2349,COIMBATORE,Coimbatore city,TRINITY MATRIC H S S,"1872, TRICHY ROAD, RAMANATHAPURAM, COIMBATORE",641045
2350,COIMBATORE,Coimbatore city,V.C.V SHISHU VIDYODAYA MATRIC HR.SEC SCHOOL,"195,SCHEME ROAD,
RACE COURSE,COIMBATORE.",641018
2351,COIMBATORE,Coimbatore city,VEERASAMY MUDALIAR AIDED HIGH SCHOOL,RAJA STREETCOIMBATORE,641001
2352,COIMBATORE,Coimbatore city,velammal bodhi campus,,
2353,COIMBATORE,Coimbatore city,VIDHYA NIKETAN PUBLIC SCHOOL,"NO. 21/17-18, PULIAKULAM ROAD, COIMBATORE",641045
2354,COIMBATORE,Coimbatore city,VIVEKALAYA MATRICULATION  HIGHER SECONDARY SCHOOL,"1602, TRICHY ROADCOIMBATORE",641018
2355,COIMBATORE,Coimbatore city,Y.W.C.A. MATRIC HR SEC SCHOOL,AVINASHI ROAD COIMBATORE,641018
2356,COIMBATORE,Karamadai,ALAGIRI SURESH GHS ALANGOMBU,SATHI MAIN ROAD\ALANGOMBU,641302
2357,COIMBATORE,Karamadai,AMBAL MATRIC. HR. SEC. SCHOOL,"V.O.C NAGAR , SIRUMUGAI.",641302
2358,COIMBATORE,Karamadai,"BHAGWAN MAHAVEER MUNICIPAL HIGH SCHOOL, SANKAR NAGAR",BHAGWAN MAHAVEER MUNICIPAL HIGH SCHOOL SANKAR NAGAR METTUPALAYAM,641301
2359,COIMBATORE,Karamadai,BHARATH VIDHYA NIKETHAN MATRICULATION SCHOOL,NEAR THEN TIRUPATHI FOUR ROAD\RAMAMPALAYAM,641302
2360,COIMBATORE,Karamadai,BRINDHAVANNA VIDHIALAYA SCHOOL CBSE,Gandhi Nagar Karamadai Mettupalayam,641104
2361,COIMBATORE,Karamadai,C.S.I. MIDDLE SCHOOL,30 ootymain roadmettupalayam,641301
2362,COIMBATORE,Karamadai,"CAREWELL MATRIC HR SEC SCHOOL , METTUPALAYAM","KAMRAJ NAGARMAHADEVAPURAM,METTUPALAYAM",641305
2363,COIMBATORE,Karamadai,CHRIST THE KING MATRIC SCHOOL,"158/3, onnipalayam road, chikkarampalayam post karamadai",641104
2364,COIMBATORE,Karamadai,E.A.B GOVT HR SEC SCHOOL THENPONMUDI,THERAMPALAYAM POST\METTUPALAYAM,641697
2365,COIMBATORE,Karamadai,EXPONICS ACADEMY,"5/1 PRESIDENT COLONY, KARAMADAI,COIMBATORE",
2366,COIMBATORE,Karamadai,"G.M.R.C. MIDDLE SCHOOL, METTUPALAYAM","GMRC MIDDLE SCHOOL, MANIYAKARAN KADU",641301
2367,COIMBATORE,Karamadai,GADW HR SEC SCHOOL WELSPURAM,WELSPURAMNELLITHURAI[PO],641305
2368,COIMBATORE,Karamadai,GHS ILLUPPAPALAYAM,"ILLUPPAPALAYAM,SIRUMUGAI VIA",641302
2369,COIMBATORE,Karamadai,GHS KANNARPALAYAM,"GOVT HIGH SCHOOL KANNARPALAYAM,KARAMADAI",641104
2370,COIMBATORE,Karamadai,GHS PARALI POWER HOUSE,PARALI POWERHOUSE\COIMBATORE,641104
2371,COIMBATORE,Karamadai,GHS THOLAMPALYAM,"GHS. THOLAMPALAYAM,SEELIYUR(PO)",641113
2372,COIMBATORE,Karamadai,"GHSS , BUJANGANUR","BUJANGANUR, SEELIYUR  VIA,COIMBATORE",641113
2373,COIMBATORE,Karamadai,GHSS METTUPALAYAM,TEACHERS COLONY OPP CTC METTUPALAYAM,641301
2374,COIMBATORE,Karamadai,GHSS OOMAPALAYAM,Palapatti Post\Mettupalayam,641305
2375,COIMBATORE,Karamadai,GHSS PETHIKUTTAI,SAKTHI MAIN ROAD PETHIKUTTAI,638459
2376,COIMBATORE,Karamadai,GHSS S.PUNGAMPALAYAM,"S.PUNGAMPALAYAM, THIMMANUR POST",641302
2377,COIMBATORE,Karamadai,GHSS VELLIANGADU,KUNDAH MAIN ROADVELLIANGADU,641104
2378,COIMBATORE,Karamadai,GOVT HR SEC SCHOOL SIRUMUGAIPUDUR,THIPPU SULTHAN ROADSIRUMUGAIPUDUR,641302
2379,COIMBATORE,Karamadai,"GOVT HR SEC SCHOOL, KARAMADAI","Mettupalayam road, Karamadai.",641104
2380,COIMBATORE,Karamadai,"HOLY ANGELS MAT HSS , SELVAPURAM","54, SELVAPURAM, ANNUR ROAD54, SELVAPURAM, ANNUR ROAD",641301
2381,COIMBATORE,Karamadai,KARAMADAI RANGANATHAR MATRICULATION SCHOOL,"S.F.NO 122, SOCIETY COLONY BACKSIDE R.V.NAGAR, KARAMADAI",641104
2382,COIMBATORE,Karamadai,"L.E.F. CHRISTIAN MATRICULATION SCHOOL, BEHIND HOUSING UNIT, METTUPALAYAM.",Housing unitMettupalayam,641301
2383,COIMBATORE,Karamadai,MADONNA MATRIC HR.SEC.SCHOOL,Mangalakarai (Po) Karamadai,641104
2384,COIMBATORE,Karamadai,"MAHAJANA HSS,METTUPALAYAM","MAHAJANA HIGHER SECONDARY SCHOOL , No 2,PAKKUKARA STREET,METTUPALAYAM",641301
2385,COIMBATORE,Karamadai,METRO MAT HR SEC SCHOOL,Coimbatore  road\mettupalayam,641301
2386,COIMBATORE,Karamadai,"MPL GIRLS HSS,METTUPALAYAM",ANNAJI RAO ROADMETTUPALAYAM,641301
2387,COIMBATORE,Karamadai,MUNICIPAL HIGH SCHOOL MANI NAGAR,MUNICIPAL HIGH SCHOOLMANINAGAR,641305
2388,COIMBATORE,Karamadai,NATIONAL MATRIC  HR.SEC.SCHOOL,"NATIONAL MATRIC HR SEC SCHOOL,NATIONAL NAGAR, SIRUMUGAI ROAD,METTUPALAYAM.ATIONAL MATRIC HR SEC SCHOOL, NATIONAL NAGAR, SIRUMUGAI ROAD,
METTUPALAYAM.",641301
2389,COIMBATORE,Karamadai,NAV BHARATH MATRICULATION SCHOOL,MARUDUR KARAMADAI,
2390,COIMBATORE,Karamadai,"PASUPATHIAPPA MIDDLE SCHOOL, KARAMADAI","10/36 , NORTH CAR STREETKARAMADAI",641104
2391,COIMBATORE,Karamadai,"PUM SCHOOL, IRUMBARAI","PUMS IRUMBARAI, IRUMBARAI & POST, PUNJAI PULIYAMPATTI VIA - 638459",638459
2392,COIMBATORE,Karamadai,PUMS ALATHI VATCHINAMPALAYAM,"ALATHIVACHINAMPALAYAM,PALAPATTI(PO),METTUPA LAYAM.",641302
2393,COIMBATORE,Karamadai,PUMS DHASANUR,"GANAPATHI NAGAR, DHASANUR\DHASANUR",641305
2394,COIMBATORE,Karamadai,PUMS K.PUNGAMPALAYAM,MARUDUR POST\KARAMADAI,641104
2395,COIMBATORE,Karamadai,PUMS KARAMADAI,METTUPALAYAM MAIN ROAD 641104,641104
2396,COIMBATORE,Karamadai,PUMS KENDEPALAYAM,PUMS KendepalayamThekkampatti,641113
2397,COIMBATORE,Karamadai,PUMS MANGALAKARAI PUDUR,MANGALAKARAIPUDUR POKARAMADAI,641104
2398,COIMBATORE,Karamadai,PUMS MOOLATHURAI,"PUMS MOOLATHURAI, ILLUPPAPALAYAM (POST),SIRUMUGAI(VIA)-641302",641302
2399,COIMBATORE,Karamadai,PUMS THEKKAMPATTI,PUMS THEKKAMPAT SEELIYUR VIA THEKAMPATTI,641113
2400,COIMBATORE,Karamadai,"PUMS,BELLEPALAYAM",BELLEPALAYAM Via SIRUMUGAI,641302
2401,COIMBATORE,Karamadai,"PUMS,CHIKKARAMPALAYAM","CHIKKARAMPALAYAM,KARAMADAI-641104",641104
2402,COIMBATORE,Karamadai,"PUMS,CHINNAKUMARAPALAYAM",PUMS CHINNAKUMARAPALAYAMMOODUTHURAI,638459
2403,COIMBATORE,Karamadai,"PUMS,CHINNATHOTTIPALAYAM",CHINNATHOTTIPALAYAMBELLATHI PO,641104
2404,COIMBATORE,Karamadai,"PUMS,GOBANARI","PUMS, Gobanari, Tholampalayam (p.o.), Seeliyur via,Coimbatore district",641113
2405,COIMBATORE,Karamadai,"PUMS,JADAYAMPALAYAM","JADAYAMPALAYAM
Sirumugai post",641302
2406,COIMBATORE,Karamadai,"PUMS,KUTTAIYUR",PUMS KUTTAIYURKARAMADAI,641104
2407,COIMBATORE,Karamadai,"PUMS,LINGAPURAM","ELANGOVADIGAL
STREET,LINGAPURAM,ILLUPPAPALAYAM(PO)SIRUMUG AI.",641302
2408,COIMBATORE,Karamadai,"PUMS,M.KOUNDAMPALAYAM","PUMS,M.KOUNDAMPALAYAM,MOODUTHURAI",638459
