S NO,DISTRICT,BLOCK NAME,SCHOOL NAME,SCHOOL ADDRESS,PINCODE
2639,COIMBATORE,Periyanaickan Palay,VIDYA VIKASINI MATRIC HR.SEC SCHOOL,"66-D, METTUPALAYAM ROAD, THUDIYALUR, COIMBATORE",641034
2640,COIMBATORE,Periyanaickan Palay,VIDYA VIKASINI OPPORTUNITY SCHOOL,"66-D, Mettupalayam Road, Thudiyalur, Coimatore",641034
2641,COIMBATORE,Periyanaickan Palay,VIVEKAM MATRIC HR SEC SCHOOL NO.4.VEERAPANDI,"33, No.4 Veerapandi Road,Press Colony (Po), Coimbatore.",641019
2642,COIMBATORE,Periyanaickan Palay,WVS SPECIAL SCHOOL,"Indira Priyadarshini Building, Ramaswamy NagarKoundampalayam",641030
2643,COIMBATORE,Periyanaickan Palay,YOUCAN SPECIAL SCHOOL,"8/1-7, Siruvani scheme road,siruvani nagar, veerakeralam, coimbatore",641041
2644,COIMBATORE,Periyanaickan Palay,YUVA PUBLIC SCHOOL,3/71-1 NaickenpalayamPeriyanaickenpalayam Coimbatore,641020
2645,COIMBATORE,Periyanaickan Palay,YUVABHARATHI PUBLIC SCHOOL,"17/1, Yuva Enclave, Thudiyalur RoadSomayampalayam Post, Kanuvai, Coimbatore.",641108
2646,COIMBATORE,Perur,AIDED HIGH SCHOOL CBM SAKUNDHALA VIDHYALAYA,123 N-Block\Kovaipudur,641042
2647,COIMBATORE,Perur,AMRIT CENTRE FOR SPECIAL NEEDS,"34, mettupalayam road coimbatorenil",641043
2648,COIMBATORE,Perur,AMRITA VIDYALAYAM CBSE SCHOOL,"RAMASAMY NAGAR EXTN IIALLAMPALAYAM, GANAPATHY POST",641006
2649,COIMBATORE,Perur,APG Matric Hr. Sec. School,,
2650,COIMBATORE,Perur,APG Matriculation Higher Secondary School,,
2651,COIMBATORE,Perur,ASHRAM MATRICULATION HR SEC SCHOOL KOVAIPUDUR,A-138/B1KOVAIPUDUR,641042
2652,COIMBATORE,Perur,"AVILA CONVENT MATRICULATION HR SEC SCHOOL, VELANDIPALAYAM","THADAGAM ROAD, VENKITAPURAM, VELANDIPALAYAM, COIMBATORE",641025
2653,COIMBATORE,Perur,C.S ACADEMY CBSE SCHOOL,"262,VLB Engineering CollegeKovai Hills,Kovaipudur",641042
2654,COIMBATORE,Perur,CHS KOVILMEDU,THILAGAR STREET KOVILMEDU,641025
2655,COIMBATORE,Perur,CHS KUPPAKONAMPUDUR,"MANIYAM VELAPPAR STREET\K.K.PUDUR, COIMBATORE",641038
2656,COIMBATORE,Perur,CHS PAPPANAICKENPUDUR,"corporation high school pappanaickenpudur, coimbatore",641041
2657,COIMBATORE,Perur,CHSS MANIYAKARANPALAYAM,"1 BHARATHIYAR ROAD ,MANIYAKARANPALAYAM, GANAPATHY ,CBE",641006
2658,COIMBATORE,Perur,CHSS RATHINAPURI,"NEHRU STREET ,RATHINAPURI",641027
2659,COIMBATORE,Perur,CHSS VENKITTAPURAM,G C T POST VENKITTAPURAM COIMBATORE,641013
2660,COIMBATORE,Perur,"CMS AIDED HIGH SCHOOL (MALAYALAM), GANAPATHY, COIMBATORE 641006",SATHY  MAIN ROADGANAPATHY,641006
2661,COIMBATORE,Perur,"CMS MATRICULATION HR SEC SCHOOL, GANAPATHY","SATHY MAIN ROAD, GANAPATHY",641006
2662,COIMBATORE,Perur,CMS RAMAKRISHNAPURAM,"CORPORATION MIDDLE SCHOOL, RAMAKRISHNAPURAMGANAPATHY",641006
2663,COIMBATORE,Perur,CMS SANGANUR,SAMYGOUNDER STREETSANGANOOR,641027
2664,COIMBATORE,Perur,"CMS VIDYA MANDIR MATRIC HR SEC SCHOOL, MANIAKARAMPALAYAM","BHARATHIYAR ROADMANIYAKARANPALAYAM, COIMBATORE",641006
2665,COIMBATORE,Perur,"CORPORATION HIGH SCHOOL, RAMASAMY NAGAR, NALLAMPALAYAM ROAD.","CORPORATION HIGH SCHOOL RAMASAMYNAGAR, NALLAMPALAYAM ROAD.",641030
2666,COIMBATORE,Perur,CS ACADEMY INTERNATIONAL,,
2667,COIMBATORE,Perur,EINSTEIN PUBLIC MATRICULATION SCHOOL,"392, RABINDRANATH TAGORE ROADGANAPATHY, COIMBATORE",641006
2668,COIMBATORE,Perur,"ELLAPPA MATRICULATION SCHOOL, KUNIAMUTHUR","NO.25 PALANI ANDAVAR KOVIL STREETKUNIAMUTHUR
, COIMBATORE,TAMILNADU",641008
2669,COIMBATORE,Perur,ELSIE MATRICULATION HR SEC SCHOOL,"186SANGANOOR ROAD, GANAPATHY, COIMBATORE",641006
2670,COIMBATORE,Perur,EQUITAS GURUKUL MATRIC.HR.SEC .SCHOOL,"744/3B, CTO Colony, Phase II, Madukkarai Main Road, Sundarapuram",641021
2671,COIMBATORE,Perur,GHS EDAYARPALAYAM,"CHURCH STREET,
EDAYARPALAYAM, KUNIYAMUTHUR PO.,",641008
2672,COIMBATORE,Perur,GHS GANDHIMANAGAR,GOVERNMENT HIGH SCHOOL\GANDHIMANAGAR,641004
2673,COIMBATORE,Perur,GHS KAMARAJ NAGAR,GOVERNMENT HIGH SCHOOLKAMARAJ NAGAR,641021
2674,COIMBATORE,Perur,GHS KUNIYAMUTHUR,"GHS KUNIYAMUTHUR, RICE MILL ROAD, KUNIYAMUTHUR",641008
2675,COIMBATORE,Perur,GHS SUGUNAPURAM,SUGUNAPURAMPALAKKAD MAIN ROAD,641008
2676,COIMBATORE,Perur,GHSS KULATHUPALAYAM,"GHSS, KULATHUPALAYAM, KOVAIPUDHUR, COIMBATORE",641042
2677,COIMBATORE,Perur,GHSS KUNIYAMUTHUR,"PALAKKAD MAIN  ROADKUNIAMUTHUR,",641008
2678,COIMBATORE,Perur,GHSS KURICHI,"GOVERNMENT HIGHER SECONDARY SCHOOL, KURICHICOIMBATORE",641024
2679,COIMBATORE,Perur,GHSS SUNDAKKAMUTHUR,"GHSS SUNDAKKAMUTHUR,COIMBATORE",641010
2680,COIMBATORE,Perur,"GHSS, GANAPATHY","GOVT Hr Sec School, GanapathyCOIMBATORE",641006
2681,COIMBATORE,Perur,"GREEN GARDEN MATRICULATION SCHOOL , KURICHI","GREEN GARDEN MATRICULATION
SCHOOLVENKATACHALAPATHY  NAGAR, KURICHI. SUNDARAPURAM POST , COIMBATORE",641024
2682,COIMBATORE,Perur,GURUKULAM HIGH SCHOOL,NETHAJI NAGARKOVAIPUDUR,641042
2683,COIMBATORE,Perur,INFANT JESUS MATRICULATION HR SEC SCHOOL,"SANGANURRATHINAPURI, COIMBATORE",641027
2684,COIMBATORE,Perur,Kasturi Matriculation Hr.Sec.School,29-A SUGUNAPURAMKUNIAMUTHUR POST,641008
2685,COIMBATORE,Perur,KOVAI KALAIMAGAL MATRICULATION HR SEC SCHOOL,"KR PURAM, PN PALAYAM ROAD,GANAPATHY, COIMATORE",641006
2686,COIMBATORE,Perur,"KPM MATRICULATION HR SEC SCHOOL, EACHANARI","POLLACHI MAIN ROAD, EACHANARI (PO)",641021
2687,COIMBATORE,Perur,MEWS MATRICULATION SCHOOL POTHANUR MAIN,THIRUMARAI NAGARPODANUR,641023
2688,COIMBATORE,Perur,"MILTON MATRICULATION SCHOOL, CHOKKAMPUDUR","12 A, N.S.K STREET, DR.RAJARATHINAM NAGARSELVAPURAM",641026
2689,COIMBATORE,Perur,MJ VINCENT MATRICULATION HR.SEC.SCHOOL,"SF NO 27 GANDHIMANAGAR, PEELAMEDU , COIMBATORE",641004
2690,COIMBATORE,Perur,MOTHER LAAND MATRIC HR SEC SCHOOL,"BHARATHI ROAD, TELUNGUPALAYAM, COIMBATORE",641039
2691,COIMBATORE,Perur,MOUNT CARMEL MATRICULATION HIGHER SECONDARY SCHOOL,"CARMEL NAGAR, PODANUR, COIMBATORE",641023
2692,COIMBATORE,Perur,NARAYANA E-TECHNO SCHOOL,,
2693,COIMBATORE,Perur,NIRMALA MATHA CONVENT SCHOOL,"Nirmala Matha Convent School - ICSE / ISC, Kuniamuthur, Coimbatore - 641008.",641001
2694,COIMBATORE,Perur,"NIRMALAMATHA CONVENT MAT HR SEC SCHOOL, KUNIAMUTHUR","27-F\SIRUVANI ROAD,KUNIAMUTHUR",641008
2695,COIMBATORE,Perur,"NISE ACADEMY, POTHANUR","130, Podanur Main Road, Podanur",641023
2696,COIMBATORE,Perur,"NS MATRICULATION HR SEC SCHOOL, KUNIYAMUTHUR","kurinji nagar,kuniamuthur,coimbatore-8",641008
2697,COIMBATORE,Perur,ORISON ACADEMY SENIOR SECONDARY SCHOOL,"S.F.Nos:669/2A, 669/6A, Madukkarai Road, Eachanari",641021
2698,COIMBATORE,Perur,PANDIT NEHRU MATRIC HR.SEC.SCHOOL,"opp kurichi housing unit,sidco(post)opp kurichi housing unit,sidco(post),cbe",641021
2699,COIMBATORE,Perur,PEEPAL PRODIGY SCHOOL,"S.F.No.733/1B, 734/1B, 735/2,736/1A, Kurichi
VillageKuniyamuthur, Coimbatore",641008
2700,COIMBATORE,Perur,PRESENTATION CONVENT MATRICULATION HR SEC SCHOOL,"No  : 126 , Trinity Nagar , Madukkarai Road , Sidco (P) , Coimbatore",641021
2701,COIMBATORE,Perur,PRISTINE NURSERY & PRIMARY SCHOOL,,
2702,COIMBATORE,Perur,"PSG HIGH SCHOOL, VEDAPATTI","PSG  HIGH SCHOOL,THONDAMUTHUR ROAD,VEDAPATTI.",641007
2703,COIMBATORE,Perur,PUMS ECHANARI,EachanariEachanari,641021
2704,COIMBATORE,Perur,PUMS GANESAPURAM,"PERUR PANCHAYAT UNION MIDDLE SCHOOL GANESHAPURAM, WARD 100, VINAYAGAR KOIL
STREET, PODANUR (P.O.),  COIMBATORE 641023",641023
2705,COIMBATORE,Perur,PUMS GANESAPURAM,"GANESHAPURAM, WARD 100, VINAYAGAR KOIL STREET, PODANUR (P.O.),  COIMBATORE 641023",
2706,COIMBATORE,Perur,PUMS KONAVAIKALPALAYAM,"PUMS,KONAVAIKKAL PALAYAM",641023
2707,COIMBATORE,Perur,PUMS METTUR,"NACHIMUTHU GOUNDER STREET,METTURPODANUR COIMBATORE",641023
2708,COIMBATORE,Perur,PUMS NOYYALPALAM,"IX  STREET, N.P. ITTERI,
KURICHI PIRIVU, PODANUR-641023",641023
2709,COIMBATORE,Perur,PUMS PERUR,NORTH CAR STREETPERUR,641010
2710,COIMBATORE,Perur,RAILWAY HIGH SCHOOL,Near S&T WorkShopPodanur,641023
2711,COIMBATORE,Perur,RATHINAM INTERNATIONAL PUBLIC SCHOOL,"Rathinam Techzone, Madukkarai RoadEachanari",641021
2712,COIMBATORE,Perur,RKV Senior Secondary School,"604, Edayarpalayam Pirivu,Kuniyamuthur, Palakkad Main Road, Coimbatore",641008
2713,COIMBATORE,Perur,RUKMANI KANNAN VIDYALAYA MATRICULATION HR SEC SCHOOL,"U-BLOCK, KOVAIPUDUR COIMBATORE",641042
2714,COIMBATORE,Perur,"S.E.S MATRICULATION HR SEC SCHOOL, GANAPATHY","No:60-B31-A, Maniakarampalayam Road Ganesh Layout,Ganapathy, Coimbatore",641006
2715,COIMBATORE,Perur,SAIBABA VID.MDL SCH.SB KOIL,MTP ROADSAIBABA KOVIL CAMPUS,641043
2716,COIMBATORE,Perur,SANGAMAM MATRICULATION SCHOOL,KAMATCHI NAGAR\RATHINAPURI,641027
2717,COIMBATORE,Perur,SARASWATHI RAMACHANDRAN VIDYALAYA MATRIC HR.SEC SCHOOL,"NO.216, SRV SCHOOL ROAD,EDAYARPALAYAM, KUNIAMUTHUR",641008
2718,COIMBATORE,Perur,"SBOA MATRICULATION HR SEC SCHOOL,CHOKKAMPUDUR","29, CHOKKAMPUDURCOIMBATORE",641039
2719,COIMBATORE,Perur,SETHU VIDYALAYA MATRICULATION HR SEC SCHOOL,"393/1,2, THONDAMUTHUR ROAD, KURUMBAPALAYAMNIL",641007
2720,COIMBATORE,Perur,SFV GHSS SEERANAICKENPALAYAM,SUGARCANE MAIN ROADSEERANAICKENPALAYAM,641007
2721,COIMBATORE,Perur,SHIRUSHTI VIDHYALAYA MATRIC HR SEC SCHOOL,"SHIRUSHTI VIDHYALAYA MATRIC HR SEC SCHOOL,211
A, IDUMBAN KOIL STREET,SELVAPURAM,COIMBATORE- 26.",641026
2722,COIMBATORE,Perur,Shri Meenakshi Matric Higher Secondary School,,
2723,COIMBATORE,Perur,SIDHAR GNANA PEEDAM SENIOR SECONDARY SCHOOL,"M.S.GARDEN, 43/2D, VOC,NAGAR, SUNDAKKAMUTHUR POST, KOVAIPUDUR, COIMBATORE-641042",641042
2724,COIMBATORE,Perur,SINDHI INTERNATIONAL SCHOOL,"Dr.Ambethkar Road,Velandipalayam,Coimbatore",
2725,COIMBATORE,Perur,SINDHI VIDYALAYA MATRICULATION HR SEC SCHOOL,170 DR.AMBEDKAR ROADVELANDIPALAYAM,641025
2726,COIMBATORE,Perur,SREE NARAYANA MISSION MATRICULATION HR SEC SCHOOL,sundakkamuthur main roadkuniyamuthur,641008
2727,COIMBATORE,Perur,SRI SOWDESWARI VIDYALAYA MATRIC HR SEC SCHOOL,"129(p),130(p), RAMAMURTHY ROAD, SELVAPURAM, COIMBATORECOIMBATORE",641026
2728,COIMBATORE,Perur,SRI VAIDEESWARA VIDYALAYAM AIDED MIDDLE SCHOOL,"10 - Muthaiah Udayar StreetTelungupalayam, Coimbatore",641039
2729,COIMBATORE,Perur,SRI VISWESWARA MATRICULATION HR SEC SCHOOL,"22 ASTALAKSHMI NAGARMADUKKARAI ROAD, SUNDARAPURAM",641024
2730,Coimbatore,Perur,"St Mary's Matriculation School Edayarpalayam
Coimbatore",,
2731,COIMBATORE,Perur,ST THOMAS AIDED HIGHER SECONDARY SCHOOL,K K PUDUR(N)COIMBATORE,641038
2732,COIMBATORE,Perur,"ST.JOSEPH'S MIDDLE SCHOOL, PODANUR","Church Road,Podanur,Coimbatore",641023
2733,COIMBATORE,Perur,T V SEKHARAN MEMORIAL MATRICULATION HR SEC SCHOOL,"5/7 A PERUR ROAD, GOKULAM COLONY KOVAIPUDUR COIMBATORE",641042
2734,COIMBATORE,Perur,"THAVATHIRU SANDHALINGA ADIKALAR AIDED HIGHER SECONDARY SCHOOL, PERUR","T S A HR SEC SCHOOL SIRUVANI MAIN ROAD, PERUR,COIMBATORE",641010
2735,COIMBATORE,Perur,THE CAMFORD INTERNATIONAL SCHOOL,SF NO: 574/1 ManiyakaranpalayamGanapathy,641006
2736,COIMBATORE,Perur,THE HARVEE SCHOOL,,
2737,COIMBATORE,Perur,THE LITTLE KINGDOM MATRICULATION SCHOOL,Ganapathy ManagarGanapathy,641006
2738,COIMBATORE,Perur,V.L.B JANAKIAMMAL AIDED GIRLS HIGH SCHOOL,"VASANTHAM NAGAR\KUNIYAMUTHUR, COIMBATORE",641008
2739,COIMBATORE,Perur,V.S.SENGOTTAIAH MEMORIAL AIDED HIGH SCHOOL,"KURICHI, SUNDARAPURAMCOIMBATORE",641024
2740,COIMBATORE,Perur,V.V.VANI VIDYALAYA MATRIC.HR.SEC.SCHOOL,"27/1,27/2,SRP Nagar,2nd Cross, Near Sri Narayana Guru Road,Saibaba colony",641011
2741,COIMBATORE,Perur,VASAVI VIDYALAYA MATRICULATION HR SEC SCHOOL,"Telungupalayam Pirivu, Perur Main Road, Coimbatore.",641039
2742,COIMBATORE,Pollachi north,ARAM PUBLIC SCHOOL,,
2743,COIMBATORE,Pollachi north,ARB INTERNATIONAL SCHOOL,"PALAKKAD ROADTHALAKKARAI VILLAGE,ZAMINMUTHUR,POLLACHI",642005
2744,COIMBATORE,Pollachi north,BHARATH VIDHYA NIKKETAN MHSS ACHIPATTI,BHARATH VIDHYA NIKKETAN MHSSpollachi,642002
2745,COIMBATORE,Pollachi north,CENTRAL HIGH SCHOOL A NAGORE,"CENTRAL HSS, A.NAGORE",642205
2746,COIMBATORE,Pollachi north,CHANGAVI VIDHYAA MANDIR MAT HR SEC SCHOOL,2/1  MarampudungigoundenputhurEaripatti Post,642205
2747,COIMBATORE,Pollachi north,DISHA A LIFE SCHOOL,"Kullakkapalayam Pirivu,P.K.D. College Road,\Achipatti Post,Pollachi Taluk",642002
2748,COIMBATORE,Pollachi north,GGHS NEGAMAM,"GGHS NEGAMAM , POLLACHI (T.K), COIMBATORE- 642120",642120
2749,COIMBATORE,Pollachi north,GHS DEVAMBADI KALIPALAYAM,"GOVERNMENT HIGH SCHOOL, DEVAMBADI KALIPALAYAM\POLLACHI",642005
2750,COIMBATORE,Pollachi north,GHS R.GOPALAPURAM,"R.GOPALAPURAM, MANNUR, POLLACHI",642005
2751,COIMBATORE,Pollachi north,GHSS Negamam,DHALI ROAD \ periya negamam,642120
2752,COIMBATORE,Pollachi north,GHSS PURAVIPALAYAM,NADUPPUNI ROAD\ZAMINPURAVIPALAYAM,642110
2753,COIMBATORE,Pollachi north,GOVERNMENT HIGH SCHOOL GOLLAPATTI,GHS GOLLAPATTI ERIPATTI (PO) 642205,642205
2754,COIMBATORE,Pollachi north,GOVERNMENT HIGH SCHOOL PULIYAMPATTI,palladaam roadnear udayakrishna ghee company,642002
2755,COIMBATORE,Pollachi north,GOVERNMENT HIGHER SECONDARY SCHOOL MANNUR RAMANATHAPURAM,GHSS MANNUR RAMANATHAPURAM\POLLACHI,642005
2756,COIMBATORE,Pollachi north,JK PUBLIC HIGHER SEC SCHOOL,DHARAPURAM ROADA.NAGORE,642205
2757,COIMBATORE,Pollachi north,KESHAV VIDHYA MANDIR MHSS POLLACH,"64/H PALAKKAD ROAD, POLLACHI64/H PALAKKAD ROAD, POLLACHI",642001
2758,COIMBATORE,Pollachi north,MAHARISHI INTERATIONAL SCHOOL,new colonyzaminmuthur,642005
2759,COIMBATORE,Pollachi north,MUTHUSAMY GOUNDER MATRICULATION HIGHER SECONDARY  SCHOOL R.GOPALAPURAM,"R.GOPALAPURAMMANNUR PO, POLLACHI",642005
2760,COIMBATORE,Pollachi north,P.A.INTERNATIONAL SCHOOL,PALLADAM ROADPULIAMPATTI,642002
2761,COIMBATORE,Pollachi north,PANCHAYAT UNION MIDDLE SCHOOL BODIPLAYAM,"PUMS, BODIPALAYAMZAMIN UTHUKULI POST, POLLACHI",642004
2762,COIMBATORE,Pollachi north,PANCHAYAT UNION MIDDLE SCHOOL KOLLUPALAYAM,PUM SCHOOLKOLLUPALAYAM,642107
2763,COIMBATORE,Pollachi north,PANCHAYAT UNION MIDDLE SCHOOL ERIPATTI,ERIPATTI(POST)POLLACHI(T.K),642205
2764,COIMBATORE,Pollachi north,PANCHAYAT UNION MIDDLE SCHOOL RAMAPATTINAM,"PANCHAYAT UNION MIDDLE SCHOOL, RAMAPATTINAM, POLLACHI(NORTH).",642005
2765,COIMBATORE,Pollachi north,PANCHAYAT UNION MIDDLE SCHOOL THAPPATTAIKILAVAN PUDUR,"PANCHAYAT UNION MIDDLE SCHOOL,THAPPATAI
KILAVAN PUDUR,POLLACHI NORTH\COIMBATORE (DIST)",642005
2766,COIMBATORE,Pollachi north,PANCHAYAT UNION MIDDLE SCHOOL THIPPAMPATTY,"PUMS,THIPPAMPATTY, POLLACHI NORTH.PUMS, THIPPAMPATTY, POLLACHI NORTH.",642107
2767,COIMBATORE,Pollachi north,"PANCHAYAT UNION MIDDLE SCHOOL, R.PONNAPURAM",PUMS SCHOOLR PONNAPURAM,642002
2768,COIMBATORE,Pollachi north,PKD MAT HSS,"PKD MHSS,KOVAI ROAD POLLACHI TK",642002
2769,COIMBATORE,Pollachi north,PUMS ACHIPATTI,"PANCHAYAT UNION MIDDLE SCHOOL ACHIPATTI, POLLACHI -642002",642002
2770,COIMBATORE,Pollachi north,PUMS ALAMPALAYAM,ALAMPALAYAMERIPATTY PO,642205
2771,COIMBATORE,Pollachi north,PUMS ALAMPALAYAM,ALAMPALAYAM ERIPATTY PO,
2772,COIMBATORE,Pollachi north,PUMS JALATHUR,"PUM SCHOOL, JALATHURDEVEMPADDI VALSU POST",642005
2773,COIMBATORE,Pollachi north,PUMS JAMIN MUTHUR,T.NALLIGOUNDANPALAYAM ROADZAMINMUTHUR,642005
2774,COIMBATORE,Pollachi north,PUMS KONDEGOUNDEN PALAYAM,"KONDEGOUNDANPALAYAM, POLLACHI",642120
2775,COIMBATORE,Pollachi north,PUMS KURUMBAPALAYAM,"P.U.M,SCHOOL,
KURUMBAPALAYAM, ML PURAM (PO),",642002
2776,COIMBATORE,Pollachi north,PUMS P.NAGORE,"p.u.m.s.p.nagore,servaikaranpalayam (pa)\M.G.PUDUR POST",642005
2777,COIMBATORE,Pollachi north,PUMS T.NALLIGOUNDANPALAYAM,Mahalakshmi nagarZamin Muthur road,642005
2778,COIMBATORE,Pollachi north,PUMS THOPPAMPATTY,"HEADMASTER,
P.U.MIDDLE SCHOOL, THOPPAMPATTI, VELLALAPALAYAM(PO),
POLLACHI NORTH",642120
2779,COIMBATORE,Pollachi north,PUMS VADAKKIPALAYAM,sulakkal main road\vadakkipalyam,642110
2780,COIMBATORE,Pollachi north,PUMS VADAKKUKADU,vadakkuakadu\vadakukadu POST,642005
2781,COIMBATORE,Pollachi north,PUMS ZAMINKALIYAPURAM,"PUMS Zamin kaliyapuram,zaminkaliyapuram p.o\Pollachi t.k",642110
2782,COIMBATORE,Pollachi north,RISE MATRICULATION SCHOOL SAMIYANDIPUDUR,"Rise Matriculation School,
Samiyandipudhur, Thimmankuthu .",642005
2783,COIMBATORE,Pollachi north,"SIWALIK MATRIC.HR.SEC. SCHOOL, POLLACHI",A SangampalayamPollachi,642002
2784,COIMBATORE,Pollachi north,"Sri Chinthamani Memorial Matric HSS, Thippampatti",209  NH  roadUDUMALAI-POLLAACHI MAIN RAOD,642107
2785,COIMBATORE,Pollachi north,SUBASH VIDHYA MANDIR MHSS,2/2 A.SANGAMPALAYAMKOVAI ROAD,642002
2786,COIMBATORE,Pollachi north,"SWASTIK MAT SCHOOL, CHINNERIPALAYAM",171 /8a 8b palladam main road\chinneripalayam,642120
2787,COIMBATORE,Pollachi north,VISHWA SISHYA VIDYODAYA SCH,Palladam road\Puliampatti,642002
2788,COIMBATORE,Pollachi south,"ADITYA VIDHYA MANDIR MATRIC. HR. SEC. SCHOOL, SULESWARANPATTI","SULESWARANPATTI(PO),POLLACHI.",642006
2789,COIMBATORE,Pollachi south,ADW HSS THONDAMUTHUR,GOVT ADW HSS THONDAMUTHUR POLLACHI TALUK,642123
2790,COIMBATORE,Pollachi south,AROKIAMATHA MATRICULATION HIGHER SECONDARY SCHOOL,"MAKKINAMPATTI, UDUMALAI ROAD, POLLACHI 642003,MAKKINAMPATTI",642003
2791,COIMBATORE,Pollachi south,"AROKIAMATHA MATRICULATION SCHOOL, POLLACHI","6,MURUGAPPA LAY OUT\MAHALINGAPURAM,POLLACHI.",642002
2792,COIMBATORE,Pollachi south,BHARATIYA VIDYA MANDIR MHSS,"BVM SCHOOLNALLAPPA NAGAR, MAHALINGAPURAM",642002
2793,COIMBATORE,Pollachi south,"CARMEL JYOTHI CMI PUBLIC SCHOOL, UNJAVELAMPATTI","OPP TO AMUTHA SURABI HOTEL,UDUMALAI ROAD,\UNJAVELAMPATTY, POLLACHI",642003
2794,COIMBATORE,Pollachi south,GHS MAKKINAMPATTI,"MAKKINAMPATTI,POLLACHI",642003
2795,COIMBATORE,Pollachi south,"GHSS , ZAMIN UTHUKULI",BODIPALAYAM ROAD\ZAMIN UTHUKULI,642004
2796,COIMBATORE,Pollachi south,GHSS KANJAMPATTI,MALAYANDI KOIL STREETKANJAMPATTI,642003
2797,COIMBATORE,Pollachi south,GHSS SINGANALLUR,Akilandapuram (po)Singanallur,642004
2798,COIMBATORE,Pollachi south,GOOD SHEPHERD MATRIC HIGHER SECONDARY SCHOOL,"Thendral Nagar, SuleeswaranpattiPollachi",642006
2799,COIMBATORE,Pollachi south,GOOD SHEPHERD MATRIC HIGHER SECONDARY SCHOOL,"Thendral Nagar, Suleeswaranpatti Pollachi",
2800,COIMBATORE,Pollachi south,"GOVERNMENT HIGH SCHOOL,S.MALAYANDIPATTINAM","S.Malaiyandipattinam,S.Malaiyandipattinam post,Pollachi.",642205
2801,COIMBATORE,Pollachi south,"GOVERNMENT HIGHER SECONDARY SCHOOL,GOMANGALAMPUDUR","GHSS,GOMANGALAMPUDUR POLLACHI, 642107",642107
2802,COIMBATORE,Pollachi south,"GOVT GIRLS HR.SC.SCHOOL, POLLACHI","GGHSS, NETHAJI ROAD, POLLACHI.",642001
2803,COIMBATORE,Pollachi south,HONEY BUNCH SCHOOL,"1/312 THOPPAMPATTI,VELALLAPALAYAM(PO)",642120
2804,COIMBATORE,Pollachi south,"MARIAMMAL GIRLS HIGHER SECONDARY SCHOOL, POLLACHI",BHARATHI STREET MAHALINGAPURAM,642002
2805,COIMBATORE,Pollachi south,MGHSS POLLACHI,KOTTUR ROADPOLLACHI,642001
2806,COIMBATORE,Pollachi south,MMS VENKATRAMANAN RD,"MUNICIPAL MIDDLE SCHOOL, VENKATARAMANAN STREET, POLLACHI",642001
2807,COIMBATORE,Pollachi south,"MMS, BALAGOPALAPURAM ST","BALAGOPALAPURAM STREET, POLLACHI",642001
2808,COIMBATORE,Pollachi south,"MMS, MARAPETTAI ROAD","MUNICIPAL MIDDLE SCHOOL, MARAPPETTAI, POLLACHI",642001
2809,COIMBATORE,Pollachi south,"MMS,VADUGAPALAYAM",manimegalai street \vadugapalayam,642001
2810,COIMBATORE,Pollachi south,"MMS,VSRA","chairman  street,Pollachi.",642001
2811,COIMBATORE,Pollachi south,"MUNICIPAL BOYS HR. SEC. SCHOOL, POLLACHI","PALAKKAD ROAD,POLLACHI",642001
2812,COIMBATORE,Pollachi south,MUNICIPAL MIDDLE SCHOOL KOTTUR ROAD,"MUNICIPAL MIDDLE SCHOOL , KOTTUR  ROAD POLLACHI SOUTH",642001
2813,COIMBATORE,Pollachi south,MUNICIPAL MIDDLE SCHOOL RAMAKRISHNA NAGAR,"1,KAMATCHI NAGAR,POLLACHI-1",642001
2814,COIMBATORE,Pollachi south,"MUNICIPAL MIDDLE SCHOOL,,ABT ROAD","ABT ROAD,MMS-POLLACHI",642001
2815,COIMBATORE,Pollachi south,NACHIAR - THE WORLD SCHOOL,"56 MEENKARAI ROAD, ZAMIN UTHUKULI, POLLACHI",
2816,COIMBATORE,Pollachi south,NACHIAR VIDYALAYAM MHSS,"56 MEENKARAI ROAD,
ZAMIN UTHUKULI,POLLACHI.",642004
2817,COIMBATORE,Pollachi south,NGNG HSS REDDIARUR,"NGNGHR SEC SCHOOL,REDDIARURPOLLACHI (TK),COIMBATORE",642007
2818,COIMBATORE,Pollachi south,OUR LADY OF LOURDES MATRIC HR SEC SCHOOL,PALLADAM ROAD\T.KOTTAMPATTI,642002
2819,COIMBATORE,Pollachi south,"P.L.M.School,POLLACHI","PUNITHA LOURDHANNAI MIDDLE SCHOOL\RAJAMILL ROAD,POLLACHI",642001
2820,COIMBATORE,Pollachi south,"PALANIGOUNDER HIGHER SECONDARY SCHOOL, POLLACHI","Nachimuthu Polytechnic college campus, pollachi\Udumalai road",642003
2821,COIMBATORE,Pollachi south,PANCHAYAT UNION MIDDLE SCHOOL SULEESWARANPATTI,nggo colony suleswaranpatti pollachisuleswaranpatti post pollachi,642006
2822,COIMBATORE,Pollachi south,"PANCHAYAT UNION MIDDLE SCHOOL,KOLARPATTI","PANCHAYAT UNION MIDDLE SCHOOL, KOLARPATTI",642107
2823,COIMBATORE,Pollachi south,"PANCHAYAT UNION MIDDLE SCHOOL,KUNDALPATTI","PANCHAYAT UNION MIDDLE SCHOOL,KUNDALAPATTI LAKSHMAPURAM POST,POLLACHI SOUTH-642107",642107
2824,COIMBATORE,Pollachi south,"PANCHAYATH UNION MIDDLE SCHOOL, KARATTUPALAYAM","KARATUPALAYAM , THONDAMUTHUR POST",642123
2825,COIMBATORE,Pollachi south,PUMS RANGASAMUTHIRAM,"PANCHAYAT UNION MIDDLE SCHOOL, RANGASAMUTHIRAM, SULEESWARANPATTI, POLLACHI.",642006
2826,COIMBATORE,Pollachi south,PUMS SEMBAGOUNDARCOLONY,"PANCHAYAT UNION MIDDLE SCHOOL, SEMBAGOUNDERCOLONYSULEESWARANPATTI,POLLA
CHI",642006
2827,COIMBATORE,Pollachi south,"PUMS, KUNJIPALAYAM",SARAVANA GOUNDAR STREET KUNJIPALAYAM ZAMIN UTHUKULI POLLACHI,642004
2828,COIMBATORE,Pollachi south,"PUMS,AMBARAMPALAYAM",Vinayagar streetAmbaram palayam,642103
2829,COIMBATORE,Pollachi south,"PUMS,NAICKENPALAYAM","PANCHAYAT UNION MIDDLE SCHOOL NAICKENPALAYAM, KARUPPANPALAYAM POST,
POLLACHI SOUTH",642004
2830,COIMBATORE,Pollachi south,"PUMS,SRINIVASAPURAM","SRINIVASPURAM ,POLLACHICOIMBATORE",642004
2831,COIMBATORE,Pollachi south,"PUMS,UNJAVELAMPATTI","PUMS Unjavelampatti,UDUMALAI ROAD",642003
2832,COIMBATORE,Pollachi south,"PUMS,VAKKAMPALAYAM","PANCHAYAT UNION MIDDLE SCHOOL, VAKKAMPALAYAMNAICKENPALAYAM POST",642004
2833,COIMBATORE,Pollachi south,R.V.S MATRICULATION HR SEC SCHOOL,ReddiarmadamReddiarur,642007
2834,COIMBATORE,Pollachi south,SAMATHUR RAMA IYYANKAR MUNICIPAL HR SEC SCHOOL,"MAHALINGAPURAM ,POLLACHI 642 002",642002
2835,COIMBATORE,Pollachi south,SHAANTHI MATRIC HR SEC SCHOOL,"Jothi Nagar,Pollachi",642001
2836,COIMBATORE,Pollachi south,SHAANTHI SCHOOL,,
2837,COIMBATORE,Pollachi south,"SHANTINIKETAN MATRICULATION SCHOOL, POLLACHI","17/2, NALLAPPA STREET, BEHIND DORAIS THEATRE, POLLACHI-642002.",642002
2838,COIMBATORE,Pollachi south,SHENBAGAM MHSS,"106D,MEENKARAI ROAD, ZAMIN UTHUKULI, POLLACHI",642004
2839,COIMBATORE,Pollachi south,SHRI VINAYAGAR MATRIC HIGHER SECONDARY SCHOOL,"BALAJI NAGAR,T.KOTTAMPATTI, POLLAACHI-2",642002
2840,COIMBATORE,Pollachi south,SRI LATHANGI VIDHYA MANDIR MATRIC HR SEC SCHOOL,"Palladam Road, T.Kottampatti, Pollachi",642002
2841,COIMBATORE,Pollachi south,SVGHSS SAMATHUR,"P N ROAD, SAMATHUR,POLLACHI",642123
2842,COIMBATORE,Pollachi south,"TMT. RUKMANIAMMAL HSS, JOTHI NAGAR","D-COLONY,JOTHINAGAR,POLLACHI",642001
2843,COIMBATORE,Pollachi south,VIDYA NETHRRA INTERNATIONAL SCHOOL,"VNI campus,GOMANGALAMPUDUR,POLACHI",642107
2844,COIMBATORE,Pollachi south,VIDYA NETHRRA MATRIC HR SEC SCHOOL,"VNI CAMPUS, POLLACHI-UDUMALPET HIGHWAY,GOMANGALAMPUDHUR",642107
2845,COIMBATORE,Pollachi south,VINAYAGA VIDYODHAYA MATRICULATION SCHOOL,"vadugapalayam to sangampalayam roadvadugapalayam,pollachi",642001
2846,COIMBATORE,Pollachi south,"VISWADEEPTHI MAT HSS, UNJAVELAMPATTI","UNJAVELAMPATTI,MAKKINAMPATTI PO, POLLACHI",642003
2847,COIMBATORE,Pollachi south,"VIVEKANANTHAA VITHYALAYAA MATRIC SCHOOL, KUNCHIPALAYAM",Singanallur main roadKunjipalayam,642004
2848,COIMBATORE,Puduchatram,"GOVERNMENT MODEL SCHOOL, COIMBATORE",,
2849,COIMBATORE,Sarkar Samakkulam,A B C MAT HR SEC SCHOOL,"160,Avarampalayam road, peelamedu , Coimbatore",641004
2850,COIMBATORE,Sarkar Samakkulam,A R N MATRICULATION SCHOOL,"NO-5, IRUGUR ROAD,ONDIPUDUR-16.",641016
2851,COIMBATORE,Sarkar Samakkulam,ADITHYA GLOBAL SCHOOL,"ADHITHYA GLOBAL SCHOOL, KURUMBAPALAYAM, ANNUR TALUK, COIMBATORE",641107
2852,COIMBATORE,Sarkar Samakkulam,ADITHYA INTERNATIONAL SCHOOL,"S.F. No 222, Lakshmi Nagar,Idikarai, Coimbatore",641022
2853,COIMBATORE,Sarkar Samakkulam,ADITHYA PUBLIC MATRICULATION HIGHER SECONDARY SCHOOL,"behind adithya institue of technology, kurumbapalayam",641107
2854,COIMBATORE,Sarkar Samakkulam,ADWAITH G.N.S MAT HR SEC SCHOOL,Adwaith GNS Matric.Hr.Sec.School Sowripalayam Road,641028
2855,COIMBATORE,Sarkar Samakkulam,ALCHEMY PUBLIC SCHOOL,"OPP PPG INSTITUTE OF TECHNOLOGY, SARAVANAMPATTI",641035
2856,COIMBATORE,Sarkar Samakkulam,AMRITA VIDYALAYAM,"KARUPARAYANPALAYM,
KALAPATTI EAST, COIMBATORE-641062",
2857,COIMBATORE,Sarkar Samakkulam,ANAN INTERNATIONAL SCHOOL,"14/283/1, SITRA ROAD,\ KALAPATTI, COIMBATORE",641048
2858,COIMBATORE,Sarkar Samakkulam,ANNAI VELANKANNI MAT HR SEC SCHOOL,UPPILLIPALAYAM MAIN ROAD SOWRIPALAYAM,641028
2859,COIMBATORE,Sarkar Samakkulam,ARM MATRICULATION HIGHER SECONDARY SCHOOL,Shri raman chettiar memorial high schoolvilankurichi road,641035
2860,COIMBATORE,Sarkar Samakkulam,BRILLIANT VIDYA BHAVAN,"84-A, Ammasai gounder st., Saravanampatti - Thudiyalur Road, Vellakinar.",641029
2861,COIMBATORE,Sarkar Samakkulam,BVM GLOBAL CBSE SCHOOL,"No 635, 680/6,681/1 Kathiravan gardens singanallur, coimbatore",641005
2862,COIMBATORE,Sarkar Samakkulam,C R R MAT HR SEC SCHOOL,"119 Ruckmani Garden,Trichy Road Ondipudur",641016
2863,COIMBATORE,Sarkar Samakkulam,C.M.S SIHS COLONY,"CORPORATION MIDDLE SCHOOL, SIHS COLONY,COIMBATORE-14",641014
2864,COIMBATORE,Sarkar Samakkulam,CHANDRA MATRICULATION HR SEC SCHOOL,"Tex Park Road, Civil Aerodrome Post,Coimbatore - 641014",641014
2865,COIMBATORE,Sarkar Samakkulam,CHANDRAKANTHI PUBLIC SCHOOL,TEX PARK ROAD CIVIL AERODROME POST COIMBATORE,641014
2866,COIMBATORE,Sarkar Samakkulam,CHANDRAMARI INTERNATIONAL SCHOOL,"68, Kalapatti to Vilankurichi Road,",
2867,COIMBATORE,Sarkar Samakkulam,CHS VARADHARAJAPURAM,CORPORATION HIGH SCHOOL.VARADHARAJA PURAM,641015
2868,COIMBATORE,Sarkar Samakkulam,CHSS UDAYAMPALAYAM,"UDAYAMPALAYAM MAIN ROAD,UDAYAMPALAYAM",641028
2869,COIMBATORE,Sarkar Samakkulam,"CHSS,PEELAMEDU","pioneer mill road,peelamedu",641004
2870,COIMBATORE,Sarkar Samakkulam,CMS KRISHNAPURAM,IYER LAYOUT\KRISHNAPURAM,641005
2871,COIMBATORE,Sarkar Samakkulam,CMS KRISHNARAYAPURAM,"SHOBHA NAGAR,AVARAMPALAYAM",641006
2872,COIMBATORE,Sarkar Samakkulam,CMS MASAKALIPALAYAM,"Masakalipalayam,uppilipalayam (post)",641015
