S NO,DISTRICT,BLOCK NAME,SCHOOL NAME,SCHOOL ADDRESS,PINCODE
1661,CHENNAI,Perambur,LOURDES MAT SCHOOL,"No.30, Bunder Garden StreetPerambur,Chennai",600011
1662,CHENNAI,Perambur,MAHARISHI VIDYA MANDIR MATRICULATION HIGHER SECONDARY SCHOOL,"78, SOLAI STREETAYANAVARAM",600023
1663,CHENNAI,Perambur,MODEL MAT HSS,Jawahar nagar/Agaram,600082
1664,CHENNAI,Perambur,N.S.P. VIDHYAPEETAM,"274, M.T.H. Road,Villivakkam , Chennai",600049
1665,CHENNAI,Perambur,NARAYANA E-TECHNO SCHOOL,NO 240 D SWAMI RAMALINGA COLONY3RD CROSS STREET PONNIAMMANMEDU CHENNAI 600110,600110
1666,CHENNAI,Perambur,OUR  LADY OF VELANGANNI MAT HSS,"NO:2, GANDHI STREET,VILLIVAKKAM, CHENNAI",600049
1667,CHENNAI,Perambur,PERIYAR MATRIC HIGHER SECONDARY SCHOOL,5TH STREETPERIYAR NAGAR,600082
1668,CHENNAI,Perambur,PONNUSWAMY MAT HIGHER SECONDARY SCHOOL,"NO-130,4TH CROSS STREET,KUMARAN NAGAR, CHENNAI-82",600082
1669,CHENNAI,Perambur,PRCA HSS,"10th,street,pananthope railway colony, ayanavaram10th,street,pananthope railway colony, ayanavaram",600023
1670,CHENNAI,Perambur,RADIANCE MAT HSS,"12 -EKENNEDY STREET, G K M COLONY",600082
1671,CHENNAI,Perambur,RAILWAY BALA BHAVAN MAT HSS,"426, 8th STREETAYANAVARAM ,CHENNAI",600023
1672,CHENNAI,Perambur,RAILWAY COLONY HS,"No. 1 Moorse RoadAyanavaram ,Chennai",600023
1673,CHENNAI,Perambur,RAILWAY COLONY MAT HSS,"No:227 , 2nd street , Duncan road , Railway quartersAyanavaram , Chennai.",600023
1674,CHENNAI,Perambur,RAILWAY MIXED HSS,siruvallur raodpermabur,600011
1675,CHENNAI,Perambur,RAMAKRISHNA MATRIC H.S. SCHOOL,"15, ANNAI VELANKANNI NAGARM.M.C., CHENNAI",600051
1676,CHENNAI,Perambur,SDC VIVEKANANDA VIDYALAYA,159 School RoadSakthivel Nagar Chennai,600082
1677,CHENNAI,Perambur,SHRI KRISHNASWAMY VIDYASHRAM,VILLIVAKKAM,600049
1678,CHENNAI,Perambur,SINGARAM PILLAI BOYS HSS,"NO.1 C.T.H.ROAD, VILLIVAKKAM,",600049
1679,CHENNAI,Perambur,SINGARAM PILLAI GIRLS HSS,No 1 Mounaswamy madam street Villivakkam,600049
1680,CHENNAI,Perambur,SINGARAM PILLAI MAT HSS,1 DAMODARAN LANEVILLIVAKKAM,600049
1681,CHENNAI,Perambur,SKDT HSS,"138, SOUTHMADA STREETVillivakkam",600049
1682,CHENNAI,Perambur,SREE AYYAPPA MAT HSS,20-A Thulasingam streetperambur chennai,600011
1683,CHENNAI,Perambur,SRI BALA VIDYALAYA  SCHOOL,"125. Shanthi Nagar, PeramburChennai",600011
1684,CHENNAI,Perambur,SRI BALAJI MAT SCHOOL,NO 11 SECOND STREET KOLATHURCHENNAI,600099
1685,CHENNAI,Perambur,SRI CHAMPALAL  PAGARIYA JAIN HSS,"200/304 PAPER MILLS ROAD,PERAVALLUR",600011
1686,CHENNAI,Perambur,SRI PADMA SARANGAPANI MAT HSS,"NO 11/1 E TYPE SIDCO NAGAR, 92 ND STREET,VILLIVAKKAM  CHENNAI - 49.",600049
1687,CHENNAI,Perambur,ST JOHNS MAT HSS,4TH CROSS STREET BABA NAGAR VILLIVAKKAM,600049
1688,CHENNAI,Perambur,ST JOSEPH AI HSS,"62, SIRUVALLUR ROAD, PERAMBUR, CHENNAI",600011
1689,CHENNAI,Perambur,ST MARYS BOYS MAT HSS,"NO 117 RAGHAVAN STREET, PERAMBUR CHENNAI",600011
1690,CHENNAI,Perambur,ST MARY'S MATRICULATION GIRLS HR. SEC. SCHOOL,NO 37 MADURAI SWAMY MADAM STREETPERAMBUR,600011
1691,CHENNAI,Perambur,ST MOSES MAT SCHOOL,3 JAGANATHAN STREET T. V. k NAGAR,600082
1692,CHENNAI,Perambur,ST. JOSEPH OF ANNECY MATRICULATION SCHOOL,"st.Joseph of Annecy Matriculation School16/30 Dr. Ambedkar Street. Villivakkam, Chennai",600049
1693,CHENNAI,Perambur,ST.MARK'S MATRICULATION SCHOOL SEMBIUM,"45,46, 5th Street, Janakiram NagarSembium, Perambur",600011
1694,CHENNAI,Perambur,TAHA CONVENT MAT SCHOOL,"34/2, Vasudevan Streetperambur",600011
1695,CHENNAI,Perambur,THANGAM MAT SCHOOL,"No.1 Nalliah Naidu streetammalwarpet, Chennai",600012
1696,CHENNAI,Perambur,THE TEMPLE-SCHOOL OF ENLIGHTENMENT,"15 Baba Towers, 200 feet road, Jawaharlal Nehru Salai\Kolathur",600099
1697,CHENNAI,Perambur,VATSALYA MATRICULATION HIGHER SECONDARY SCHOOL,"No.2A, Chelliamman Colony Peravallur, Chennai",600082
1698,CHENNAI,Perambur,VEERA SAVARAKAR NETAJI MATRICULATION SCHOOL,"19,12, chinnasamy street,Agaram",600082
1699,CHENNAI,Perambur,VIVEK VIDYALAYA MID SCH,"NO.18, AVVAI NAGAR, SECOND STREET,KOLATHUR, CHENNAI",600099
1700,CHENNAI,Periamedu,ADW BHSS KANNIGAPURAM,"NO:06,BRIGHTENS ROAD,KANNIGAPURAM,CHENNAI- 600012",600012
1701,CHENNAI,Periamedu,ADW GHSS KANNIGAPURAM,38 VENKEDESAPURAM NEW COLONY KANNIGAPURAM CHENNAI-12,600012
1702,CHENNAI,Periamedu,ADW HS PULIANTHOPE,"Pulianthope High Road,Pulianthope, Chennai.",600012
1703,CHENNAI,Periamedu,ANAIKAR MAT HSS,"No.72B, Sattannan StreetChoolai, Chennai",600112
1704,CHENNAI,Periamedu,BAYNES MEM BAPTIST CHURCH MAT HSS,"115, VEPERY HIGH ROAD PERIAMET, CHENNAI",600003
1705,CHENNAI,Periamedu,C.M.S. 130 AMMAN KOIL STREET,130 amman koil streetkondithop,600001
1706,CHENNAI,Periamedu,C.M.S. 246 MINT STREET,"246, Mint Street, CHENNAI",600003
1707,CHENNAI,Periamedu,C.M.S. 87 ANNAPILLAI STREET,87 annapillai streetsowcarpet,600079
1708,CHENNAI,Periamedu,C.M.S. VK PILLAI,"2/22, V.K. PILLAI ST., CHOOLAI",600112
1709,CHENNAI,Periamedu,C.S.I MIDDLE SCHOOL MM ST,58 mulla streetSOWCARPET,600079
1710,CHENNAI,Periamedu,C.S.I. MIDDLE SCHOOL (CHOOLAI),18 SAMI STREETCHOOLAI,600112
1711,CHENNAI,Periamedu,C.S.I. MIDDLE SCHOOL GM ST,16 GENERAL MUTHIAH STSOWCARPET,600057
1712,CHENNAI,Periamedu,CGHSS MH ROAD,"2A, SCHOOL ROAD, M H ROAD, PERAMBUR",600011
1713,CHENNAI,Periamedu,CHENNAI HIGHER SECONDARY SCHOOL KALYANAPURAM,"567 SATHYA MOORTHY NAGAR, MAIN ROAD, KALYANAPURAM VYASARPDI",600039
1714,CHENNAI,Periamedu,CHRISTIAN HS,"no 188 Perambur barracks road ,pattalam,chennai",600012
1715,CHENNAI,Periamedu,CHS AMMAIAMMAL ST,"15/51, AMMAYAMMAL STREETPULIANTHOPE, CHENNAI",600012
1716,CHENNAI,Periamedu,CHS COOKS ROAD,"chennai high school , 26,cooks road,chennai",600012
1717,CHENNAI,Periamedu,CHS GANESAPURAM,NO.3 SUNDARAM MAIN ROAD VYASARPADI GANESAPURAM,600039
1718,CHENNAI,Periamedu,CHS NP KOIL ST AT SHARMA NAGAR,2 II MAIN ROADSHARMA NAGAR,600039
1719,CHENNAI,Periamedu,CHS THIRUVENGADA SAMY STREET,"NO 7/41 THIRUVENGADA SAMY STREET, PULIANTHOPE",600012
1720,CHENNAI,Periamedu,CHS WALLTAX ROAD,"61,Walltax Road,Elephant gate,Chennai",600079
1721,CHENNAI,Periamedu,CMS DECOSTER ROAD,"45,DECASTER ROAD,PULIANTHOPE, CHENNAI DIST",600012
1722,CHENNAI,Periamedu,CMS EKANGIPURAM,15/2ekangipuram 1st street aynavaram,600023
1723,CHENNAI,Periamedu,CMS GOKULAM,"22/26 cheyur parthasarathy street, perambur",600011
1724,CHENNAI,Periamedu,CMS H&S FACTORY,"5,NARASIMMA NAGAR MAIN STPULLIYANTHOPE",600012
1725,CHENNAI,Periamedu,CMS K K LANE,"1, kuravan kulam lane, Choolai",600112
1726,CHENNAI,Periamedu,CMS MH ROAD,"2A, SCHOOL .ROAD,PERAMBUR",600011
1727,CHENNAI,Periamedu,CMS MOORTHINGAR ST,"48,MOORTHINGAR ST,VYASARPADI,CHENNAI",600039
1728,CHENNAI,Periamedu,CMS NEW KAMARAJ NAGAR,"78, Nehruji Street, Vyasarpadi, Chennai",600039
1729,CHENNAI,Periamedu,CUMS PERAMBUR BARRACKS,"33 Mannarsamy Street, Pulianthope  Chennai",600012
1730,CHENNAI,Periamedu,DON BOSCO HS VEPERY,NO.31 VEPERY HIGH ROAD VEPERY CHENNAI 600007,600019
1731,CHENNAI,Periamedu,DON BOSCO HSS VYASARPADI,"50, Sundaram Street, VyasarpadiChennnai",600039
1732,CHENNAI,Periamedu,DON BOSCO MAT SCHOOL MKB NAGAR,"10A/1, FIRST CROSS ROAD, M.K.B. NAGAR, VYASARPADI, CHENNAI",600039
1733,CHENNAI,Periamedu,DR GURUSWAMY MUDALIAR TTV HR SEC SCHOOL,"108, AMMAN KOIL ST,  SOWCARPET, CHENNAI.",600079
1734,CHENNAI,Periamedu,GANESH BAI GALADA JAIN GIRLS HSS,NO 102 MINT STREET SOWCARPET,600079
1735,CHENNAI,Periamedu,GHSS MKB NAGAR,"3rd MAIN ROAD\MKB. NAGAR, chennai 39.",600039
1736,CHENNAI,Periamedu,GSSV JAIN VIDHYALAYA JUNIOR COLLEGE,"96, NEW NO.154, VEPERY HIGH ROAD,CHENNAI",600007
1737,CHENNAI,Periamedu,H.U.C. MIDDLE SCHOOL,"185, Demellous roadPuliyanthoppu",600012
1738,CHENNAI,Periamedu,HYDER GARDEN MAT SCHOOL,"No.1, Hyder garden Extn, jamalia, chennaiNo.1, Hyder Garden Extn, Jamalia, Chennai",600012
1739,CHENNAI,Periamedu,INDIRA VIVEKANANDA VIDHYALAYA,"no 5,tank bund road,ottery",600012
1740,CHENNAI,Periamedu,KR MONTFORD MAT HSS,"NO. 8 ANANDAVELU STREET, PERAMBURPERAMBUR",600011
1741,CHENNAI,Periamedu,M P DEVADAS HIGH SCHOOL,"73,E H Road, Vyasarpadi,chennai",600039
1742,CHENNAI,Periamedu,MAHARISHI VIDYA MANDIR,"13, R K MUDALI ST,CHOOLAI,CH 112",600112
1743,CHENNAI,Periamedu,MAHARISHI VIDYA MANDIR MATRICULATION SCHOOL,"No .375, Mint Street, Sowcarpet, Chennai - 79",600079
1744,CHENNAI,Periamedu,MANILAL M MEHTA GIRLS HSS,"1,RAVANIER STREET,PARK Town, Chennai 03",600001
1745,CHENNAI,Periamedu,MERCURY MAT HSS,no 102 east avenue mkb nagar chennai 600039,600039
1746,CHENNAI,Periamedu,MOONGIBAI GOENKA GIRLS HSS,"1 &3 RAMANUJAR STREET,SOWCARPET, CHENNAI-
600079",600079
1747,CHENNAI,Periamedu,Motilal Fomra Sanatana Dharma Hss,"17, (OLD NO.26) MANAGAPPAN STREETSOWCARPET, CHENNAI",600079
1748,CHENNAI,Periamedu,PRINCESS MAT HSS,NO.119 PULIANTHOPE HIGH ROAD PULIANTHOPE,600012
1749,CHENNAI,Periamedu,PT LEE Chenglavaraya Naicker HSS,"GOVT.GIRLS HR.SEC.SCHOOLSIDCO NAGAR, VILLIVAKKAM,",600049
1750,CHENNAI,Periamedu,PT MISSION HS,"42,ponnaopa chetty streetparktown",600003
1751,CHENNAI,Periamedu,RAASHIDH MATRICULATION SCHOOL,"461/1, Second Link Road, 6th Main Road, M.K.B Nagar, Chennai 600039",600039
1752,CHENNAI,Periamedu,SEVENTH DAY ADVENTIST HR. SEC SCHOOL (ICSE & ISE),"NO 35 RITHERDON ROAD, VEPERY, CHENNAI-07.",600007
1753,CHENNAI,Periamedu,SEVENTH DAY ADVENTIST MAT SCHOOL,15 NEW MAGAZINE ROAD VYASARPADI,600039
1754,CHENNAI,Periamedu,SHREE AG JAIN HSS,"no.19, tholasingam street",600079
1755,CHENNAI,Periamedu,Shree K.Sugunibai Sanatana Dharma Girls HSS,NO 3 & 4 chinna naikaran streetsowcarpet,600079
1756,CHENNAI,Periamedu,SHRI SANATANA DHARMA VIDYALAYA MAT HSS,"319/358, MINT STREET, SOWCARPET, CHENNAI 79",600079
1757,CHENNAI,Periamedu,SKNS PMC VIV VID JR COLLEGE,"NO.125, THULASINGAM STREET,PERAMBUR, CHENNAI",600011
1758,CHENNAI,Periamedu,SMD HINDU HSS,"18,PONNAPPA STREETPARK TOWN",600003
1759,CHENNAI,Periamedu,SMT  NDJA VIV VID JR COLLEGE,"Smt Narbada Devi J Agarwal Vivekananda Vidyalaya Sr Sec School
III main road, MKB Nagar, Vyasarpadi
Chennai",600039
1760,CHENNAI,Periamedu,SNCP ARYA SAMAJ HS,"NO.33, MANAGAPPAN STREET, SOWCARPET, CHENNAI- 79",600079
1761,CHENNAI,Periamedu,SREE THIRUVOTEESWARAR FREE HIGH SCHOOL,"1,E.V.K. Sampath salai,Vepery, Chennai",600112
1762,CHENNAI,Periamedu,SRI A.B. PAREKH  GUJARATI VIDYAMANDIR HSS,"19 EKAMBARESWARAR AGRAHARAM,PARK TOWN, CHENNAI",600003
1763,CHENNAI,Periamedu,SRI BADALCHAND SCC JAIN VID MS,villivakkamCHENNAI,600049
1764,CHENNAI,Periamedu,SRI J T SURANA JAIN VIDYALAYA,"2, Badri Garden LanePark Town, Chennai",600003
1765,CHENNAI,Periamedu,SRI LAKSHMI NARAYANA MATRICULATION HIGHER SECONDARY  SCHOOL,"plot no. 6-8,17-20. S.R.Main roadS.R.NAGAR",600051
1766,CHENNAI,Periamedu,SRI LGG MAT.HR.SEC  SCHOOL,"No.10, E.K. Agraharam, Park Town, Chennai",600003
1767,CHENNAI,Periamedu,SRI RAMAKRISHNA MATH VIVEKANANDHA CENTENARY GIRLS' HSS,"NO.2, SARAVANA STREET\MINT, CHENNAI",600079
1768,CHENNAI,Periamedu,SRI SUSHWANI MATHA JAIN VIDYALAYA,"11 kutti thambiran street, pulianthope",600012
1769,CHENNAI,Periamedu,SSV HSS,30 EKAMBARESHWARAR KOIL AGRAHARAM STREET PARK TOWN,600049
1770,CHENNAI,Periamedu,ST ALOYSIUS AI HSS,"9 GENERAL COLLINS ROAD, CHOOLAI",600112
1771,CHENNAI,Periamedu,ST JOSEPH'S AI HSS,"31, VEPERY HIGH ROAD\Chennai",600007
1772,CHENNAI,Periamedu,ST MATTHIAS' ANGLO INDIAN HIGHER SECONDARY SCHOOL,"NO.7, CHURCH ROAD, VEPERY, CHENNAI-600 007.",600007
1773,CHENNAI,Periamedu,ST PETERS MAT SCHOOL,44/8 PERUMAL KOIL GARDEN STFIRST LANE SOWCARPET,600017
1774,CHENNAI,Periamedu,St. MARK's MIDDLE SCHOOL,"62/123, VEPERY HIGH ROAD, PERIAMET, CHENNAI - 3",600003
1775,CHENNAI,Periamedu,TERAPANTH JAIN VIDYALAYA MATRIC HSS,VADAMALAI STREETSOWCARPET,600079
1776,CHENNAI,Periamedu,THE HINDU THEOLOGICAL  HSS,"107,Audiappa Naicken  Street,SowcarpetSOWCARPET, CHENNAI",600079
1777,CHENNAI,Periamedu,The Hindu Union Committee HSS,"no 47/23,t k street choolai chennai -112",600112
1778,CHENNAI,Periamedu,THE MADRAS PROGRESSIVE UNION HSS,Sikko NagarVillivakkam,600049
1779,CHENNAI,Periamedu,THE SAIVITE MIDDLE SCHOOL,No 65 Nattu Pillaiyar Koil street Sowcarpet,600079
1780,CHENNAI,Periamedu,THE SHRI RAM UNIVERSAL SCHOOL,"1, South Avenue, Kamaraj Nagar, Thiruvanmaiyur, Chennai - 600041",600041
1781,CHENNAI,Periamedu,TTV HSS,"No.97, Mint StreetSowcarpet",600079
1782,CHENNAI,Periamedu,V.O.C VIDIYALAYAA MATRIC HSS,"NO:66/24, B.B ROAD, PERAMBUR, CHENNAI- 39,GOVINDHARAJALU EDUCATIONAL TRUST # 24 2ND
CROSS LANE, BB ROAD, VYASARPADI, CHENNAI-39",600039
1783,CHENNAI,Periamedu,VEERA SAVARKAR NETHAJI MAT HSS,"NO.106, A.A ROAD ,VYASARPADI, CHENNAI",600039
1784,CHENNAI,Periamedu,VISWA BHARATHI MIDDLE SCHOOL,"No.23/51,T.K.Mudhali street,Choolai,Chennai-112",600112
1785,CHENNAI,Periamedu,WISDOM MATRICULATION SCHOOL,"45 &46 Vedamuthu st., Krishnamoorthy Nagar",600118
1786,CHENNAI,Periamedu,ZPH GUJ KKM MAT SCHOOL,"No:5,Narayana chetty lane, Mint -street , Park town , chennai 600003",600003
1787,CHENNAI,Purasaiwalkkam,ADW HIGH SCHOOL THIRUMANGALAM,"GOVT. A.D.W HIGH SCHOOL,PERIYAR STREETTHIRUMANGALAM, CHENNAI-40",600040
1788,CHENNAI,Purasaiwalkkam,ADW VIRUGAMBAKKAM HIGH SCHOOL,112/36 kali amman koil streetVirugambakkam Chennai,600092
1789,CHENNAI,Purasaiwalkkam,ALAGAPPA MATRICULATION HIGHER SECONDARY SCHOOL,"No: 49, Gangadeeswarar koil stPurasaiwalkkam",600084
1790,CHENNAI,Purasaiwalkkam,ALLWYN MATRIC HIGH SCHOOL,"44/57, KANNAGI STREET,CHOOLAIMEDU, CHENNAI",600094
1791,CHENNAI,Purasaiwalkkam,AMBAL MATRICULATION SCHOOL,"NO: 1,II MAIN ROAD,JAGANATHAN NAGARARUMBAKKAM",600106
1792,CHENNAI,Purasaiwalkkam,ANNA ADARSH MATRIC HR. SEC. SCHOOL,"5042 A 9TH MAIN ROAD,SHANTHI COLONY, ANNA NAGAR",600040
1793,CHENNAI,Purasaiwalkkam,ARPUTHARAJ MATRICULATION HIGHER SECONDARY SCHOOL,"9/8, Nelson manickam road, choolaimedu",600094
1794,CHENNAI,Purasaiwalkkam,AV MEIYAPPAN MAT HSS,"No. 155, 5th Street, AVM Colony\Virugambakkam, Chennai",600092
1795,CHENNAI,Purasaiwalkkam,B.V.BHAVAN'S RAJAJI VIDYASHRAM,"No. 6 Kilpauk Garden RoadKilpauk, Chennai",600010
1796,CHENNAI,Purasaiwalkkam,BALALOK MATRIC HR. SEC. SCHOOL,"17, THARACHAND NAGAR, 2ND STREET,VIRUGAMBAKKAM, CHENNAI",600092
1797,CHENNAI,Purasaiwalkkam,BALAR KALVI NILAYAM,"5 &6, Ritherdon road, Vepery, Chennai 600007",600007
1798,CHENNAI,Purasaiwalkkam,BENTINCK HR.SEC.SCHOOL FOR GIRLS,"23/47, JEREMIAH ROAD, VEPERY, Chennai",600007
1799,CHENNAI,Purasaiwalkkam,C. M. S PULLAPURAM,"149,pullapuram ,kilpauk, chennai",600010
1800,CHENNAI,Purasaiwalkkam,C.M.S GUJJI STREET,No.98 ANNA NAGAR EASTCHENNAI,600102
1801,CHENNAI,Purasaiwalkkam,C.M.S VELLALA STREET,NO 150 VELLALA STREET PURASAIWAKKAM CHENNAI,600084
1802,CHENNAI,Purasaiwalkkam,C.S.I. BAIN SCHOOL,"42-48 ORMES ROAD,KILPAUK",600010
1803,CHENNAI,Purasaiwalkkam,C.S.I. EWART MATRICULATION HIGHER SECONDARY SCHOOL,"93, Dr. Alagappa Road purasawalkam chennai-84",600084
1804,CHENNAI,Purasaiwalkkam,CHENNAI BOYS HIGHER SECONDARY SCHOOL G.KOIL,"29A, GANGADEESHWARAR KOIL ST, PURASAIWAKKAM, CHENNAI",600084
1805,CHENNAI,Purasaiwalkkam,CHENNAI GIRLS HIGHER SECONDARY SCHOOL PULLA AVENUE,"NO.39, PULLA AVENUESHENOY NAGAR",600029
1806,CHENNAI,Purasaiwalkkam,CHENNAI HIGH SCHOOL KILPAUK,"9, thiyagappa street, kilpauk garden, kilpauk, chennai",600010
1807,CHENNAI,Purasaiwalkkam,CHENNAI HIGH SCHOOL MCNICHOLS ROAD,"NO.88 MCNICHOL'S ROAD ,CHETPET, CHENNAI",600031
1808,CHENNAI,Purasaiwalkkam,CHINMAYA VIDYALAYA ANNA NAGAR,"PLOT NO.5063A,Z-BLOCK, BELLY AREAANNA NAGAR",600040
1809,CHENNAI,Purasaiwalkkam,CHINMAYA VIDYALAYA HR.SEC SCHOOL,"NO 42/23 CHITTIHIRAI STREET\CHINMAYA NAGAR, STAGE II,VIRUGAMBAKKAM",600092
1810,CHENNAI,Purasaiwalkkam,CHINMAYA VIDYALAYA KILPAUK,"9 B ,Taylor's road, Chennai-10",600010
1811,CHENNAI,Purasaiwalkkam,"CHINMAYA VIDYALAYA SR.SEC.SCHOOL
,VIRUGAMBAKKAM",CHINMAYA NAGAR STAGE II VIRUGAMBAKKAM,600092
1812,CHENNAI,Purasaiwalkkam,CHS MMDA II,35 BHAGATH SINGH II STREETN BLOCK MMDA COLONY ARUMBAKKAM,600106
1813,CHENNAI,Purasaiwalkkam,CHS THIRUVALLUVARPURAM,"45A,SANKARAPURAM MAIN ROAD, THIRUVALLUVARPURAM,CHOOLAIMEDU,CHENNAI-94 ,",600094
1814,CHENNAI,Purasaiwalkkam,CHSS  SUBBARAYAN ST,"16,SUBBARAYAN ST,SHENOY NAGAR\CHENNAI",600030
1815,CHENNAI,Purasaiwalkkam,CHSS CHOOLAIMEDU,17 CHOOLAIMEDU HIGH ROADCHOOLAIMEDU,600094
1816,CHENNAI,Purasaiwalkkam,CHSS KOYAMBEDU,"7/20, SCHOOL STREETKOYAMBEDU",600107
1817,CHENNAI,Purasaiwalkkam,CHSS VIRUGAMBAKKAM,36 SCHOOL STREETVIRUGAMBAKKAM,600092
1818,CHENNAI,Purasaiwalkkam,CMS AMINJIKARAI,383-385  P.H.ROADAMINJIKARAI,600029
1819,CHENNAI,Purasaiwalkkam,CMS APPASAMI,"111,APPASAMY STREETCHETPET,CHENNAI",600031
1820,CHENNAI,Purasaiwalkkam,CMS ARUMBAKKAM,"1, Dhamodharan Street, T.S.D NagarArumbakkam, Chennai",600106
1821,CHENNAI,Purasaiwalkkam,CMS KUTTY ST,"Jayalakshmipuram Main RoadNungambakkam,Chennai",600034
1822,CHENNAI,Purasaiwalkkam,CMS MMDA I,"39 C Block, School StreetMMDA colony, Arumbakkam",600106
1823,CHENNAI,Purasaiwalkkam,CSI BAIN MATRICULATION & HIGHER SECONDARY SCHOOL,42-48 ORMES ROADKILPAUK,600010
1824,CHENNAI,Purasaiwalkkam,CSI EWART GLOBAL SCHOOL,93 Alagappa road Pursawalkkam,600084
1825,CHENNAI,Purasaiwalkkam,CSI JESSIE MOSES MAT. HR. SEC.SCHOOL,"V Avenue,ANNA NAGAR,CHENNAI-40",600040
1826,CHENNAI,Purasaiwalkkam,CSI MS PERUMALPET,34 vallam bangaru streetperumalpet,600007
1827,CHENNAI,Purasaiwalkkam,CSI MS SUNDRAM ST,"23,sundaram stpurasaiwalkam.chennai.",600007
1828,CHENNAI,Purasaiwalkkam,CSI MS TANA ST,"26, TANA STREET, PURASAIWALKAM CHENNAI-600007",600007
1829,CHENNAI,Purasaiwalkkam,DANIEL THOMAS GIRLS HS,"No.45 SELVAVINAYAGAR KOIL STREET,
ARUMBAKKAMArumbakkam, Chennai",600106
1830,CHENNAI,Purasaiwalkkam,DANIEL THOMAS MAT HSS KOYAMBEDU,"1184, E.V.R. HIGH ROAD,KOYAMBEDU, CHENNAI-107",600107
1831,CHENNAI,Purasaiwalkkam,DANIEL THOMAS MATRIC HR. SEC. SCHOOL,"NO.11A PERUMAL KOIL STREETARUMBAKKAM, CHENNAI",600106
1832,CHENNAI,Purasaiwalkkam,DAV MAT HSS GILL NAGAR,"162 Sivananda Salai,Gill Nagar, Choolaimedu,Chennai",600094
1833,CHENNAI,Purasaiwalkkam,DR BMS MAT HSS,"No.40,1st Main Road, Shenoy Nagar",600030
1834,CHENNAI,Purasaiwalkkam,E.L.M.FABRICIUS HR.SEC.SCHOOL,"59,PURASAWALKAM HIGH ROAD CHENNAI - 600 007",600006
1835,CHENNAI,Purasaiwalkkam,GOOD HOPE MAT HSS,"NO.5, JAGANATHA NAGAR MAIN ROAD, ARUMBAKKAM, CHENNAI - 600106.",600106
1836,CHENNAI,Purasaiwalkkam,GRACE MAT HSS,"2167-A L BLOCK. 1ST 12TH MAIN ROAD ANNA NAGAR
CH-40NO:4 L block 12th main road",600040
1837,CHENNAI,Purasaiwalkkam,I.C.F. HIGHER SECONDARY SCHOOL,"ICF COLONY , ICF",600038
1838,CHENNAI,Purasaiwalkkam,ICI MATRIC HR. SEC. SCHOOL,022-26163196,600040
1839,CHENNAI,Purasaiwalkkam,J.M.Matriculation Girls Higher Secondary School,"37/3, PONNAN STREET, PURASAWALKAM, CHENNAI - 7",600007
1840,CHENNAI,Purasaiwalkkam,JAIVEL MATRIC HIGHER SECONDARY SCHOOL,"no 93 sundarar st, thiruvalleeswarar  nagaranna nagar, chennai - 40",600040
1841,CHENNAI,Purasaiwalkkam,JGVV MAT HSS,"U BLOCK NO 6, 7TH STREETANNANAGAR",600040
1842,CHENNAI,Purasaiwalkkam,"KANCHEEPURAM ARULMIGU
EGAMBARANATHAR MATRICULATION HIGHER SECONDARY SCHOOL",768 Poonamalle High RoadKilpauk chennai,600010
1843,CHENNAI,Purasaiwalkkam,KASTHURIBAI GANDHI HIGH SCHOOL,"300 PURASAIWALKKAM HIGH ROAD, CHENNAI -10.",600010
1844,CHENNAI,Purasaiwalkkam,KENDRIYA VIDYALAYA ANNA NAGAR,"KV ANNA NAGAR,
GPRA CAMPUS, THIRUMANGALAM, ANNA NAGAR, CHENNAI-600040.",600040
1845,CHENNAI,Purasaiwalkkam,KENDRIYA VIDYALAYA GILL NAGAR,SHANMUGANAR SALAI  CHOOLAIMEDU CHENNAI,600094
1846,CHENNAI,Purasaiwalkkam,KERALA VIDYALAYAM HSS,903POONAMALLEE HIGH ROAD,600084
1847,CHENNAI,Purasaiwalkkam,KOLA PERUMAL CHETTY VAISHNAV SENIOR SECONDARY SCHOOL,"No 815, Kola perumal school street\Arumbakkam",600106
1848,CHENNAI,Purasaiwalkkam,KOLA SARASWATHI VAISHNAV SENIOR SECONDARY SCHOOL,"41 BARNABY ROAD,KILPAUK, CHENNAI",600010
1849,CHENNAI,Purasaiwalkkam,L M DHADHA SR.SEC.SCHOOL,"17/6, Krishnapuram Street Choolaimedu",600094
1850,CHENNAI,Purasaiwalkkam,LADY M.CT.M GIRLS HSS,"NO.13&14, Dr.ALAGAPPA ROAD,PURASAWALKAM, CHENNAI",600084
1851,CHENNAI,Purasaiwalkkam,MAHALASHMI VIDHYA MANDHIR,"14 A, 6th Cross StreetCollectorate Colony, Aminjikarai",600029
1852,CHENNAI,Purasaiwalkkam,MAHARISHI VIDYA MANDIR SENIOR SECONDARY SCHOOL,"No.28, Dr. Guruswamy Road,Chetpet, Chennai",600031
1853,CHENNAI,Purasaiwalkkam,MALAYALA VIDYALAYAM HS,"52,VENKITADRI STREETKOSAPET",600012
1854,CHENNAI,Purasaiwalkkam,MAR THOMA MATRICULATION HR. SEC. SCHOOL,"2/1 1st Cross Street, Sri Ayyappa Nagar, Virugambakkam",600092
1855,CHENNAI,Purasaiwalkkam,"MARY CLUBWALA JADHAV SPECIAL HIGHER
SECONDARY SCHOOL FOR THE HEARING IMPAIRED","No.1775/D,School RoadAnna Nagar West",600101
1856,CHENNAI,Purasaiwalkkam,MARY IMMACULATE MS,"62, halls road, kilpauk ,chennai-10",600010
1857,CHENNAI,Purasaiwalkkam,MES RAZEENA MAT HSS,"No.5 Professor Subramaniyan street, Kilpauk",600010
1858,CHENNAI,Purasaiwalkkam,MOHAMED SATHAK MATRIC HR. SEC. SCHOOL,A2A MMDA COLONY ARUMBAKKAM,600106
1859,CHENNAI,Purasaiwalkkam,MORNING STAR MATRIC. HR. SEC. SCHOOL,"No.11, South gangai amman koil 1 stChoolaimedu",600094
1860,CHENNAI,Purasaiwalkkam,NARAYANA E-TECHNO SCHOOL,"551, PONAMALLEE HIGH ROAD, ARUMBAKKAM, CHENNAI-600106",600106
1861,CHENNAI,Purasaiwalkkam,NATIONAL STAR MATRIC HR. SEC. SCHOOL,"NO:6,V.O.C ST ARUMBAKKAM",600106
1862,CHENNAI,Purasaiwalkkam,NIRMAL HIGH SCHOOL,"38/18,SABAPATHY STREET AYANAVARAM CHENNAI",600023
1863,CHENNAI,Purasaiwalkkam,"PADMA SARANGAPANI MATRIC HR.SE.SCHOOL, VIRUGAMBAKKAM","15/16/17 VENKATESA NAGAR3RD STREET , VIRUGAMBAKKAM",600092
1864,CHENNAI,Purasaiwalkkam,"PADMA SARANGAPANI MATRIC HR.SEC.SCHOOL,VILLIVAKKAM",No:32 Kumaraswamy Nagar Villivakkam,600049
1865,CHENNAI,Purasaiwalkkam,PONNAMMAL MEMORIAL MATRICULATION SCHOOL,"3/2, M.G.R. Street, Periyar Pathai, Choolaimedu, Chennai",600094
1866,CHENNAI,Purasaiwalkkam,RAJESWARI MAT HS,"no:58, 5th cross streetT.P.CHATHIRAM, KILPAUK",600010
1867,CHENNAI,Purasaiwalkkam,RAMACHANDRA MATRICULATION HSS,"474 KILPAUK GARDEN , KILPAUK",600010
1868,CHENNAI,Purasaiwalkkam,SBOA (M) HSS ANNA NAGAR WEST,R-9. 17th street Anna nagar westCHENNAI-600 101,600101
1869,CHENNAI,Purasaiwalkkam,SBOA GLOBAL SCHOOL,"R15/1, 6th Street, W Block, C SectorAnna Nagar West Extn, Chennai",600101
1870,CHENNAI,Purasaiwalkkam,SBOA SCHOOL & JUNIOR COLLEGE,"NO. 18, SCHOOL ROAD ANNANAGAR WEST EXTENSION , CHENNAI",600101
1871,CHENNAI,Purasaiwalkkam,SHERWOOD HALL SENIOR SECONDARY SCHOOL,"NO 7/13,HARRINGTON ROAD,XIII AVENUE,CHETPET,CHENNAI",600031
1872,CHENNAI,Purasaiwalkkam,SHRI B.K.KOTHARI MATRIC HR.SEC.SCHOOL,"NO 4,Harleys Road  kilpaukNO 4,Harleys Road kilpauk",600010
1873,CHENNAI,Purasaiwalkkam,Shri Krishnaswamy Matric Hr. Sec. School,AC-48 6TH MAIN ROADANNA NAGAR CHENNAI,600040
1874,CHENNAI,Purasaiwalkkam,Shri Krishnaswamy Matric Hr. Sec. School,"A' TYPE , SIDCO NAGAR VILLIVAKKAM,",600049
1875,CHENNAI,Purasaiwalkkam,Shri M Ct Muthiah Memorial Matriculation Hr Sec School,NO 6 ORMES ROADKILPAUK CHENNAI,600010
1876,CHENNAI,Purasaiwalkkam,SINDHI MODEL MATRICULATION HIGHER SECONDARY SCHOOL,"NO-20, NOWROJI ROAD, CHETPET,CH-31",600031
1877,CHENNAI,Purasaiwalkkam,SINDHI MODEL SR SEC SCHOOL,"No 1, Domodaran Street, Kellys, Davidpuram, Kilpauk, Chennai, Tamil Nadu",600010
1878,CHENNAI,Purasaiwalkkam,SIR MCTM HSS,"23 Raja Annamalai Road. PURASAWALKAM, CHENNAI",600084
1879,CHENNAI,Purasaiwalkkam,Smt. M.J.V HR. SEC. SCHOOL,"817 KOLA PERUMAL SCHOOL ST, PERIYAR EVR SALAI, ARUMBAKKAM",600106
1880,CHENNAI,Purasaiwalkkam,SRI ARANGIAH NAIDU HIGH SCHOOL,"No.81, Konnur High Road,Ayanavaram,CHENNAI - 23",600023
1881,CHENNAI,Purasaiwalkkam,SRI ARANGIAH NAIDU MIDDLE SCHOOL,"AYANAVARAM, CHENNAI.",600023
1882,CHENNAI,Purasaiwalkkam,SRI VENKATESWARA MAT HSS,"NO.104B, 1ST MAINROADALWARTHIRUNAGAR ANNEXE",600087
1883,CHENNAI,Purasaiwalkkam,ST CHRISTOPHER'S ACADEMY,"63, EVK Sampath Road, Vepery, Chennai",600007
1884,CHENNAI,Purasaiwalkkam,ST GEORGE'S AI HSS,"768 EVR salai Shenoy nagar, Chennai",600030
1885,CHENNAI,Purasaiwalkkam,ST. JOHN'S MATRIC HR.SEC SCHOOL,NO 15 NEW COLONYALWARTHIRUNAGAR,600087
1886,CHENNAI,Purasaiwalkkam,ST. PAULS HSS,"NO 11, CHURCH ROAD, VEPERY,CHENNAI",600007
1887,CHENNAI,Purasaiwalkkam,ST. VINCENT'S MATRICULATION HR. SEC. SCHOOL,24 RAILWAY COLONY IV STREET AMINJIKARAI CHENNAI-29,600029
1888,CHENNAI,Purasaiwalkkam,SUNSHINE ACADEMY MATRIC HR. SEC. SCHOOL,"NO .10, RAJESWARI STREET ,METHA NAGAR",600029
1889,CHENNAI,Purasaiwalkkam,T T A MATRIC HIGHER SECONDARY SCHOOL,"No.50/60, Basha street,Choolaimedu, Chennai.",600094
1890,CHENNAI,Purasaiwalkkam,TAGORE MAT HS,"NO.97 ANNA STREET ,SRI AYYAPPA NAGAR, CHINMAYA NAGAR CHENNAI",600092
1891,CHENNAI,Purasaiwalkkam,TELC MAGDALENE GIRLS HSS,"25, MURUGAPPA STREETPURASAWALKAM",600007
1892,CHENNAI,Purasaiwalkkam,THE SECRETARIAT COLONY MATRICULATION SCHOOL,"No:144, Secretariat colony 3rd streetKellys, chennai",600010
1893,CHENNAI,Purasaiwalkkam,THE TARAPORE AND LOGANATHAN HR. SEC. SCHOOL FOR GIRLS,"NO: 6, 2ND CROSS STREET, VP COLONY, AYANAVARAM, CHENNAI -23",600023
1894,CHENNAI,Purasaiwalkkam,THIRU VI KA HSS,"38/39 FIRST MAIN RD ,SHENOYNAGAR  , CHENNAI-30",600030
1895,CHENNAI,Purasaiwalkkam,VALLAL SABAPATHY MAT HSS,"No,25, Harrington Road, Chennai",600030
1896,CHENNAI,Purasaiwalkkam,VALLIAMMAL MAT HSS,F 40 FIRST MAIN ROAD ANNA NAGAR EAST CHENNAI,600102
1897,CHENNAI,Purasaiwalkkam,W. P. A. SOUNDARAPANDIAN HR. SEC. SCHOOL,"66 & 76, N.M.K.STREET, AYANAVARAM, CHENNAI",600023
1898,CHENNAI,Royapuram,A.A.PUBLIC SCHOOL,"N0:17/8, Andiappan Gramani Street,Royapuram",600013
1899,CHENNAI,Royapuram,ANDERSON DAY GIRLS HSS,98 ACHARAPPAN STREET MANNADY CHENNAI,600001
1900,CHENNAI,Royapuram,ANDERSON RAJAGOPAL GIRLS HSS,"219, THAMBU CHETTY STREET\MANNADY",600001
1901,CHENNAI,Royapuram,ARUMUGA NADAR GIRLS HSS,"13/8, M C ROADOLDWASHERMENPET, CHENNAI",600021
1902,CHENNAI,Royapuram,B.SUBBARAYAN MIDDLE SCHOOL,1/3 P P  A KOIL STREETMOOLAKOTHALAM,600021
1903,CHENNAI,Royapuram,BISHOP CORRIE AI HSS,"1, CHAPEL CHURCH STREET\GEORGE TOWN, CHENNAI -
01",600001
1904,CHENNAI,Royapuram,C T HS ANJANEYA NAGAR,"48 OLD SLAUGHTER'S HOUSE ROAD, ANJANEYA NAGAR, ROYAPURAM, CHENNAI -13",600013
1905,CHENNAI,Royapuram,C U BOYS HS WASHERMENPET,48/32 EAST CEMETRY ROADOLD WASHERMENPET,600021
1906,CHENNAI,Royapuram,C.M.S. PADAVETTAMMAN,"45,chennai middle school    padavattamman koil st  ch-79",600079
1907,CHENNAI,Royapuram,C.M.S.RAMASAMY ST,"44, Ramasamy st, Mannady, Chennai - 1",600001
