S NO,DISTRICT,BLOCK NAME,SCHOOL NAME,SCHOOL ADDRESS,PINCODE
3335,CUDDALORE,Cuddalore,MUNICIPAL MIDDLE SCHOOL - BROOKEESPET,"Municipal Middle School, Brookespet",607004
3336,CUDDALORE,Cuddalore,MUNICIPAL MIDDLE SCHOOL - DEVANAMPATTINAM,"MAIN ROAD ,
DEVANAMPATTINAM, CUDDALORE-607001.",607001
3337,CUDDALORE,Cuddalore,MUNICIPAL MIDDLE SCHOOL - REDDY CHATHIRAM,"REDDY CHATHIRAM STREETTHIRUPPATHIRIPULIYUR,",607002
3338,CUDDALORE,Cuddalore,MUNICIPAL MIDDLE SCHOOL - SIMON GARDEN,"SimonGarden,Cuddalore,OT",607003
3339,CUDDALORE,Cuddalore,NEW MILLENNIUM MATRICULATION HIGHER SECONARY SCHOOL - KUMARAPETTAI,KUMARAPETTAIPATHIRIKUPPAM POST,607401
3340,CUDDALORE,Cuddalore,OASIS SNEHADEEP HIGH SCHOOL FOR THE SEVERELY DISABLED - VANNIYARPALAYAM,"NO 61, YADHAVA STREET, VANNIYARPALAYAM, CUDDALORE-1",607001
3341,CUDDALORE,Cuddalore,PANCHAYAT UNION MIDDLE SCHOOL - CHELLANCHERRY,6MURUGAN KOIL STREET,605106
3342,CUDDALORE,Cuddalore,PANCHAYAT UNION MIDDLE SCHOOL - KARAIKADU COLONY,KARAIKADU COLONYCUDDALORE,607005
3343,CUDDALORE,Cuddalore,PANCHAYAT UNION MIDDLE SCHOOL - KUTTIYANKUPPAM,THOOKANAMPAKKAM POSTCUDDALORE TK,607402
3344,CUDDALORE,Cuddalore,PANCHAYAT UNION MIDDLE SCHOOL -  M PUDHUR,"PUMS M.PUDHUR, SCHOOL STREET, CUDDALORE",607004
3345,CUDDALORE,Cuddalore,PANCHAYAT UNION MIDDLE SCHOOL - PETHANKUPPAM,414404144,607105
3346,CUDDALORE,Cuddalore,PANCHAYAT UNION MIDDLE SCHOOL - SANRORPALAYAM,school street sandrorpalayam\sandrorpalayam cuddalore oT,607003
3347,CUDDALORE,Cuddalore,PANCHAYAT UNION MIDDLE SCHOOL - ARISIPERIYANKUPPAM,ARISIPERIYANKUPPAMPATHIRIKUPPAM PO,607401
3348,CUDDALORE,Cuddalore,PANCHAYAT UNION MIDDLE SCHOOL - C.N.PALAYAM,C.N.PALAYAMCUDDALORE,607102
3349,CUDDALORE,Cuddalore,PANCHAYAT UNION MIDDLE SCHOOL - CHINNA IRUSAMPALAYAM,"PUMS-CHINNAIRUSAMPALAYAMARIYANKUPPAM POST,CUDDALORE",605007
3350,CUDDALORE,Cuddalore,PANCHAYAT UNION MIDDLE SCHOOL - EDAIYARKUPPAM,"PUMS, Edaiyarkuppam, C.N.Palayam, Cuddalore.607102",607102
3351,CUDDALORE,Cuddalore,PANCHAYAT UNION MIDDLE SCHOOL - KALAIYUR,"PILLAIYAR KOIL STREET, KALAIYUR, CUDDALORE TALUK",607109
3352,CUDDALORE,Cuddalore,PANCHAYAT UNION MIDDLE SCHOOL - KEEZH AZHINJIPATTU,PUMS KEELALINJIPATTUPALLIKUDA STREET REDDICHAVADI,607402
3353,CUDDALORE,Cuddalore,PANCHAYAT UNION MIDDLE SCHOOL - KODUKKANPALAYAM,Panchayat Union Middle SchoolKodukkanpalayam,607003
3354,CUDDALORE,Cuddalore,PANCHAYAT UNION MIDDLE SCHOOL - PERIYA KANGANANKUPPAM,PANCHAYAT UNION MIDDLE SCHOOLPERIYAGANKANANKUPPAM,607006
3355,CUDDALORE,Cuddalore,PANCHAYAT UNION MIDDLE SCHOOL - PERIYAKATTUPALAYAM,"PUMS PERIYAKATTUPALAYAM
PONDY ROAD
MADHALAPATTU PANCHYAYAT",605007
3356,CUDDALORE,Cuddalore,PANCHAYAT UNION MIDDLE SCHOOL - RAMAPURAM EAST,RAMAPURAM EASTRAMAPURAM,607003
3357,CUDDALORE,Cuddalore,PANCHAYAT UNION MIDDLE SCHOOL - SANGOLIKUPPAM,punchayat union middle school sangolikuppampanchayat union middle school sangolikuppam,607005
3358,CUDDALORE,Cuddalore,PANCHAYAT UNION MIDDLE SCHOOL - SEDAPALAYAM,"PANCHAYAT UNION MIDDLE SCHOOL, SEDAPALAYAM, CUDDALORE BLOCK.",607003
3359,CUDDALORE,Cuddalore,PANCHAYAT UNION MIDDLE SCHOOL - SEMMANKUPPAM,"PANCHAYAT UNION MIDDLE SCHOOL SEMMANKUPPAM, CUDDALORE",607005
3360,CUDDALORE,Cuddalore,PANCHAYAT UNION MIDDLE SCHOOL - SOTHIKUPPAM,"Nadu Street, SothikuppamNadu Street, Sothikuppam",607003
3361,CUDDALORE,Cuddalore,PANCHAYAT UNION MIDDLE SCHOOL - SUTHUKULAM,PUMS\SUTHUKULAM / cuddalore  O T,607003
3362,CUDDALORE,Cuddalore,PANCHAYAT UNION MIDDLE SCHOOL - THAZHANKUDA,"Gunduuppalavadi Post, Thazhanguda,Cuddalore",607006
3363,CUDDALORE,Cuddalore,PANCHAYAT UNION MIDDLE SCHOOL - THIRUMANIKUZHI,ThirumanikuzhiCuddalore,607401
3364,CUDDALORE,Cuddalore,PANCHAYAT UNION MIDDLE SCHOOL - THOTTAPATTU,"PUMS THOTTAPATTU
NATHAPATTU(POST)
PCAULDLDINAELOLIRNEU6R07S1A0L9AI,",607109
3365,CUDDALORE,Cuddalore,PANCHAYAT UNION MIDDLE SCHOOL - U.C CHAVADI,UNNAMALAI CETTY CHAVADI KONDUR (POST),607006
3366,CUDDALORE,Cuddalore,PANCHAYAT UNION MIDDLE SCHOOL - VANAMADEVI,PANCHAYATUNION MIDDLE SCHOOLVANAMADEVI CUDDALORE,607105
3367,CUDDALORE,Cuddalore,PANCHAYAT UNION MIDDLE SCHOOL - VAZHISOTHANAIPALAYAM,VazhisothanaipalayamCuddalore,607003
3368,CUDDALORE,Cuddalore,PANCHAYAT UNION MIDDLE SCHOOL - VELLAPAKKAM,"Vellapakkam, Varakkal pattu, cuddalore taluk, cuddalore
districtVellapakkam, Varakkal pattu, cuddalore taluk, cuddalore districtVellapakkam, Varakkal pattu, cuddalore taluk, cuddalore",607109
3369,CUDDALORE,Cuddalore,PANCHAYAT UNION MIDDLE SCHOOL - VILANGALPATTU,"Vilangalpattu village, Vanamadevi postCuddalore District",607105
3370,CUDDALORE,Cuddalore,"SARVA SEVA MATRICULATION SCHOOL, KANNARAPETTAI","SARVA SEVA MATRICULATION SCHOOL,CANARA BANK
OPP SITE,KANNARAPETTAI,CUDDALORESARVA SEVA MATRICULATION SCHOOL,CANARA BANK OPP",607005
3371,CUDDALORE,Cuddalore,SAVIOUR JESUS MATRICULATION HIGHER SECONDARY SCHOOL - CUDDALORE,"11, RED CROSS STREET,\HOSPITAL  ROAD, CUDDALORE",607001
3372,CUDDALORE,Cuddalore,SHANTHAM SPECIAL SCHOOL FOR MENTALLY CHALLENGED - B.VADUGAPALAYAM,"66, Mariyamman Kocil StreetB.Vadugapalayam",607004
3373,CUDDALORE,Cuddalore,SRI LAKSHMI CHORDIA MATRICULATION HIGHER SECONDARY SCHOOL - THIRUPPATHIRIPULIYUR,13-A BABU RAO STREET THIRUPAPULIYUR CUDDALORE,607002
3374,CUDDALORE,Cuddalore,SRI MAHARISHI VIDHYA MANDHIR MATRICULATION SCHOOL - MANJAKUPPAM,"Dhanam Nagar Kaliyamman Koil Street, Manjakuppam, CuddaloreDhanam Nagar Kaliyamman Koil Street, Manjakuppam,
Cuddalore",607001
3375,CUDDALORE,Cuddalore,SRI PATALESWARAR HIGHER SECONDARY SCHOOL - THIRUPPATHIRIPULIYUR,"27 sanathi streetTirupadiripuliyur, cuddalore",607002
3376,CUDDALORE,Cuddalore,"SRI SARASWATHI VIDHYAALAYA
MATRICULATION HIGHER SECONDARY SCHOOL , CUDDALORE  PORT","1-4 Throupathiamman Koil Street,Malumiyarpettai - Cuddalore Port",607003
3377,CUDDALORE,Cuddalore,SRI SIVASAKTHI MENTALLY RETARDED SPECIAL CARE SCHOOL - K.N.PETTAI,52/1A1A sri thirumalai nagark.n.pettai,607002
3378,CUDDALORE,Cuddalore,"SRI VALLIAMMAL MATRICULATION HIGHER SECONDARY SCHOOL, THIRUPPATHIRIPULIYUR",KESAVA NAGAR\ THIRUPATHIRIPULIYUR,607002
3379,CUDDALORE,Cuddalore,"SRI VANI VIDHYALAYA MATRICULATION SCHOOL, THOTTI","Mariyamman Koil St,Pillali Thotti , Thiruvanthipuram (p.o) cuddalore",607401
3380,CUDDALORE,Cuddalore,SRI VARADHAM GOVERNMENT GIRLS HIGHER SECONDARY SCHOOL -  VENUGOPALAPURAM,GRASS MERCHANT STREETVENUGOPALAPURAM,607001
3381,CUDDALORE,Cuddalore,"SRI VIDYA KALA KENDRAM MATRICULATION HIGH SCHOOL, THIRUVANTHIPURAM","No.2/83, Sannathi Street, Thiruvandipuram",607401
3382,CUDDALORE,Cuddalore,ST ANNE'S GIRLS HIGHER SECONDARY SCHOOL - PUDHUPALAYAM,"ST.ANNE'S GIRLS HR. SEC. SCHOOL, PUDUPALAYAM,CUDDALORE.",607001
3383,CUDDALORE,Cuddalore,"ST ANTONY'S MATRICULATION HIGHER
SECONDARY SCHOOL - CHINNAKANGANANKUPPAM",PONDY - CUDDALORE MAIN ROAD\CHINNNA KANKANNANKUPPAM,607006
3384,CUDDALORE,Cuddalore,ST DAVID'S HIGHER SECONDARY SCHOOL - CUDDALORE PORT,"36WELLINGTON STREET,CUDDALORE PORT",607003
3385,CUDDALORE,Cuddalore,ST DAVID'S MATRICULATION SCHOOL- CUDALORE PORT,WELLINGTON STREETCUDDALORE PORT,607003
3386,CUDDALORE,Cuddalore,ST FRANCIS XAVIER MS,wellington streetcuddalore ot,607003
3387,CUDDALORE,Cuddalore,ST JOSEPH'S HIGHER SECONDARY SCHOOL - MANJAKUPPAM,SUBJAIL ROAD\MANJAKUPPAM,607001
3388,CUDDALORE,Cuddalore,ST JOSEPH'S HIGHER SECONDARY SCHOOL - THIRUPPATHIRIPULIYUR,", TIRUPAPULIYURCUDDALORE",607002
3389,CUDDALORE,Cuddalore,ST JOSEPH'S MATRICULATION HIGHER SECONDARY SCHOOL - KOOTHAPAKKAM,KOOTHAPAKKAM\CUDDALORE,607002
3390,CUDDALORE,Cuddalore,"ST PHILOMINA'S GIRLS HIGH SCHOOL,CUDDALORE PORT","wellington street\cuddalore port,",607003
3391,CUDDALORE,Cuddalore,ST THOMAS MATRICULATION SCHOOL - KOOTHAPAKKAM,"NO.1,SINGARAM
AVENUE,PATHIRIKUPPAM,CUDDALOREPATHIRIKUPPA M",607002
3392,CUDDALORE,Cuddalore,ST.ANNE'S SCHOOL - PUDHUPALAYAM,"St. Anne's  Schoolo.4, Bharathi Road, Pudupalayam, Cuddalore",607001
3393,CUDDALORE,Cuddalore,"ST.MARY'S MATRICULATION HR.SEC.SCHOOL, CUDDALORE-607001.",OLD HOSPITAL ROAD SORKALPET,607001
3394,CUDDALORE,Cuddalore,THE PSBB MILLENNIUM SCHOOL - PERIYAKATUPALAYAM,"The PSBB Millennium School, Periyakattupalayam, Madalapattu, Cuddalore.",605007
3395,CUDDALORE,Cuddalore,"V.C.S .SHEMFORD INTERNATIONAL SCHOOL,CAPPER HILLS",vettukulamcapper hills,607004
3396,CUDDALORE,Cuddalore,VELLAI THAMARAI MATRICULATION SCHOOL - CHINNA KATTUPALAYAM,"Chinnakattupalayam,Reddichavady,Madhalapattu.\Mariamman Kovil, Street",607402
3397,CUDDALORE,Kammapuram,"ADW HSS, DHARMANALLUR",main roadmain road,606103
3398,CUDDALORE,Kammapuram,ADWGHS-U.MANGALAM,Pillaiyar Kovil street,607804
3399,CUDDALORE,Kammapuram,AMS GOPALAPURAM,NORTH STREET\GOPALAPURAM,606101
3400,CUDDALORE,Kammapuram,AMS KAVANUR WEST,"GKN,AMS.KAVANUR(WEST)",608703
3401,CUDDALORE,Kammapuram,AMS SIRUVARPPUR,"SIRUVARAPPUR &(post), Vridhachalam(tk)N MANGAIYARKARASI",606103
3402,CUDDALORE,Kammapuram,AMS T. PAVAZHANGUDI,"SIVANKOIL BACK, T.PAVAZHANGUDI,OTTIMEDU POST,THIRUMUTTAM TK,CUDDALORE DT,606 103",606103
3403,CUDDALORE,Kammapuram,AMS VILAKKAPADI,"vilakkapadi, west streetkammapuram,( via)Dharmanalur,(post)",606103
3404,CUDDALORE,Kammapuram,AR RAHMATH MATRICULATION SCHOOL PERIYAKURICHI,"MOSQUE COMPOUNDCUDDALORE MAIN ROAD,NEYVELI",607802
3405,CUDDALORE,Kammapuram,AUXILIUM MATCULATION  SCHOOL- V.SATHAMANGALAM,"CUDDALORE MAIN
ROADV.SATHAMANGALAM&(PO),VRIDDHACHALAM(TK
)",606003
3406,CUDDALORE,Kammapuram,GHS - NADIYAPATTU,"GHS -NADIYAPATTU, PALAKKOLAI ( POST
)VIRUDHACHALAM ( TK )",606115
3407,CUDDALORE,Kammapuram,"GHS , OTTIMEDU",OTTIMEDUVRIDHACHALAM TK,606103
3408,CUDDALORE,Kammapuram,GHS GANGAIKONDAN COLONY,A-BLOCK-MATTRUKUDIYIRRPU-CELON COLONY- NEYVELI 1,607801
3409,CUDDALORE,Kammapuram,GHS IRULAKURICHI,GHS IRULAKURICHI viruthachalam,606115
3410,CUDDALORE,Kammapuram,GHS KO.ADHANUR,"GOVERNMENT HIGH
SCHOOL,KO.ADHANUR\VRIDDHACHALAM TK,CUDDALORE DT.",606003
3411,CUDDALORE,Kammapuram,GHS -KOTTERI,"GOVERNMENT HIGH SCHOOL, KOTTERI",607804
3412,CUDDALORE,Kammapuram,GHS PERIYAKAPPANKULAM,"GOVT HIGH SCHOOL PERIYAKAPPANKULAM, PERIYAKAPPANKULAM POST,  VRIDHACHALAM TALUK",607802
3413,CUDDALORE,Kammapuram,GHS -VEPPANKURICHI,vadakkuvellore(po)eyveli,607802
3414,CUDDALORE,Kammapuram,"GHS, MELAKUPPAM",GOVERNMENT HIGH SCHOOL MELAKUPPAM-607802.,607802
3415,CUDDALORE,Kammapuram,GHSS C.KEERANUR,GOVT HIGHER SECONDARY SCHOOLC.KEERANUR,606110
3416,CUDDALORE,Kammapuram,GHSS IRUPPU,"GHSS IRUPPU,  IRUPPU POST, VRIDHACHALAM TALUK",607805
3417,CUDDALORE,Kammapuram,GHSS KAMMAPURAM,MAIN ROADKAMMAPURAM,606103
3418,CUDDALORE,Kammapuram,GHSS SEPLANATHAM,SOUTH STREETMain Road,607802
3419,CUDDALORE,Kammapuram,"JAYAPRIYA VIDYALAYA MATRICULATION HIGHER SECONDARY SCHOOL,GOPALAPURAM.",Chidambaram Main Road Gopalapuram,606103
3420,CUDDALORE,Kammapuram,JPA VIDYALAYA  MATRICULATION SCHOOL,"No: 37 AKS Nagar, GangaikondanNeyveli",607802
3421,CUDDALORE,Kammapuram,"P.RAMALINGA MDR GHSS, MUDHANAI","NORTH STREET , MUDHANAI",607804
3422,CUDDALORE,Kammapuram,PUMS A. VALLIYAM,A.VALLIYAMC.KEERANUR POST,606110
3423,CUDDALORE,Kammapuram,PUMS AMMERIKOKKANKUPPAM,PUMS A.Kokkankuppam Ammeri post,607802
3424,CUDDALORE,Kammapuram,PUMS CHINNAKOTTUMULAI,PANCHAYAT UNION MIDDLE SCHOOLCUDDDALORE DISTRICT,606103
3425,CUDDALORE,Kammapuram,PUMS KARKUDAL,KARKUDAL&POST VRIDHACHALAM TALUK,606003
3426,CUDDALORE,Kammapuram,PUMS- KEEZHAPALAIYUR,"PUM School, Keezhapalaiyur.PUMS, Keezhapalaiyur.",606103
3427,CUDDALORE,Kammapuram,PUMS KO.MAVIDANTHAL,"EAST ST,
KO.MAVIDANTHAL, KARGUDAL POST,",606003
3428,CUDDALORE,Kammapuram,PUMS- KOLLIRUPPU COLONY,kolliruppu colony\periyakappankulam[post],607802
3429,CUDDALORE,Kammapuram,PUMS KUMARAMANGALAM,"PUMS,V.KUMARAMANGALAMKO.ADHANUR POST",606003
3430,CUDDALORE,Kammapuram,PUMS KUMARAMANGALAM,"PUMS,V.KUMARAMANGALAM KO.ADHANUR POST",
3431,CUDDALORE,Kammapuram,PUMS PALLAKOLAI,Panchayat Union middle school PalakollaiPalakollai post,606115
3432,CUDDALORE,Kammapuram,PUMS PAZHAAYAPATTINAM,PALAYAPATTINAM  POSTVRIDHACHALAM TK,606104
3433,CUDDALORE,Kammapuram,PUMS PUDHUVIRUDHAGIRIKUPPAM,North street\Pudhuviruthagirikuppam,607804
3434,CUDDALORE,Kammapuram,PUMS SATHAPPADI,sathappadi povirudhachalam tk,606103
3435,CUDDALORE,Kammapuram,PUMS THOPPALIKUPPAM,"Ammeri post,neyveli (via), Virudhachalam (Taluk)",607803
3436,CUDDALORE,Kammapuram,PUMS U.ADHANUR,P.U.M.S U.ADHANURKAMMAPURAM SATHAMANGALAM POST,606103
3437,CUDDALORE,Kammapuram,PUMS UTHANGAL,uthangaluthangal po,607804
3438,CUDDALORE,Kammapuram,PUMS UYAKONDARAVI,uyyakondaraviseplanatham post,607802
3439,CUDDALORE,Kammapuram,PUMS V.SATHAMANGALAM,MANTHAVELIV.SATHAMANGALAM,606003
3440,CUDDALORE,Kammapuram,PUMS VEENANKENI,"pums, veenankeni,moolakuppam postvadalur spo",607303
3441,CUDDALORE,Kammapuram,"PUMS, A.KURAVANKUPPAM",Panchayat union middle schoolsA.Kuravankuppam,607802
3442,CUDDALORE,Kammapuram,"SACRED HEART HSS, IRUPUKURICHI",U AGARAM POST\VIRUDHACHALAM TALUK,607804
3443,CUDDALORE,Kammapuram,"SACRED HEART MATRICULATION SCHOOL, KVR NAGAR,NEYVELI","No.7, KVR NagarMandharakuppam",607802
3444,CUDDALORE,Kammapuram,SAMI VIVEKANANTHA MATRICULATION SCHOOL- SEPLANATHAM,"swamy vivekananda matriculation school neyveli road ,
seplanathamswamy vivekananda matriculation school neyveli road seplanatham",607802
3445,CUDDALORE,Kammapuram,SIVABHARATHI MATRICULATION HIGHER SECONDARY SCHOOL SIRUVARAPPUR,SIRUVARAPPURPERIYAKKOTTUMULAI - POST,606103
3446,CUDDALORE,Kammapuram,"ST.THERSA'S HS, KATTUKUNANKURICHI",ST.THERESA HIGH SCHOOL KATTUKUNANKURICHI,607804
3447,CUDDALORE,Kattumannarkoil,"AIDED HIGH SCHOOL (RC) , UDAIYARKUDI",UDAIYARGUDI (PO)KATTUMANNAR KOIL (TK),608301
3448,CUDDALORE,Kattumannarkoil,"AIDED MUSLIM HIGH SCHOOL , AYANGUDI",BIG MASQUE STREETSOUTH STREET,608306
3449,CUDDALORE,Kattumannarkoil,"AKSHARA VIDYA MANDIR, CBSE SCHOOL, VILVAKULAM","NH-227,Vilvakulamkattumannarkoil",608301
3450,CUDDALORE,Kattumannarkoil,AMS KALLAIMAGAL,"east street udayargudi, north street udayargudi",608301
3451,CUDDALORE,Kattumannarkoil,AMS KANDAMANGALAM,"AMS, Kandamangalam &POKattumannarkoil TK",608301
3452,CUDDALORE,Kattumannarkoil,AMS VEERANANDAPURAM,visalatchi aided middle schoolveeranandhapuram,608301
3453,CUDDALORE,Kattumannarkoil,"ARUNACHALAM HINDU AIDED MIDDLE SCHOOL, KANATTAMPULIYUR",144 PILLIYAR KOIL STREETKANATTAMPUILYUR,608306
3454,CUDDALORE,Kattumannarkoil,ARUNMOZHY MATRIC  HIGHER SECONDARY SCHOOL-VEERANANDAPURAM,VeerananthapuramKattumannarkoil,608301
3455,CUDDALORE,Kattumannarkoil,CS JAIN  MATRICULATION SCHOOL- THIRUMUTTAM,ThethampetThirumuttam,608703
3456,CUDDALORE,Kattumannarkoil,"DHAVA AMUTHAM MHSS, SRIMUSHNAM",JAYANKONDAM ROAD SRIMUSHNAM PO AND TK,608703
3457,CUDDALORE,Kattumannarkoil,"DVC HSS , SRIMUSHNAM",thamaraikulam stsrimushnam,608703
3458,CUDDALORE,Kattumannarkoil,DVC MATRICULATION SCHOOL,Thirumurugan nagar srimushnam,
3459,CUDDALORE,Kattumannarkoil,"G.K. PUBLIC SENIOR  SECONDARY SCHOOL, KATTUMANNARKOIL",2 A mela veethikalamnagar,608301
3460,CUDDALORE,Kattumannarkoil,"GHS , KARUPPERI",kunjamedu\karupperi,608306
3461,CUDDALORE,Kattumannarkoil,"GHS , MANIYAMADOOR",MELA ST  MANIYAMADOORKATTUMANNARKOIL TK,608303
3462,CUDDALORE,Kattumannarkoil,"GHS , MOVUR","GOVERNMENT HIGH SCHOOL, MOVUR, KATTUMANNARKOIL TALUK, CUDDALORE DISTRICT.",608306
3463,CUDDALORE,Kattumannarkoil,GHS GUNAVASAL,GUNAVASALKATTUMANNARKOIL,608306
3464,CUDDALORE,Kattumannarkoil,GHS KOZHAI,"KOZHAI STREET, KOZHAI-608703,SRIMUSHNAM TK , CUDDALORE DT",608703
3465,CUDDALORE,Kattumannarkoil,GHS OMAMPULIYUR,"MAIN ROAD, OMAMPULIYUR - 608306",608306
3466,CUDDALORE,Kattumannarkoil,GHS-NATTARMANGALAM,GOVT. HIGH SCHOOL NATTARMANGALAM,608301
3467,CUDDALORE,Kattumannarkoil,"GHSS , KANJANKOLLAI",MAIN ROADKANJANKOLLAI,608304
3468,CUDDALORE,Kattumannarkoil,"GHSS , MUTTAM",PATTIVASAL STREET\MUTTAM,608306
3469,CUDDALORE,Kattumannarkoil,GHSS MAMANGALAM,MAMANGALAM & POSTKATTUMANNARKOIL - TK,608701
3470,CUDDALORE,Kattumannarkoil,GHSS THIRUMUTTAM,"GHSS,THIRUMUTTAM\THEN PATHI(MALAIMEDU)",608703
3471,CUDDALORE,Kattumannarkoil,"GHSS(BOYS) , KATTUMANNARKOIL",WEST STREETKATTUMANNARKOIL,608301
3472,CUDDALORE,Kattumannarkoil,"GHSS(GIRLS) , KATTUMANNARKOIL","OMAMPULIYUR ROAD, KATTUMANNARKOIL, KATTUMANNARKOIL",608301
3473,CUDDALORE,Kattumannarkoil,GHSS.KANDAMANGALAM,"KANDAMANGALAM KATTUMANNARKOIL TK, CUDDALORE DT",608301
3474,CUDDALORE,Kattumannarkoil,GHS-VANAMADEVI,GGHSS CHIDAMBARAMGGHSS CHIDAMBARAM,608001
3475,CUDDALORE,Kattumannarkoil,"GK MAT HSS , KATTUMANNARKOIL",IYYANARKOIL STREETIYYANARKOIL STREET,608301
3476,CUDDALORE,Kattumannarkoil,"GOVERNMENT HIGH SCHOOL, KURUNGUDI","kurungudi,kandamangalam(po)kattumannarkoil(tk),cuddalore(dt)",608301
3477,CUDDALORE,Kattumannarkoil,GOVERNMENT HIGHER SECONDARY SCHOOL SRINEDUNCHERI,"SOUTH STREET, SRINEDUNJERYKATTUMANNARKOIL TK, CUDDALORE DT",608703
3478,CUDDALORE,Kattumannarkoil,"GOVERNMENT HIGHER SECONDARY SCHOOL, REDDIYUR",SIVAN KOIL STREETREDDIYUR,608304
3479,CUDDALORE,Kattumannarkoil,KALAIMAGAL MATRIC HIGHER SECONDARY SCHOOL  KATTUMANNARKOIL,"NO 58,VALAYALKARA
ST,KATTUMANNRKOIL,CUDDALORE DTNO 58,VALAYALKARA",608301
3480,CUDDALORE,Kattumannarkoil,"MUSLIM HIGH SCH., KOLLUMEDU",BAZAR STREET-KOLLUMEDU AND POST,608303
3481,CUDDALORE,Kattumannarkoil,"P R G HR SEC SCHOOL, KATTUMANNARKOIL","NEW NORTH STREET, KATTUMANNARKOIL",608301
3482,CUDDALORE,Kattumannarkoil,PANCHAYAT UNION MIDDLE SCHOOL ANANTHAKUDI,"MAIN ROAD.
ANANTHAKUDI. RAJENDRAPATTINAM-POST,",608703
3483,CUDDALORE,Kattumannarkoil,PANCHAYAT UNION MIDDLE SCHOOL MELPALANCHANALLUR,PANCHYAT UNION MIDDLE SCHOOLMELAPAZHANJANALLUR,608301
3484,CUDDALORE,Kattumannarkoil,PANCHAYAT UNION MIDDLE SCHOOL SATHAVATTAM,"SATHAVATTAM,KANUR, PO, SRIMUSHNAM,
TALUKSATHAVATTAM,KANUR, PO, SRIMUSHNAM, TALUK",608701
3485,CUDDALORE,Kattumannarkoil,PANCHAYAT UNION MIDDLE SCHOOL EYYALUR,EYYALUR & POST  KATTUMANNARKOIL T.K CUDDALORE D.T  TAMIL NADU,608304
3486,CUDDALORE,Kattumannarkoil,"PANCHAYAT UNION MIDDLE SCHOOL, NACHIYARPETTAI",PUMSNACHIYARPETTAI MAIN,608703
3487,CUDDALORE,Kattumannarkoil,PUMS AMBUJAVALLIPETTAI,"PUMS AMBUJAVALLIPETTAI. SRIPUTHUR PO
.SRIMUSHNAM TK. CUDDALORE DT",608703
3488,CUDDALORE,Kattumannarkoil,PUMS M.ADHANUR,PUMS M.ATHANOORKATTUMANNARKOIL T.K,608304
3489,CUDDALORE,Kattumannarkoil,PUMS SHANDAN,"Post office street ,
Shandan & Post, PIN CODE 608304.",608304
3490,CUDDALORE,Kattumannarkoil,PUMS SRI ADIVARAGANALLUR,"SRIMUSHNAM (VIA),SRIMUSHNAM TALUK",608703
3491,CUDDALORE,Kattumannarkoil,PUMS THIRUCHENNAPURM,M.Adoor (post)Thiruchinnapuram,608303
3492,CUDDALORE,Kattumannarkoil,PUMS UDAIYARGUDI MIXED,"P.U.M.S UDAIYARGUDI (MIXED), KATTUMANNARKOIL PO & TK.KATTUMANNARKOIL",608301
3493,CUDDALORE,Kattumannarkoil,"RAJIV GANDHI NATIONAL  MAT HR SEC SCHOOL , NATTARMANGALAM","school streetmain road, NATTARMANGALAM",608301
3494,CUDDALORE,Kattumannarkoil,"RAJIV GANDHI NATIONAL HIGH SCHOOL, NATTARMANGALAM","nattarmangalamkattumannarkoil-tk,cuddalore-dt",608301
3495,CUDDALORE,Kattumannarkoil,"SARASWATHI AIDED MIDDLE SCHOOL, GUNAMANGALAM.",MAIN ROADGUNAMANGALAM,608703
3496,CUDDALORE,Kattumannarkoil,SBG CBSE VIDYALAYA-THENPATHI,THENPATHYSRIMUSHNAM,608703
3497,CUDDALORE,Kattumannarkoil,"SBG VIDHYALAYA MATRICULATION SCHOOL, THENPATHY","Thenpathy,Srimushnam, Cuddalore",608703
3498,CUDDALORE,Kattumannarkoil,"ST.ANTHONY'S HS , ARANTHANGI",ARANTHANGI POSTKATTUMANNARKOIL TK,608301
3499,CUDDALORE,Kattumannarkoil,"THIRUGNANAM INTERNATIONAL SCHOOL,MELPULIYANGUDI","Vridhachalam nmain road,Melpuliyangudi",608703
3500,CUDDALORE,Kattumannarkoil,"VIVEKANANDAN AIDED MIDDLE SCHOOL, MELAKADAMBUR","Koil street,\Melakadambur",608304
3501,CUDDALORE,Keerapalayam,"ADI-DRAVIDA WELFARE GOVERNMENT HIGHER
SECONDARY SCHOOL- MATHURANTHAGANALLUR",MAIN ROADMADURANTHAGANALLUR P.O,608201
3502,CUDDALORE,Keerapalayam,ADI-DRAVIDA WELFARE MIDDLE SCHOOL- MUGAIYUR,Big street Mugaiyur,608305
3503,CUDDALORE,Keerapalayam,ADI-DRAVIDA WELFARE MIDDLE SCHOOL- PERUNGALUR,"Perungalur & Post,Chidambaram Talluk,Cuddalore Districtperungalur&post,chidambaram Tk",608305
3504,CUDDALORE,Keerapalayam,AHS SOZHATHARAM,"AHS SOZHATHARAM, SETHIYATOPE MAIN ROAD, SRIMUSHNAM TALUK, CUDDALORE DISTRICT",608701
3505,CUDDALORE,Keerapalayam,AIDED MIDDLE SCHOOL- PANNAPATTU,Pannapattu & PostChidambaram Taluk,608201
3506,CUDDALORE,Keerapalayam,AIDED MIDDLE SCHOOL- POONTHOTTAM,"poonthottam,vakkur post,chidambaram t.kcuddalore d.t",608201
3507,CUDDALORE,Keerapalayam,"AIDED-RASAMBAL ACHI MIDDLE SCHOOL, PONNAKOIL","Ponnankoil, Paradhur post chidambaram T.k",608201
3508,CUDDALORE,Keerapalayam,AIDED-SACRED HEART HIGHER SECONDARY SCHOOL- VADAKUPALAYAM,VADAKKUPALAYAMCUDDALORE,608701
3509,CUDDALORE,Keerapalayam,AIDED-ST.LOURDE'S MIDDLE SCHOOL- SILUVAIPURAM,"Vayalur post, Chidambaram (T.k)",608002
3510,CUDDALORE,Keerapalayam,AIDED-ST.MARY'S MIDDLE SCHOOL- VALISAPET,"St.mary's middle School,valispet, Ramapuram (po),srimushnam(Tk),cuddalore(dt).",608701
3511,CUDDALORE,Keerapalayam,AIDED-VALLALAR AIDED MIDDLE SCHOOL- PUDHUPETTAI,"Ayyanur maion road, pudupettaiAkkaramangalam post",608201
3512,CUDDALORE,Keerapalayam,AMS ENNANAGARAM,ENNANAGARAMENNANAGARAM POST,608602
3513,CUDDALORE,Keerapalayam,AMS GOVINDANALLUR,"AMS GOVINTHANALLUR, PUDAIYUR (PO), SRIMUSHNAM TALUK, CUDDALORE DISTRICT",608701
3514,CUDDALORE,Keerapalayam,AMS THANDESWARANALLUR,"KUMBAKONAM MAIN ROAD,
THANDEWARANALLUR,VATTATHUR(PO), SHRIMUSHNAM(TK), CUDDALORE DISTRICT.",608702
3515,CUDDALORE,Keerapalayam,ATHENA GLOBAL SCHOOL,ThunisirameduChidambaram,608001
3516,CUDDALORE,Keerapalayam,GOVERNMENT HIGH SCHOOL- C.VEERASOLAGAN,C.VEERASOZHAGANCHIDAMBARAM,608602
3517,CUDDALORE,Keerapalayam,GOVERNMENT HIGH SCHOOL- K.ADOOR,Sivan kovil Street\K.Adoor,608602
3518,CUDDALORE,Keerapalayam,GOVERNMENT HIGH SCHOOL- MAZHAVARAYANALLUR,"GHS MAZHAVARAYANALLUR, KUMARAKUDI POST, SRIMUSHNAM TALUK,
CUDDALORE DIST. 608 702",608702
3519,CUDDALORE,Keerapalayam,GOVERNMENT HIGH SCHOOL- PALAYANKOTTAI,"KEEZH PATHI ,PALAYAMKOTTAI & POST,SRIMUSHANAM TK,CUDDALORE DT",608701
3520,CUDDALORE,Keerapalayam,GOVERNMENT HIGH SCHOOL- PUDAIYUR,GOVT HIGH SCHOOL PUDAIYURPUDAIYUR,608701
3521,CUDDALORE,Keerapalayam,GOVERNMENT HIGH SCHOOL- RAMAPURAM,"GOVT. HIGH SCHOOL, RAMAPURMSRIMUSHNAM TK, CUDDALORE DT",608701
3522,CUDDALORE,Keerapalayam,GOVERNMENT HIGH SCHOOL- SAKKANKUDI,"main road, \sakkangudi",608201
3523,CUDDALORE,Keerapalayam,GOVERNMENT HIGH SCHOOL- VEYYALORE,"GOVT. HIGH SCHOOL - VEYYALOREVAZHAKOLLAI POST,",608702
3524,CUDDALORE,Keerapalayam,GOVERNMENT HIGH SCHOOL- VILAGAM,MAIN ROAD VILAGAM,608707
3525,CUDDALORE,Keerapalayam,GOVERNMENT HIGH SCHOOL-KEERAPALAYAM,"MAIN ROAD,
KEERAPALAYAM, CHIDAMBARAM TK",608602
3526,CUDDALORE,Keerapalayam,GOVERNMENT HIGHER SECONDARY SCHOOL- KANUR,KUDALAIYATHUR MAIN ROADKANUR,608701
3527,CUDDALORE,Keerapalayam,"GOVERNMENT HIGHER SECONDARY SCHOOL, T.NEDUNCHERI",Vilagam Main RoadT. Neduncheri,608305
3528,CUDDALORE,Keerapalayam,"KAMARAJ INTERNATIONAL CBSE SCHOOL,VAYALUR.","111/1, Vayalur",608602
3529,CUDDALORE,Keerapalayam,"KAMARAJ MATRIC HIGHER SECONDARY SPECIAL SCHOOL, VAYALUR",VAYALURCHIDAMBARAM,608602
3530,CUDDALORE,Keerapalayam,KARUPASAMY VIDYALAYA MATRICULATION SCHOOL,"1/63, MAIN ROAD,ORAUR POST.",
3531,CUDDALORE,Keerapalayam,PANCHAYAT UNION MIDDLE SCHOOL- C.MELAVANNIYUR,"C.MELAVANNIYURPILLAI STREET, C.MELAVANNIYUR
,ENNANAGARAM POST CHIDAMBARAM TALUK",608602
3532,CUDDALORE,Keerapalayam,PANCHAYAT UNION MIDDLE SCHOOL- KALIYAMALAI,"PUMS KALIYAMALAI, T.VIRUTHAGAN-P.O.
KATTUMANNARKOIL TK.",608305
3533,CUDDALORE,Keerapalayam,PANCHAYAT UNION MIDDLE SCHOOL KANTHAKUMARAN,"PUMS,KANDAKUMARAN, KANDAKUMARAN(PO),KATTUMANNARKOIL(TK)-608305",608305
3534,CUDDALORE,Keerapalayam,"PANCHAYAT UNION MIDDLE SCHOOL, ALLUR","PUMS ALLUR, CHIDAMBARAM MAIN ROAD,
SETHIYATHOPE (PO), CHIDHAMBARAM TALUK, CUDDALORE DISTRICT.",608702
3535,CUDDALORE,Keerapalayam,"PANCHAYAT UNION MIDDLE SCHOOL, AYYANUR",AYYANUR AKKARAMANGALAM.POST CHIDAMBARAM TK,608201
3536,CUDDALORE,Keerapalayam,"PANCHAYAT UNION MIDDLE SCHOOL, KAVALAKUDI","MAIN ROAD, KAVALAGUDI & post, KEERAPALAYAM (BLOCK)  608702",608702
3537,CUDDALORE,Keerapalayam,"PANCHAYAT UNION MIDDLE SCHOOL, KEEZHANATHAM",K ADOOR POSTCHIDAMBARAM TALUK,608602
3538,CUDDALORE,Keerapalayam,"PANCHAYAT UNION MIDDLE SCHOOL, KILLIYANUR","panchayat union middle schoolkiliyanur, orathur(p.o), chidambaram",608201
3539,CUDDALORE,Keerapalayam,"PANCHAYAT UNION MIDDLE SCHOOL, KOODALAIYATHUR",KAVALAKUDI POST SRIMUSHNAM TALUK CUDDALORE DT 608702,608702
3540,CUDDALORE,Keerapalayam,"PANCHAYAT UNION MIDDLE SCHOOL, MADURANTHAGANALLUR",PUMS MADHURANTHAGANALLUR-608201,608201
3541,CUDDALORE,Keerapalayam,"PANCHAYAT UNION MIDDLE SCHOOL, ODDAKANALLUR",PUMS .ODAKKANALLURPUMS ODAKKANALLUR,608201
3542,CUDDALORE,Keerapalayam,"PANCHAYAT UNION MIDDLE SCHOOL, PARATHUR SAVADI","PARATHUR SAVADIORATHUR POST, CHIDAMBARAM
.TK",608201
3543,CUDDALORE,Keerapalayam,"PANCHAYAT UNION MIDDLE SCHOOL, PERUR",PERUR POST SRIMUSHNAM TALUK CUDDALORE DT 608701,608701
3544,CUDDALORE,Keerapalayam,"PANCHAYAT UNION MIDDLE SCHOOL, THERKUPALAYAM",srimushnam (T.k)cuddalore (D.t),608701
3545,CUDDALORE,Keerapalayam,"PANCHAYAT UNION MIDDLE SCHOOL, VADAHARIRAJAPURAM",MIDDLE STREETVADAHARIRAJAPURAM,608602
3546,CUDDALORE,Keerapalayam,"PANCHAYAT UNION MIDDLE SCHOOL, VALASAKADU",pumschool\Valasakkadu PO,608701
3547,CUDDALORE,Keerapalayam,"PANCHAYAT UNION MIDDLE SCHOOL, VAZHAIKKOLLAI",NEAR ANGALAMMAN KOIL VAZHAIKKOLLAI,608702
3548,CUDDALORE,Keerapalayam,RBM MATRICULATION SCHOOL,"MAIN ROAD,NANDHEESHWARAMANGALAM AND POSTSRIMUSHNAM TALUK,CUDDALORE DISTRICT",608702
3549,CUDDALORE,Keerapalayam,"S.D.SION MATRICULATION HIGHER SECONDARY SCHOOL, BOOTHANGUDI",PAZHVAIKAL K M KOIL ROADSETHIYATHOPE,608702
3550,CUDDALORE,Keerapalayam,"SHRI SAI VIDHYASHARAM CBSE SCHOOL, KANNANGUDI","Sai Garden, Muthunagar extn, Kannankudi main road",608602
3551,CUDDALORE,Keerapalayam,SRI VIJAYA MAT. PALAYANKOTTAI,SRIMUSHNAM TKCUDDALORE DT,608703
3552,CUDDALORE,Keerapalayam,"THIRUVALLUVAR HIGHER SECONDARY SCHOOL , ORATHUR","123, R.S.NO.80/2, MAIN ROAD, ORATHUR & PO, CHIDAMBARAM TK, CUDDALORE DT - 608201",608201
3553,CUDDALORE,Kumaratchi,"A.R.G ACADEMY MATRICULATION HIGHER SECONDARY SCHOOL,ANNAMALAI NAGAR","7TH CROSS STREET, K R M NAGAR,ANNAMALAI NAGAR,CHIDAMBARAM.608002",608002
3554,CUDDALORE,Kumaratchi,ADWHS M.KOLAKKUDI,GOVT ADW HIGH SCHOOLMA KOLAKUDI,608301
3555,CUDDALORE,Kumaratchi,ADWMS- VARAHOOR,"VARAHOOR, J.K. PATTINAM POST, CHIDAMBARAM TK",608002
