S NO,DISTRICT,BLOCK NAME,SCHOOL NAME,SCHOOL ADDRESS,PINCODE
24022,VIRUDHUNAG,Virudhunagar,GHSS CHATRAREDDIAPATTI,GOVT HR SEC SCHOOL CHATRAREDDIAPATTI,626002
24023,VIRUDHUNAG,Virudhunagar,"GHSS, AVUDAIYAPURAM","PRIMARY HEALTH CENTER ROAD,AVUDAIYAPURAM",626204
24024,VIRUDHUNAG,Virudhunagar,"GHSS, METTUKUNDU",ghssmettukundu,626004
24025,VIRUDHUNAG,Virudhunagar,"GHSS, NADUVAPATTI","THIRU RAMAMOORTHY GHSS,NADUVAPATTI",626203
24026,VIRUDHUNAG,Virudhunagar,"GHSS, SANKARALINGAPURAM",Sankaralingapuram\sankaralingapuram,626199
24027,VIRUDHUNAG,Virudhunagar,"GHSS, VEERARPATTI APPAYANAYAKENPATTI",Appayananayakenpatti PostRR Nagar Via,626204
24028,VIRUDHUNAG,Virudhunagar,"GOVERNMENT HIGHER SECONDARY SCHOOL, MEESALUR","TAS GOVT.HR,SEC,SCHOOL., MEESALUR  TAS GOVT.HR,SEC,SCHOOL., MEESALUR",626003
24029,VIRUDHUNAG,Virudhunagar,GOVT HR SEC SCHOOL THIYAGARAJAPURAM - MODEL,THIYAGARAJAPURAMVIRUDHUNAGAR,626189
24030,VIRUDHUNAG,Virudhunagar,HAJEE P SYED M HSS VIRUDHUNAGAR,"31, KRISHNAMACHARY ROAD VIRUDHUNAGAR",626001
24031,VIRUDHUNAG,Virudhunagar,HAJEE P SYED MM SCHOOL VIRUDHUNAGAR,"54, PARAPATTI STREET,",626001
24032,VIRUDHUNAG,Virudhunagar,"HINDU MIDDLE SCHOOL, KADAMBANKULAM",KADAMBANKULAM/ METTUKUNDU POST,626004
24033,VIRUDHUNAG,Virudhunagar,"HINDU MIDDLE SCHOOL, P.KUMARALINGAPURAM","P.KUMARALINGAPURAM, VALLIYUR-POST, VIRUDHUNAGAR-DISTRICT.",626005
24034,VIRUDHUNAG,Virudhunagar,K KAMARAJ VIDHYASALA MS VIRUDHUNAGAR,"4, Katchery Road, VIRUDHUNAGAR",626001
24035,VIRUDHUNAG,Virudhunagar,"K.C.S.DHANUSHKODI NADAR  MUNICIPAL MIDDLE SCHOOL,VIRUDHUNAGAR",ROSALPATTI ROADVIRUDHUNAGAR,626001
24036,VIRUDHUNAG,Virudhunagar,KGHSS VIRUDHUNAGAR,"52, KRISHNAMACHARI ROADVIRUDHUNAGAR.",626001
24037,VIRUDHUNAG,Virudhunagar,KGMS VIRUDHUNAGAR,"32,animuthu pillaiyar koil street",626001
24038,VIRUDHUNAG,Virudhunagar,KKSSN MEMORIAL MIDDLE SCHOOL ROSALPATTI,"1/71 KKSSN NAGAR ,ROSALPATTI,VIRUDHUNAGAR",626001
24039,VIRUDHUNAG,Virudhunagar,"KPMJHS HOWA BIBI MS, VIRUDHUNAGAR","KPMJHS HOWVA BIBI MIDDLE SCHOOL 79,Ahamed Nagar,VIRUDHUNAGAR",626001
24040,VIRUDHUNAG,Virudhunagar,"KSHATRIYA VIDHYASALA CENTENARY SCHOOL, VIRUDHUNAGAR",RAMAMOORTHY ROADNear to Govt Hospital,626001
24041,VIRUDHUNAG,Virudhunagar,"KSHATRIYA VIDHYASALA ENGLISH MEDIUM SCHOOL , KOORAIKUNDU",OPPOSITE TO COLLECTORATE\VIRUDHUNAGAR,626002
24042,VIRUDHUNAG,Virudhunagar,KVS HSS VIRUDHUNAGAR,104 MADURAI ROADKATCHRAI ROAD,626001
24043,VIRUDHUNAG,Virudhunagar,"KVS MATRICULATION HSS SCHOOL, VIRUDHUNAGAR",OPPOSITE TO COLLECTORATEVIRUDHUNAGAR,626002
24044,VIRUDHUNAG,Virudhunagar,"KVS MIDDLE SCHOOL, SENGUNDRAPURAM","KVS middle School, Sengundrapuram",626103
24045,VIRUDHUNAG,Virudhunagar,"KVS MIDDLE SCHOOL, VIRUDHUNAGAR","4/Katcheri Road,near old bus stand,",626001
24046,VIRUDHUNAG,Virudhunagar,MCNUPDA HSS M.CHINNAIYAPURAM,"M..C.N.U.P.DEVASAKAYAM ANNATHAYAMMAL HR.SEC.SCHOOL M.CHINNAIAHPURAM, K.G.KOVIL POST",626204
24047,VIRUDHUNAG,Virudhunagar,"MSPN MUNICIPAL MIDDLE SCHOOL, VIRUDHUNAGAR",30/152/SMG SCHOOL STREET,626001
24048,VIRUDHUNAG,Virudhunagar,"MUNICIPAL MIDDLE SCHOOL, SIVAN KOVIL ST, VIRUDHUNAGAR",sivan kovil streetwest car street,626001
24049,VIRUDHUNAG,Virudhunagar,"MUNICIPAL MIDDLE SCHOOL,RAMAMOORTHY ROAD","MUNICIPAL MIDDLE SCHOOL RAMAMOORTHY ROAD ,F
.F  ROAD, VNR.",626001
24050,VIRUDHUNAG,Virudhunagar,"MUNICIPAL MUSLIM MIDDLE SCHOOL, VIRUDHUNAGAR",pavali roadVIRUDHUNAGAR,626001
24051,VIRUDHUNAG,Virudhunagar,P.S.T.M.SEVENTH DAY ADVENTISTS MATRIC HSS VIRUTHUNAGAR,"Mallanginar  Road, VirudhunagarMallanginar  Road, Virudhunagar",626001
24052,VIRUDHUNAG,Virudhunagar,PUMS KUPPAMPATTI,kuppampatti/pattampudur post,626003
24053,VIRUDHUNA GAR,Virudhunagar,PUMS KUPPAMPATTI,kuppampatti/pattampudur post,
24054,VIRUDHUNAG,Virudhunagar,PUMS MARULOOTHU,"PUMS,Maruloothu\Inam Reddiapatti PO,VNR",626003
24055,VIRUDHUNAG,Virudhunagar,PUMS O.KOVILPATTI,pums o kovilpattisankaralingapuram po virudhunagar dist,626119
24056,VIRUDHUNAG,Virudhunagar,PUMS THADANGAM,PUMS THADANGAM R.R.NAGAR VIRUDHUNAGAR - 626204,626204
24057,VIRUDHUNA GAR,Virudhunagar,PUMS THADANGAM,PUMS THADANGAM R.R.NAGAR VIRUDHUNAGAR - 626204,
24058,VIRUDHUNAG,Virudhunagar,"PUMS, THATHAMPATTI",PUMS THATHAMPATTI.MEESALOOR POST. VIRUDHUNAGAR,626003
24059,VIRUDHUNAG,Virudhunagar,"PUMS,A.PUDHUPATTI",pums   a.pudupattiA. Pudupatti (Post)  RR Nagar via,626204
24060,VIRUDHUNAG,Virudhunagar,"PUMS,CHINNAMOOPANPATTI",PUMS ChinnamoopanpattiVadamalaikurichi post,626001
24061,VIRUDHUNAG,Virudhunagar,"PUMS,MOOLIPATTI",Moolipatti PoAmathur Via,626005
24062,VIRUDHUNAG,Virudhunagar,"PUMS,PELAMPATTI","PUMS PELAMPATTI, NEW RAILWAY COLONY,VIRUDHUNAGAR",626001
24063,VIRUDHUNAG,Virudhunagar,"RAMCO VIDYALAYA, R.R.NAGAR","RAMASAMY RAJA NAGAR,VACHAKARAPATTI VILLAGE,VIRUDHUNAGAR DISTRICT,TAMILNADU",626204
24064,VIRUDHUNAG,Virudhunagar,"RAO BAHADUR MSPS MUNICIPAL HIGH SCHOOL, VIRUDHUNAGAR","MUTHURAMANPATTI,VIRUDHUNAGAR",626001
24065,VIRUDHUNAG,Virudhunagar,RC HSS VIRUDHUNAGAR,R.C.Hr.Sec.SchoolArockia nagar.,626001
24066,VIRUDHUNAG,Virudhunagar,"SARASWATHI AMMAL LIONS MATRICULATON SCHOOL, VIRUDHUNAGAR","89/10, Aruppukottai Road,Virudhunagar",626001
24067,VIRUDHUNAG,Virudhunagar,SFS MAT SCHOOL,SFS MAT SCHOOL,626001
24068,VIRUDHUNAG,Virudhunagar,"SHRI VISHWAKARMA SEVA VIDYALAYA, VIRUDHUNAGAR",MUTHUMARIAMMAN KOVIL NEARGANDHI NAGAR,626001
24069,VIRUDHUNAG,Virudhunagar,SMG MUNICIPAL MS VIRUDHUNAGAR,smg mpl ms virudhunagar\thantimara street.smg mpl ms virudhunagar,626001
24070,VIRUDHUNAG,Virudhunagar,SOWDAMBIGAI HSS  VIRUDHUNAGAR,MUTHURAMAN STREETALLAMPATTI,626001
24071,VIRUDHUNAG,Virudhunagar,"SRI VIDHYA MATRICULATION SCHOOL, P.KUMARALINGAPURAM",ALAGAPURI MAIN ROADVIRUDHUNAGAR,626005
24072,VIRUDHUNAG,Virudhunagar,"SSSN GOVT HR SEC SCHOOL, VIRUDHUNAGAR",Near G HMallankinaru road,626001
24073,VIRUDHUNAG,Virudhunagar,ST.XAVIER'S HS K.PUDUR,ST.XAVIER HIGH SCHOOLT.AMMAPATTI,626204
24074,VIRUDHUNAG,Virudhunagar,SVA MS VIRUDHUNAGAR,"52, Gurunathan Kovil Street, Virudhunagar",626001
24075,VIRUDHUNAG,Virudhunagar,TELC MS VIRUDHUNAGAR,TELC  MIDDLE SCHOOLPERIYA KALIAMMAN KOVIL STREET VIRUDHUNAGAR,626001
24076,VIRUDHUNAG,Virudhunagar,"THIRUVALLUVAR VIDHYASALA MIDDLE SCHOOL, VIRUDHUNAGAR",117&119 PULUGANURANI ROADNEAR OLD BUS STAND,626001
24077,VIRUDHUNAG,Virudhunagar,"TPNM GIRLS HIGHER SECONDARY SCHOOL, VIRUDHUNAGAR",COLLEGE ROADVIRUDHUNAGAR,626001
24078,VIRUDHUNAG,Virudhunagar,"VIRUDHUNAGAR MATRICULATION SCHOOL, VIRUDHUNAGAR",VMS TTKIRSHNAMACHARI ROADVIRUDHUNAGAR,626001
24079,VIRUDHUNAG,Virudhunagar,VKMJHSHB GIRLS HR SEC SCHOOL,"158,SEETHAKATHI STREET,VIRUDHUNAGAR",626001
24080,VIRUDHUNAG,Virudhunagar,"VMGRR SARADHA SM HSS, VIRUDHUNAGAR","89-A, RAMAMOORTHY ROAD,VIRUDHUNAGAR",626001
24081,VIRUDHUNAG,Virudhunagar,"VPP HIGHER SECONDARY SCHOOL, Virudhunagar",POUND STREETMUTHURAMANPATTI,626001
24082,VIRUDHUNAG,Virudhunagar,"WISDOM WEALTH INTERNATIONAL SCHOOL, MARULOOTHU","SATTUR VIRUTHUNAGAR HIGHWAY, VAIPUTTANPATTI VILLAGE, INAMREDDIYAPATTI po",626003
24083,VIRUDHUNAG,Watrap,"G.H.S, THULUKKAPATTI","GOVT HIGH SCHOOL, THULUKKAPATTI.SRIVILLIPUTTUR TALUK.",626149
24084,VIRUDHUNAG,Watrap,"GHS, AYANKARISALKULAM",GHS AYANKARISALKULAM - 33260804804GHS AYANKARISALKULAM 33260804804,626149
24085,VIRUDHUNAG,Watrap,"GHS, KEELAKOTTAIYUR",KEELAKOTTAIYURMAHARAJAPURAM POST,626149
24086,VIRUDHUNAG,Watrap,"GHS, SEELNAICKANPATTI",kadaneri poVirudhunagar Dt,626149
24087,VIRUDHUNAG,Watrap,"GOVERNMENT GIRLS HIGHER SECONDARY SCHOOL, KOOMAPATTI","DAM ROAD
KOOMAPATTI - PO WATRAP - TK",626133
24088,VIRUDHUNAG,Watrap,"GOVERNMENT HIGHER SECONDARY SCHOOL, KOOMAPATTI","DAM ROAD, KOOMAPATTI",626133
24089,VIRUDHUNAG,Watrap,"GOVERNMENT HIGHER SECONDARY SCHOOL, MAHARAJAPURAM",GOVT HR SEC SCHOOL MAHARAJAPURAM,626149
24090,VIRUDHUNAG,Watrap,"GOVERNMENT HIGHER SECONDARY SCHOOL, MELAGOPALAPURAM",GHSS MELAGOPALAPURAMSESHAPURAM -PO,626116
24091,VIRUDHUNAG,Watrap,"GOVERNMENT HIGHER SECONDARY SCHOOL, S.AMMAPATTI",GOVERNMENT HIGHER SECONDARY SCHOOL S.AMMAPATTI,626138
24092,VIRUDHUNAG,Watrap,"GOVERNMENT HIGHER SECONDARY SCHOOL, SUNDARAPANDIAM",GHSS SUNDARAPANDIAM,626126
24093,VIRUDHUNAG,Watrap,"GOVERNMENT HIGHER SECONDARY SCHOOL, THAILAPURAM",ThailapuramThailapuram,626149
24094,VIRUDHUNAG,Watrap,Govt A.D.W.MIDDLE SCHOOL AGASAMPATTI,"G.A.D.W.M.S AGASAMPATTI, WATRAP",626132
24095,VIRUDHUNAG,Watrap,"GOVT ADW HIGH SCHOOL, KOTTAIYUR","GOVT ADW HIGH SCHOOL, KOTTAIYUR",626149
24096,VIRUDHUNAG,Watrap,HINDU (G)H.S.WATRAP,"2, CHATTIRAM STREET,WATRAP",626132
24097,VIRUDHUNAG,Watrap,HINDU H.S.S.  WATRAP,"1, Chathiram street, watrap",626132
24098,VIRUDHUNAG,Watrap,"KALAIMAGAL HSS, S.RAMACHANDRAPURAM","304 KALAIMAGAL STREET, S.RAMACHANDRAPURAM
626 126.",626126
24099,VIRUDHUNAG,Watrap,"KAMARAJ M.S, KUNNUR","Main road, kunnur",626138
24100,VIRUDHUNAG,Watrap,"LINGA GLOBAL SCHOOL.,KRISHNANKOVIL","Anand Nagar, Krishnan koil - 626126.",626126
24101,VIRUDHUNAG,Watrap,NADAR H.S.S  WATRAP,MAINROADWATRAP PO,626132
24102,VIRUDHUNAG,Watrap,P U M S KUNNUR,"Kalyanipuram road,  KunnurSrivilliputhur",626138
24103,VIRUDHUNAG,Watrap,P.U.M.S KANSAPURAM,"METTU STREET,KHANSAPURAM",626133
24104,VIRUDHUNAG,Watrap,P.U.M.S MATHUR,PUMS MATHURMAHARAJAPURAM POST,626142
24105,VIRUDHUNAG,Watrap,P.U.M.S MEENAKSHIPURAM,GOPALAPURAM MAINSESHAPURAM P.O.,626116
24106,VIRUDHUNAG,Watrap,P.U.M.S SETHUNARAYANAPURAM,PUMS SETHUNARAYANAPURAM,626132
24107,VIRUDHUNAG,Watrap,P.U.M.S.NEDUNKULAM,"PUMS NEDUNGULAM,KOOMAPATTI (POST)",626133
24108,VIRUDHUNAG,Watrap,P.U.M.S.THAMBIPATTI,ALAGAPURI MAIN ROAD\THAMBIPATTI,626149
24109,VIRUDHUNAG,Watrap,R.C M.S W.PUDUPATTI,"christian petta road,W.Pudhupatti",626116
24110,VIRUDHUNAG,Watrap,"R.C.HS.,AYANNATHAMPATTI",RC STREETSRIVILLIPUTTUR TALUK,626138
24111,VIRUDHUNAG,Watrap,"RANGARAO LIONS GIRLS MATRICULATION SCHOOL, WATRAP",99 Agraharam south streetWatrap,626132
24112,VIRUDHUNAG,Watrap,"RANGARAO LIONS MATRICULATION HR. SEC SCHOOL, MAHARAJAPURAM","9/142A1, Near Anjaneyar Temple, Alagapuri Road, Maharajapuram, Watrap (TK).",626149
24113,VIRUDHUNAG,Watrap,"SRI RENUGA HINDU HIGH SCHOOL, W.PUDHUPATTI",KANSAAPURAM ROADW.PUDUPATTI,626116
24114,VIRUDHUNAG,Watrap,T.E.L.C .M.S.RAMASAMIPURAM,"TELC MS RAMASAMIAPURAM, KOOMAPATTI",626133
24115,VIRUDHUNAG,Watrap,"VIVEKANANTHA VIDYA MANDIR.,AKKANAPURAM","2/126, Watrap - Alagapuri roadAkkanapuram",626149
